Grant - UrbanBrain,https://www.crunchbase.com/funding_round/urbanbrain-grant--39563f3b,UrbanBrain,https://www.crunchbase.com/organization/urbanbrain,Grant,700000,INR,9482,2021-09-27,,,,,No,UrbanBrain is building an AI-powered Smart Traffic Light system to tackle congestion in Indian cities.,Artificial Intelligence (AI),http://www.urbanbrain.io/,,"Portland, Oregon, United States, North America",,700000,INR,9482,,1,iTIC Incubator at IIT Hyderabad,iTIC Incubator at IIT Hyderabad,1,,"228,145"
Pre Seed Round - Bloop.ai,https://www.crunchbase.com/funding_round/bloop-ai-pre-seed--8b6b2a5d,Bloop.ai,https://www.crunchbase.com/organization/bloop-ai,Pre-Seed,125000,USD,125000,2021-08-31,Seed,,,,Yes,Bloop.ai is an extension for a code editor that surfaces code examples from each library’s official documentation.,"Artificial Intelligence (AI), Computer, Software",https://bloop.ai/,,"London, England, United Kingdom, Europe",,125000,USD,125000,Seed,1,,"Matilde Giglio, Y Combinator",2,,"383,921"
Convertible Note - Deephound,https://www.crunchbase.com/funding_round/deephound-convertible-note--472d671a,Deephound,https://www.crunchbase.com/organization/deephound,Convertible Note,100000,GBP,141560,2021-06-01,,8000000,GBP,11324788,No,"Deephound is an augmented intelligence agency that specializes in AI, technology, and data development.","Artificial Intelligence (AI), B2B, Big Data, Business Intelligence, InsurTech, Legal Tech",https://deephound.co,,"London, England, United Kingdom, Europe",Less than $1M,367630,USD,367630,,3,,,,,"384,197"
Grant - Sign-Speak,https://www.crunchbase.com/funding_round/sign-speak-grant--f287eeda,Sign-Speak,https://www.crunchbase.com/organization/sign-speak,Grant,30000,USD,30000,2021-09-16,,,,,No,"Sign-Speak develops automatic, real-time captioning and ASL to English interpreting services via an online platform and mobile application.","Artificial Intelligence (AI), Information Technology, Machine Learning, SaaS",https://www.sign-speak.com,"Black Founded, Hispanic / Latine Founded, Hispanic / Latine Led, Women Founded","Rochester, New York, United States, North America",Less than $1M,350000,USD,350000,,7,,"Hispanics in Philanthropy, Women Who Tech",2,1,"229,124"
Pre Seed Round - Smart.Reviews,https://www.crunchbase.com/funding_round/smart-reviews-pre-seed--081133d1,Smart.Reviews,https://www.crunchbase.com/organization/smart-reviews,Pre-Seed,50000,USD,50000,2021-06-08,Seed,,,,Yes,AI Powered Reviews platform aimed to cater to businesses worldwide that have an online presence.,"Artificial Intelligence (AI), Internet",https://smart.reviews/,,"London, England, United Kingdom, Europe",,590000,USD,590000,Seed,9,,,,,"384,660"
Series A - SellGone,https://www.crunchbase.com/funding_round/sellgone-series-a--0b80f70b,SellGone,https://www.crunchbase.com/organization/sellgone,Series A,150000,USD,150000,2021-08-01,Early Stage Venture,30000000,USD,30000000,Yes,SellGone is an e-Commerce company that helps small businesses and people to sell their products online through AI and machine learning.,"Artificial Intelligence (AI), E-Commerce, Information Technology, Machine Learning, Mobile Apps, Software, Web Design",https://www.vistacoders.com/,,"Reno, Nevada, United States, North America",Less than $1M,150000,USD,150000,Early Stage Venture,1,,,,,"533,517"
Seed Round - Makes.ai,https://www.crunchbase.com/funding_round/makes-ai-seed--e3abdc4f,Makes.ai,https://www.crunchbase.com/organization/makes-ai,Seed,350000,BRL,67487,2021-09-01,Seed,3000000,BRL,578458,Yes,AI Solutions to Help Companies Grow.,"Analytics, Artificial Intelligence (AI), Computer Vision, Consulting, CRM, Machine Learning, Natural Language Processing, Software",https://makes.ai/,,"Goiânia, Goias, Brazil, South America",,660000,BRL,127134,Seed,5,,Igor Cruz,1,,"387,416"
Pre Seed Round - Laudite,https://www.crunchbase.com/funding_round/laudite-pre-seed--40ab8800,Laudite,https://www.crunchbase.com/organization/laudite,Pre-Seed,300000,BRL,51962,2021-03-30,Seed,6000000,BRL,1039231,Yes,"Optimized speech recognition, artificial intelligence and several other features focused on productivity and quality for medical reports.","Artificial Intelligence (AI), Health Care, Natural Language Processing",http://www.laudite.com.br,,"Salgado, Bahia, Brazil, South America",,500000,BRL,89216,Seed,2,,,,,"361,073"
Angel Round - Solydaria,https://www.crunchbase.com/funding_round/solydaria-angel--59699e5c,Solydaria,https://www.crunchbase.com/organization/solydaria,Angel,200000,USD,200000,2021-12-15,Seed,,,,Yes,Solydaria revolutionizes how shoppers benefit from their data,"Artificial Intelligence (AI), Blockchain, Consumer, Marketing, Retail Technology",https://solydaria.co,,"New York, New York, United States, North America",,200000,USD,200000,Seed,1,,,,,"387,706"
Seed Round - SeeVC,https://www.crunchbase.com/funding_round/seevc-seed--13616066,SeeVC,https://www.crunchbase.com/organization/seevc,Seed,100000,USD,100000,2021-01-25,Seed,,,,Yes,SeeVC is a platform that leverages artificial intelligence (AI) to build products for education.,"Artificial Intelligence (AI), Education",,,"Delhi, Delhi, India, Asia",,100000,USD,100000,Seed,1,,Jimmy Singh,1,,"573,969"
Grant - Neurocreate,https://www.crunchbase.com/funding_round/neurocreate-grant--cb0a7e42,Neurocreate,https://www.crunchbase.com/organization/neurocreate,Grant,24689,GBP,33712,2021-11-01,,,,,No,NeuroCreate's AI-driven neuroscience-designed platform augments creativity and enhances mental health,"Artificial Intelligence (AI), Data Visualization, Digital Media, Health Care, Human Computer Interaction, Information Technology, Machine Learning, Mental Health, Personal Health, Serious Games",https://www.neurocreate.co.uk,,"London, England, United Kingdom, Europe",,174689,GBP,229377,Seed,5,,,,,"363,085"
Grant - Brightseed,https://www.crunchbase.com/funding_round/brightseed-grant--5e2d38dc,Brightseed,https://www.crunchbase.com/organization/brightseed,Grant,200000,USD,200000,2021-11-04,,,,,No,Brightseed uses artificial intelligence and machine learning to discover the potential of plant compounds for various applications.,"Artificial Intelligence (AI), Biotechnology, Food and Beverage, Pharmaceutical, Wellness",https://brightseedbio.com,"Hispanic / Latine Founded, Women Founded","San Francisco, California, United States, North America",$1M to $10M,120800000,USD,120800000,Early Stage Venture,7,,Bill & Melinda Gates Foundation,1,,"363,286"
Seed Round - Eco City,https://www.crunchbase.com/funding_round/eco-city-seed--5ba6caae,Eco City,https://www.crunchbase.com/organization/eco-city,Seed,10250,USD,10250,2021-06-01,Seed,5000000,USD,5000000,Yes,Eco City develops new automation for the cleaning industry.,"Artificial Intelligence (AI), CleanTech, Machine Learning, Mobile Apps, Robotics, Service Industry, Smart Cities",,,"Baku, Baki, Azerbaijan, Asia",,10250,USD,10250,Seed,1,,,,,"379,309"
Pre Seed Round - Stattus4,https://www.crunchbase.com/funding_round/stattus4-pre-seed--f84b5e96,Stattus4,https://www.crunchbase.com/organization/stattus4,Pre-Seed,100000,USD,100000,2021-08-09,Seed,2000000,USD,2000000,Yes,Focused on applied technology to preserve what matters: water,"Artificial Intelligence (AI), CleanTech, Smart Cities, Sustainability",https://stattus4.com/,,"Sorocaba, Sao Paulo, Brazil, South America",Less than $1M,746488,USD,746488,Seed,4,,Synthase Impact Ventures,1,,"363,921"
Grant - Hot Route Analytics,https://www.crunchbase.com/funding_round/hot-route-analytics-grant--1489dbb9,Hot Route Analytics,https://www.crunchbase.com/organization/hot-route-analytics,Grant,10000,USD,10000,2021-04-26,,,,,No,Hot Route Analytics is a sports analytics company that provides in-depth sports analysis for all aspects of the game.,"Analytics, Predictive Analytics, Software, Sports",https://www.hotrouteanalytics.com,,"Charlotte, North Carolina, United States, North America",Less than $1M,60000,USD,60000,,2,NC IDEA,NC IDEA,1,1,"364,363"
Pre Seed Round - Niricson,https://www.crunchbase.com/funding_round/niricson-pre-seed--154dfdc5,Niricson,https://www.crunchbase.com/organization/niricson,Pre-Seed,150000,USD,150000,2021-04-01,Seed,,,,Yes,Leading the digital revolution for Infrastructure condition assessment and risk management,"Artificial Intelligence (AI), Asset Management, Infrastructure, Predictive Analytics",http://www.niricson.com/,,"Victoria, British Columbia, Canada, North America",$1M to $10M,9463556,USD,9463556,Early Stage Venture,6,,Forward Venture Capital,1,,"364,735"
Pre Seed Round - Alchera Technologies,https://www.crunchbase.com/funding_round/alchera-technologies-pre-seed--98e1f48e,Alchera Technologies,https://www.crunchbase.com/organization/alchera-technologies,Pre-Seed,149998,GBP,207874,2021-09-03,Seed,,,,Yes,Alchera Technologies has a strong and rich pedigree of world-leading machine learning and computer vision sensing technologies,"Computer Vision, Machine Learning",https://www.alcheratechnologies.com,,"London, England, United Kingdom, Europe",$1M to $10M,149998,GBP,207874,Seed,1,,SFC Capital,1,,"371,538"
Grant - Spacept,https://www.crunchbase.com/funding_round/spacept-grant--0730c7ec,Spacept,https://www.crunchbase.com/organization/spacept,Grant,250000,SEK,29130,2021-07-01,,,,,No,Spacept uses artificial intelligence for space data analytics.,"Analytics, Artificial Intelligence (AI), Computer, Information Technology, Software, Telecommunications",https://www.spacept.com/,,"Stockholm, Stockholms Lan, Sweden, Europe",Less than $1M,344597,USD,344597,Seed,4,,,,,"372,468"
Angel Round - Pavo & Tusker Innovations,https://www.crunchbase.com/funding_round/pavo-tusker-angel--3b0e1b33,Pavo & Tusker Innovations,https://www.crunchbase.com/organization/pavo-tusker,Angel,100000,USD,100000,2021-05-01,Seed,,,,Yes,Pavo & Tusker Innovations provides IT consulting and IT services.,"Artificial Intelligence (AI), Computer Vision, Information Technology, Internet",https://www.pavo-tusker.com,,"Chennai, Tamil Nadu, India, Asia",,350000,USD,350000,Seed,4,Ramprasad Subburaman,"Karthikeyan Anbarasan, Ramprasad Subburaman",2,,"650,719"
Seed Round - Syngli,https://www.crunchbase.com/funding_round/syngli-seed--cbe13152,Syngli,https://www.crunchbase.com/organization/syngli,Seed,14000,CAD,11037,2021-09-30,Seed,,,,Yes,Syngli is building an interactive tutoring system to enhance teaching and learning.,"Big Data, E-Learning, Language Learning, Natural Language Processing, Neuroscience, Speech Recognition, Test and Measurement, Tutoring",https://syngli.com/,,"Kitchener, Ontario, Canada, North America",$10M to $50M,619659,USD,619659,Seed,25,,,,,"395,222"
Grant - Ortho AI,https://www.crunchbase.com/funding_round/ortho-ai-grant--3c395190,Ortho AI,https://www.crunchbase.com/organization/ortho-ai,Grant,60000,USD,60000,2021-12-25,,,,,No,Clinical Decision Support System for Orthopedics and Traumatology driven by AI,"Artificial Intelligence (AI), Enterprise Software, Health Diagnostics, Information Technology, Medical, Medical Device",https://orthoai.tech,,"Wilmington, Delaware, United States, North America",,60000,USD,60000,,1,,,,,"395,611"
Angel Round - Kodezi,https://www.crunchbase.com/funding_round/kodezi-angel--61c2b93c,Kodezi,https://www.crunchbase.com/organization/kodezi,Angel,20000,USD,20000,2021-09-18,Seed,,,,Yes,Kodezi is an AI-assisted developer tool focusing on maximizing programming productivity. Their initial product automatically corrects code.,"Artificial Intelligence (AI), EdTech, Education, Enterprise Software, Information Technology, Machine Learning, Natural Language Processing",https://kodezi.com/,"South Asian Founded, Southeast Asian Led","Orlando, Florida, United States, North America",$1M to $10M,1820000,USD,1820000,Seed,3,Eric Fung,Eric Fung,1,,"395,819"
Pre Seed Round - Nephra,https://www.crunchbase.com/funding_round/nephra-pre-seed--8bbe0642,Nephra,https://www.crunchbase.com/organization/nephra,Pre-Seed,70000,USD,70000,2021-05-01,Seed,,,,Yes,Biotechnology Research,"Artificial Intelligence (AI), Biotechnology, Health Care, Machine Learning",https://nephra.ai,,"Champaign, Illinois, United States, North America",,70000,USD,70000,Seed,1,,"Gies College of Business - University of Illinois Urbana-Champaign, iVenture Accelerator, VentureWell",3,,"396,148"
Pre Seed Round - Sage Medical,https://www.crunchbase.com/funding_round/sage-medical-pre-seed--89f176d8,Sage Medical,https://www.crunchbase.com/organization/sage-medical,Pre-Seed,100000,USD,100000,2021-11-23,Seed,1400000,USD,1400000,Yes,Sage Medical is an AI-driven medical coding and billing platform that remedy the gaps in the healthcare coding and billing system.,"Artificial Intelligence (AI), Billing, Health Care",https://www.sagemedical.io,Women Founded,"Denver, Colorado, United States, North America",,100000,USD,100000,Seed,1,EXPERT DOJO,"EXPERT DOJO, Right Side Capital Management",2,1,"375,366"
Pre Seed Round - TreeCloud Technologies,https://www.crunchbase.com/funding_round/treecloud-technologies-pre-seed--5af662ca,TreeCloud Technologies,https://www.crunchbase.com/organization/treecloud-technologies,Pre-Seed,100000,USD,100000,2021-02-12,Seed,,,,Yes,We develop SaaS for Companies and Governments with Artificial Intelligence,"Analytics, Artificial Intelligence (AI), Big Data, Machine Learning, Software",https://treecloud.co,,"San Salvador, San Salvador, El Salvador, North America",,600000,USD,600000,Seed,2,Amazon Web Services,Amazon Web Services,1,,"396,309"
Pre Seed Round - Pivony,https://www.crunchbase.com/funding_round/pivony-inc-pre-seed--a516bfaa,Pivony,https://www.crunchbase.com/organization/pivony-inc,Pre-Seed,55000,USD,55000,2021-05-04,Seed,,,,Yes,Pivony provides a platform that uncovers valuable insights through the vast processing capabilities of artificial intelligence.,"Analytics, Artificial Intelligence (AI), Business Intelligence, Software",https://pivony.com,,"Claymont, Delaware, United States, North America",Less than $1M,55000,USD,55000,Seed,3,,Startup Wise Guys,1,,"376,178"
Seed Round - Bookline,https://www.crunchbase.com/funding_round/bookline-seed--a4fb0879,Bookline,https://www.crunchbase.com/organization/bookline,Seed,200000,EUR,224803,2021-12-17,Seed,,,,Yes,Bookline is a company which offers AI-based conversational bots to manage appointments and bookings over the phone.,"Artificial Intelligence (AI), Information Technology, Machine Learning, Restaurants",https://bookline.io,,"Barcelona, Catalonia, Spain, Europe",,200000,EUR,224803,Seed,1,,"Agustín Martin, Alejandro Martinez Peon, Bergaturi SL, Cristòbal Escoda, Enrique Serrano, Felipe Ojeda, Fernando Oriol, Fernando Ortiz, Guillermo Mercader, Harold Plunkett, Idea Ventura, Juan De Sala, Marc Puig, Pablo Martinez, Puffin Capital, Ramón Casals",16,,"397,871"
Pre Seed Round - deepsearch labs,https://www.crunchbase.com/funding_round/deepsearch-labs-pre-seed--8b5b1ca4,deepsearch labs,https://www.crunchbase.com/organization/deepsearch-labs,Pre-Seed,126999,GBP,169091,2021-11-29,Seed,,,,Yes,DeepSearch Labs is a deep-tech company that specializes in intelligent search engines for industry.,"Artificial Intelligence (AI), Generative AI, SaaS, Search Engine",https://deepsearchlabs.com,,"London, England, United Kingdom, Europe",,126999,GBP,169091,Seed,1,,SFC Capital,1,,"397,960"
Pre Seed Round - Interacshn,https://www.crunchbase.com/funding_round/interacshn-pre-seed--b3ec4964,Interacshn,https://www.crunchbase.com/organization/interacshn,Pre-Seed,25000,USD,25000,2021-09-20,Seed,,,,Yes,Develop AI powered education and government technology products.,"Artificial Intelligence (AI), EdTech, GovTech, Machine Learning, Mobile Apps, Software",https://interacshn.com,,"Kansas City, Missouri, United States, North America",Less than $1M,55000,USD,55000,Seed,2,,,,,"277,026"
Grant - Agro BI by Horos.AI,https://www.crunchbase.com/funding_round/horos-tech-grant--2c1ad072,Agro BI by Horos.AI,https://www.crunchbase.com/organization/horos-tech,Grant,25000,USD,25000,2021-05-10,,,,,No,"Plant-level insights on germination, weed & disease trends based on drone imagery. AI and CV help to manage risks during the season.","Agriculture, AgTech, Artificial Intelligence (AI), Big Data, Business Intelligence, Drones, Machine Learning, Sustainability",https://horos.ai/,,"Kyiv, Kyyiv, Ukraine, Europe",,30000,USD,30000,,2,,Ukrainian Startup Fund,1,,"278,177"
Grant - Elysium,https://www.crunchbase.com/funding_round/ahmed-barkhia-co-grant--2105c298,Elysium,https://www.crunchbase.com/organization/ahmed-barkhia-co,Grant,30000,EUR,35747,2021-04-08,,,,,No,Providing access to historical patient data,"Analytics, Apps, Artificial Intelligence (AI), Big Data, Health Care, Life Science, Machine Learning, mHealth",http://elysium.tech,,"Rome, Lazio, Italy, Europe",$1M to $10M,95000,EUR,112491,Seed,4,,Lazio Innova,1,,"278,426"
Pre Seed Round - TRACKiTT,https://www.crunchbase.com/funding_round/eduro-ai-pre-seed--d8a5a442,TRACKiTT,https://www.crunchbase.com/organization/eduro-ai,Pre-Seed,120000,USD,120000,2021-02-01,Seed,,,,Yes,TRACKiTT is the App Store for manufacturing. Factories are leveraging the TRACKiTT's app speed up their factory digitization,"B2B, Industrial Automation, Internet, Internet of Things, Predictive Analytics, Software",https://www.trackitt.io,,"Toronto, Ontario, Canada, North America",,199021,USD,199021,Seed,3,,Techstars,1,1,"424,047"
Equity Crowdfunding - Bodha Inc,https://www.crunchbase.com/funding_round/bodha-inc-equity-crowdfunding--35ccd512,Bodha Inc,https://www.crunchbase.com/organization/bodha-inc,Equity Crowdfunding,51288,USD,51288,2021-02-01,,4000000,USD,4000000,Yes,"Bodha.ai helps organizations achieve workplace synergy through cognitive analysis, specialized performance support, and AI learning.","Artificial Intelligence (AI), Human Resources, Information Technology, SaaS, Skill Assessment, Software Engineering",https://bodha.ai,Black Founded,"New York, New York, United States, North America",Less than $1M,451288,USD,451288,Seed,3,,Wefunder,1,,"424,166"
Grant - Echoliv,https://www.crunchbase.com/funding_round/echoliv-grant--83e70de8,Echoliv,https://www.crunchbase.com/organization/echoliv,Grant,90000,EUR,106240,2021-09-14,,,,,No,Echoliv develops AI medical-grade in liver ultrasound to assist radiologists and hepatologists.,"Artificial Intelligence (AI), Biotechnology, Health Care, Software",https://echoliv.ai,,"Paris, Ile-de-France, France, Europe",,210000,EUR,230378,Seed,3,,Bpifrance,1,,"279,523"
Convertible Note - Machine Perception,https://www.crunchbase.com/funding_round/machine-perception-convertible-note--6886f628,Machine Perception,https://www.crunchbase.com/organization/machine-perception,Convertible Note,100000,USD,100000,2021-01-15,,,,,No,Machine Perception develops a perception-as-a-service product that provides obstacle detection and safe navigation for autonomous machines.,"Autonomous Vehicles, Machine Learning, Robotics, Sensor",https://www.machineperception.co,,"Newark, California, United States, North America",,100000,USD,100000,,1,Forum Ventures,"Forum Ventures, Right Side Capital Management",2,,"424,570"
Convertible Note - Cyclopt,https://www.crunchbase.com/funding_round/cyclopt-convertible-note--7b0ce1f2,Cyclopt,https://www.crunchbase.com/organization/cyclopt,Convertible Note,160000,EUR,189542,2021-07-08,,,,,No,"A fully automated, Plug & Play, AI-driven Software QA (Quality Assurance).","Artificial Intelligence (AI), Quality Assurance, Software",https://www.cyclopt.com/,,"Thessaloníki, Thessaloniki, Greece, Europe",,380000,EUR,425733,Seed,2,TECS Capital,TECS Capital,1,,"280,715"
Pre Seed Round - Wool & Water,https://www.crunchbase.com/funding_round/wool-water-llc-pre-seed--ed6b421b,Wool & Water,https://www.crunchbase.com/organization/wool-water-llc,Pre-Seed,140000,USD,140000,2021-01-05,Seed,100000,USD,100000,Yes,"Award-winning smart retail tech revolutionizing $1.03T online & $6.1T physical retail with Web3, Metaverse & AI technology.","Artificial Intelligence (AI), Automotive, E-Commerce, E-Commerce Platforms, Metaverse, Retail, Software, Virtual Reality, Web Development, Web3",http://www.woolandwater.co,,"Chicago, Illinois, United States, North America",Less than $1M,140000,USD,140000,Seed,1,MCB Ventures,MCB Ventures,1,,"274,143"
Pre Seed Round - URay,https://www.crunchbase.com/funding_round/uray-pre-seed--be1fbf41,URay,https://www.crunchbase.com/organization/uray,Pre-Seed,140000,USD,140000,2021-07-15,Seed,,,,Yes,AI and photonics based MedTech solutions,"Artificial Intelligence (AI), Hardware, Health Diagnostics, Medical Device, Mobile Apps",https://uray.ai/,,"Singapore, Central Region, Singapore, Asia",,140000,USD,140000,Seed,1,,,,,"274,355"
Pre Seed Round - Vikk AI,https://www.crunchbase.com/funding_round/vikktoria-pre-seed--dcd26aa6,Vikk AI,https://www.crunchbase.com/organization/vikktoria,Pre-Seed,175000,USD,175000,2021-03-04,Seed,7000000,USD,7000000,Yes,Powerful generative AI for legal assistance trained on vast legal sets for USA. Talk to Vikk !,"Apps, Consumer Software, Generative AI, Legal Tech, SaaS",https://vikk.ai,,"Long Beach, California, United States, North America",,375000,USD,375000,Seed,2,,Kevin Tamm,1,,"299,033"
Grant - Harmix,https://www.crunchbase.com/funding_round/harmix-grant--88ff2cfc,Harmix,https://www.crunchbase.com/organization/harmix,Grant,38000,USD,38000,2021-07-06,,,,,No,Harmix is an intelligent service that automatically selects right music for your video.,"Artificial Intelligence (AI), Music, Search Engine",https://www.harmix.ai/,,"Kyiv, Kyyiv, Ukraine, Europe",Less than $1M,538000,USD,538000,,2,"Amazon, Ukrainian Startup Fund","Amazon, Ukrainian Startup Fund",2,,"572,409"
Pre Seed Round - Makes.ai,https://www.crunchbase.com/funding_round/makes-ai-pre-seed--9d7b4998,Makes.ai,https://www.crunchbase.com/organization/makes-ai,Pre-Seed,50000,BRL,8783,2021-04-10,Seed,,,,Yes,AI Solutions to Help Companies Grow.,"Analytics, Artificial Intelligence (AI), Computer Vision, Consulting, CRM, Machine Learning, Natural Language Processing, Software",https://makes.ai/,,"Goiânia, Goias, Brazil, South America",,660000,BRL,127134,Seed,5,,Nayarah Ribeiro,1,,"572,705"
Equity Crowdfunding - Amplio.ai,https://www.crunchbase.com/funding_round/amplio-ai-equity-crowdfunding--dd1252a9,Amplio.ai,https://www.crunchbase.com/organization/amplio-ai,Equity Crowdfunding,76034,USD,76034,2021-11-22,,,,,Yes,Amplio.ai develops an app tool to help companies retain talent.,"Analytics, Apps, Artificial Intelligence (AI), Collaboration",https://www.amplio.ai/,,"Chantilly, Virginia, United States, North America",Less than $1M,503034,USD,503034,Seed,3,Republic,Republic,1,,"275,872"
Pre Seed Round - CShine AI,https://www.crunchbase.com/funding_round/cshine-ai-pre-seed--7ee1816d,CShine AI,https://www.crunchbase.com/organization/cshine-ai,Pre-Seed,50000,USD,50000,2021-11-29,Seed,500000,USD,500000,Yes,Data-driven Intelligence Platform for Creative Business,"Artificial Intelligence (AI), Internet, Software",,,"New York, New York, United States, North America",,50000,USD,50000,Seed,1,,Stealth Mode Venture,1,,"276,500"
Pre Seed Round - DIMA,https://www.crunchbase.com/funding_round/dima-667c-pre-seed--8e3b38d9,DIMA,https://www.crunchbase.com/organization/dima-667c,Pre-Seed,110000,USD,110000,2021-03-15,Seed,,,,Yes,"Corporate data assistant. Derives insights, forecasts and visualizes data in natural language.","Artificial Intelligence (AI), Big Data, Business Intelligence, Data Visualization, Machine Learning, Predictive Analytics",http://dima.website,,"New York, New York, United States, North America",,110000,USD,110000,Seed,1,,Starta VC,1,,"596,280"
Grant - Hollo Limited,https://www.crunchbase.com/funding_round/hollo-limited-grant--fe9f2c9c,Hollo Limited,https://www.crunchbase.com/organization/hollo-limited,Grant,600000,HKD,77012,2021-11-20,,,,,No,"SaaS, Digital Therapeutics, Healthtech, Mental Health","Artificial Intelligence (AI), Electronic Health Record (EHR), Health Care, Health Diagnostics, Information Technology, Mental Health, Personal Health, Software, Wellness",https://hollo.hk,,"Central and Western, Hong Kong Island, Hong Kong, Asia",$1M to $10M,6190000,HKD,793900,Seed,10,,,,,"248,585"
Angel Round - Stargazr,https://www.crunchbase.com/funding_round/stargazr-angel--4fed27f8,Stargazr,https://www.crunchbase.com/organization/stargazr,Angel,210000,USD,210000,2021-08-15,Seed,,,,Yes,Pioneering decision-making with AI.,"Accounting, Analytics, Artificial Intelligence (AI), Information Technology, Machine Learning, Predictive Analytics, Software",https://stargazr.ai/,,"Santa Monica, California, United States, North America",$1M to $10M,2370000,USD,2370000,Seed,5,,"Alchemist Accelerator, New Forge, Tim Mayeur",3,,"249,145"
Grant - Arkangel AI,https://www.crunchbase.com/funding_round/arkangel-ai-grant--3f84950a,Arkangel AI,https://www.crunchbase.com/organization/arkangel-ai,Grant,26500,USD,26500,2021-10-10,,,,,No,Transforming medical data into predictive algorithms without code,"Artificial Intelligence (AI), Health Care, Machine Learning, Software",http://www.arkangel.ai,,"Montréal, Quebec, Canada, North America",$1M to $10M,602500,USD,602500,Seed,8,,Amazon Web Services,1,,"249,227"
Pre Seed Round - xiris,https://www.crunchbase.com/funding_round/xiris-pre-seed--60f35b7c,xiris,https://www.crunchbase.com/organization/xiris,Pre-Seed,35000,USD,35000,2021-02-11,Seed,,,,Yes,Real-time video surveillance software monitored by AI 24/7.,"Artificial Intelligence (AI), Computer Vision, Machine Learning, Security, Software",https://xiris.ai,"Black Founded, Black Led","New York, New York, United States, North America",Less than $1M,180000,USD,180000,Seed,2,MARL 5G Accelerator,"MARL 5G Accelerator, Right Side Capital Management",2,,"250,182"
