Pre Seed Round - Strikes,https://www.crunchbase.com/funding_round/unbiased-intuitive-pre-seed--0d6a0f8b,Strikes,https://www.crunchbase.com/organization/unbiased-intuitive,Pre-Seed,40000,EUR,47705,2021-03-07,Seed,,,,Yes,"Strikes is a beautiful, intuitive, and data-driven stocks & options trading app built to help you trade options the right way.","B2C, FinTech, Natural Language Processing, Trading Platform",https://www.trystrikes.com,,"Glasgow, Glasgow City, United Kingdom, Europe",,167705,USD,167705,Seed,2,StartupYard,StartupYard,1,,"401,451"
Grant - Cerebriu,https://www.crunchbase.com/funding_round/cerebriu-grant--11a8c9ba,Cerebriu,https://www.crunchbase.com/organization/cerebriu,Grant,720000,DKK,116873,2021-01-15,,,,,No,Cerebriu is a health tech company developing machine learning in medical imaging that improves workflow efficiency and quality in radiology.,"Consumer Software, Health Care, Machine Learning, Medical, Software",https://www.cerebriu.com,,"Københoved, Syddanmark, Denmark, Europe",$1M to $10M,6052791,USD,6052791,Seed,15,,Innovation Fund Denmark,1,,"171,399"
Pre Seed Round - Python RPA,https://www.crunchbase.com/funding_round/python-rpa-pre-seed--7a3543a7,Python RPA,https://www.crunchbase.com/organization/python-rpa,Pre-Seed,50000,USD,50000,2021-04-28,Seed,714000,USD,714000,Yes,"No-code Robotic Process Automation Platform for IT Service Providers, Solopreneurs and BPOs","Enterprise Software, Robotic Process Automation (RPA), SaaS, Software",http://pythonrpa.org,,"Almaty, Almaty City, Kazakhstan, Asia",,350000,USD,350000,Seed,3,,Quest Ventures,1,,"402,653"
Venture Round - Appier,https://www.crunchbase.com/funding_round/appier-series-unknown--46c254a9,Appier,https://www.crunchbase.com/organization/appier,Venture - Series Unknown,12126000,JPY,115612,2021-02-01,,,,,Yes,Appier is a Taipei-based startup providing an AI powered platform to brands and retailers to help increase customer engagement.,"Analytics, Artificial Intelligence (AI), Information Technology, Machine Learning, SaaS",http://appier.com,,"Taipei, T'ai-pei, Taiwan, Asia",$100M to $500M,164460856,USD,164460856,IPO,7,,"China-ASEAN etst Investment Cooperation Fund, Hippo Technologies, Sequoia Capital, SoftBank Capital, Su Jiayong, TA STRATEGIC PTE",6,,"402,963"
Grant - WaveScan,https://www.crunchbase.com/funding_round/wavescan-technologies-pte-ltd-grant--87cc8d68,WaveScan,https://www.crunchbase.com/organization/wavescan-technologies-pte-ltd,Grant,80200,SGD,59223,2021-09-27,,,,,No,We create advanced 3D imaging scanning technology for see-through structural inspections focused on cross-sector NDT applications.,"Analytics, Artificial Intelligence (AI), Consumer Electronics, Electronics, Information Technology, Machine Learning, Software",https://www.wavescan.sg,,"Singapore, Central Region, Singapore, Asia",$1M to $10M,3115160,SGD,2322363,Seed,9,,Enterprise Singapore,1,,"456,149"
Angel Round - ChoiZY,https://www.crunchbase.com/funding_round/choizy-angel--8b9ad56a,ChoiZY,https://www.crunchbase.com/organization/choizy,Angel,50000,USD,50000,2021-02-20,Seed,1000000,USD,1000000,Yes,Career Guidance App with Artificial Intelligence,"Artificial Intelligence (AI), EdTech, Education, Machine Learning",https://www.choizy.org,,"Kyiv, Kyyiv, Ukraine, Europe",,150000,USD,150000,Seed,5,,,,,"553,328"
Pre Seed Round - Hypertype,https://www.crunchbase.com/funding_round/hypertype-pre-seed--4a62d233,Hypertype,https://www.crunchbase.com/organization/hypertype,Pre-Seed,110000,USD,110000,2021-05-24,Seed,,,,Yes,Hypertype is the world's leading data integration platform for support & sales communications using AI.,"Artificial Intelligence (AI), CRM, Email, Generative AI, Information Technology, Natural Language Processing, SaaS, Sales Automation",https://hypertype.co,Women Led,"Stockholm, Stockholms Lan, Sweden, Europe",$1M to $10M,1499749,USD,1499749,Seed,4,,Antler,1,,"325,052"
Pre Seed Round - Recorn,https://www.crunchbase.com/funding_round/recorn-pre-seed--8bf5faba,Recorn,https://www.crunchbase.com/organization/recorn,Pre-Seed,12000,EUR,14458,2021-03-01,Seed,,,,Yes,AI-powered call recording mobile App,"Artificial Intelligence (AI), Information Technology, Mobile Apps, Software",https://recorn.app,,"Nicosia, Nicosia, Cyprus, Europe",Less than $1M,12000,EUR,14458,Seed,1,,Bank of Cyprus,1,,"405,225"
Seed Round - Algoritmi Vision,https://www.crunchbase.com/funding_round/algorimi-vision-seed--72374d16,Algoritmi Vision,https://www.crunchbase.com/organization/algorimi-vision,Seed,210000,USD,210000,2021-09-21,Seed,,,,Yes,"SaaS, Website, Application, AI, NLG, Multi-Domain Abstractive Search Summarization","Artificial Intelligence (AI), Information Services, Information Technology, Internet, SaaS",https://plex.page/,,"Mountain View, California, United States, North America",,405000,USD,405000,Seed,4,,,,,"405,451"
Equity Crowdfunding - Novidá,https://www.crunchbase.com/funding_round/novidá-equity-crowdfunding--67aa3146,Novidá,https://www.crunchbase.com/organization/novidá,Equity Crowdfunding,875000,BRL,163429,2021-05-05,,,,,Yes,"Novidá helps companies to measure the productivity and allocation of operational teams in their daily routines, thought a IoT+AI platform.","Artificial Intelligence (AI), Big Data, Human Resources, Internet of Things",https://novida.com.br/,,"São Paulo, Sao Paulo, Brazil, South America",,875000,BRL,163429,,1,,,,,"291,052"
Seed Round - Cropsy Technologies,https://www.crunchbase.com/funding_round/cropsy-seed--3615092d,Cropsy Technologies,https://www.crunchbase.com/organization/cropsy,Seed,75000,AUD,56955,2021-03-31,Seed,,,,Yes,Cropsy unlocks the full potential of vineyards and orchards with a unique and scalable AI-enabled vision system.,"AgTech, Artificial Intelligence (AI), Horticulture",https://www.cropsy.tech,,"Auckland, Auckland, New Zealand, Oceania",$1M to $10M,1822993,USD,1822993,Seed,4,,Startmate,1,,"405,820"
Angel Round - Kopernicus,https://www.crunchbase.com/funding_round/kopernicus-inc-angel--1d7156df,Kopernicus,https://www.crunchbase.com/organization/kopernicus-inc,Angel,150000,USD,150000,2021-03-01,Seed,,,,Yes,Unlocking Growth Potential with AI-Powered Insights for Financial Institutions and Investment Funds,"Artificial Intelligence (AI), Financial Services, Information Services, Machine Learning, Natural Language Processing",https://www.kopernicus.com,,"Palo Alto, California, United States, North America",,150000,USD,150000,Seed,1,,,,,"291,345"
Seed Round - Omnix Corp,https://www.crunchbase.com/funding_round/omnix-corp-seed--4026165d,Omnix Corp,https://www.crunchbase.com/organization/omnix-corp,Seed,50000,USD,50000,2021-02-11,Seed,5000000,USD,5000000,Yes,Cognitive automation of complex business processes through AI to restore operational fluidity.,"Artificial Intelligence (AI), Big Data, Business Intelligence, Data Center Automation, SaaS",http://www.omnixcorp.com,,"Santiago, Region Metropolitana, Chile, South America",$1M to $10M,1450000,USD,1450000,Seed,2,Wayra,Wayra,1,,"406,961"
Pre Seed Round - The Collaboratory,https://www.crunchbase.com/funding_round/the-collaboratory-f267-pre-seed--3ba96b44,The Collaboratory,https://www.crunchbase.com/organization/the-collaboratory-f267,Pre-Seed,120000,USD,120000,2021-07-19,Seed,,,,Yes,A B2B SaaS company building AI-powered document discovery tools for biopharma companies,"Artificial Intelligence (AI), Biotechnology, Machine Learning, SaaS, Software",https://thecollaboratory.ai/collaboratory,Women Founded,"Chicago, Illinois, United States, North America",$1M to $10M,1919999,USD,1919999,Seed,3,Techstars,Techstars,1,,"407,423"
Pre Seed Round - Whizz Mobility,https://www.crunchbase.com/funding_round/whizz-mobility-pre-seed--af7e4769,Whizz Mobility,https://www.crunchbase.com/organization/whizz-mobility,Pre-Seed,200000,SGD,146500,2021-12-01,Seed,,,,Yes,Vertically Integrated Robotic Delivery,"Artificial Intelligence (AI), Delivery, Drone Management, Drones, Food Delivery, Logistics, Machine Learning, Manufacturing, Robotics, Software",https://www.whizz.sg/,,"Singapore, Central Region, Singapore, Asia",,400000,SGD,293820,Seed,3,Mistletoe,Mistletoe,1,,"408,410"
Initial Coin Offering - Hypermine,https://www.crunchbase.com/funding_round/hypermine-initial-coin-offering--6d33e3ca,Hypermine,https://www.crunchbase.com/organization/hypermine,Initial Coin Offering,100000,USD,100000,2021-04-01,,10000000,USD,10000000,Yes,An avant-garde technology and research organization that is dedicated to building trust and transparency in the real world.,"Artificial Intelligence (AI), Blockchain, Cyber Security, Information Technology, Machine Learning",https://www.hypermine.co/,,"Bengaluru, Karnataka, India, Asia",Less than $1M,200000,USD,200000,,3,BlockOG Capital,"AU21 Capital, BlockOG Capital",2,,"531,704"
Grant - Nosh Technologies,https://www.crunchbase.com/funding_round/nosh-technologies-grant--29686203,Nosh Technologies,https://www.crunchbase.com/organization/nosh-technologies,Grant,3000,GBP,4095,2021-02-03,,,,,No,Nosh Technologies operates as a deep tech company that develops applications to optimize food management to fight food waste and hunger.,"AgTech, Machine Learning, Software",https://nosh.tech/,,"Colchester, Essex, United Kingdom, Europe",$1M to $10M,203478,USD,203478,Seed,6,,,,,"532,164"
Seed Round - Smartzi,https://www.crunchbase.com/funding_round/smartzi-b260-seed--6d8965cf,Smartzi,https://www.crunchbase.com/organization/smartzi-b260,Seed,200000,USD,200000,2021-04-04,Seed,,,,Yes,"Smartzi Provides ""Integrated IoT Solutions"" by Supporting Hundreds of Devices with Different Protocols and Different Brands.","Apps, Artificial Intelligence (AI), Internet of Things",https://www.smartzi.net/,,"Muscat, Masqat, Oman, Asia",,200000,USD,200000,Seed,2,Pioneer Investors,Pioneer Investors,1,,"294,414"
Grant - MRIMath,https://www.crunchbase.com/funding_round/mrimath-grant--50626b41,MRIMath,https://www.crunchbase.com/organization/mrimath,Grant,25000,USD,25000,2021-04-01,,,,,No,MRIMath offers explainable AI to assist physicians in brain tumor segmentation and volumetric analysis within few minutes.,"Artificial Intelligence (AI), Hospital, Medical",https://www.mrimath.com,,"Birmingham, Alabama, United States, North America",,225000,USD,225000,Seed,5,National Institutes of Health,National Institutes of Health,1,,"379,850"
Angel Round - Meeow,https://www.crunchbase.com/funding_round/meeow-angel--f9514483,Meeow,https://www.crunchbase.com/organization/meeow,Angel,150000,GBP,212760,2021-05-20,Seed,,,,Yes,Meeow is an AI-powered video networking platform.,"Artificial Intelligence (AI), Information Services, Information Technology",https://meeow.com/,,"Leeds, Leeds, United Kingdom, Europe",Less than $1M,150000,GBP,212760,Seed,2,,"Greg Gormley, Nigel Ashfield",2,,"650,625"
Pre Seed Round - Influunt,https://www.crunchbase.com/funding_round/influunt-pre-seed--0eacd0dc,Influunt,https://www.crunchbase.com/organization/influunt,Pre-Seed,120000,USD,120000,2021-09-13,Seed,,,,Yes,Influunt water risk intelligence platform helps businesses understand current and future water risk in their portfolio,"Artificial Intelligence (AI), Risk Management, Water",https://www.influunt.ai/,,"San Francisco, California, United States, North America",,120000,USD,120000,Seed,1,Techstars,Techstars,1,1,"505,352"
Pre Seed Round - Tavolo,https://www.crunchbase.com/funding_round/tavolo-9b33-pre-seed--8a93c28e,Tavolo,https://www.crunchbase.com/organization/tavolo-9b33,Pre-Seed,160000,USD,160000,2021-05-24,Seed,,,,Yes,Tavolo is an AI-driven content creation and automated marketing platform for restaurants that helps drive revenue for business owners.,"Artificial Intelligence (AI), Mobile Apps, Restaurants, SaaS, Software",https://www.tavolo.ai,,"Minneapolis, Minnesota, United States, North America",$1M to $10M,1280000,USD,1280000,Seed,3,Food Foundry,"Food Foundry, Techstars",2,,"381,084"
Seed Round - Blackfruit,https://www.crunchbase.com/funding_round/blackfruit-seed--8798fba5,Blackfruit,https://www.crunchbase.com/organization/blackfruit,Seed,150000,CAD,119791,2021-07-13,Seed,,,,Yes,"Agriculture, Biotech, Sustainability","Agriculture, Artificial Intelligence (AI), Biotechnology, Sustainability",https://www.blackfruit.ca/,,"Montréal, Quebec, Canada, North America",,500000,CAD,396665,Seed,2,,,,,"505,754"
Pre Seed Round - brickbox.io,https://www.crunchbase.com/funding_round/brickbox-io-pre-seed--5d0099c5,brickbox.io,https://www.crunchbase.com/organization/brickbox-io,Pre-Seed,200000,USD,200000,2021-12-01,Seed,,,,Yes,"brickbox.io democratizes processing power by providing affordable, flexible GPU rental services.","Artificial Intelligence (AI), Data Center, Information Technology, Machine Learning, Software",https://brickbox.io,,"Altoona, Pennsylvania, United States, North America",,300000,USD,300000,Seed,2,,,,,"628,410"
Pre Seed Round - Sigma Industrial Precision,https://www.crunchbase.com/funding_round/sigma-industrial-precision-pre-seed--4243a768,Sigma Industrial Precision,https://www.crunchbase.com/organization/sigma-industrial-precision,Pre-Seed,60000,EUR,71819,2021-04-15,Seed,1450000,EUR,1735637,Yes,"Experts in smart electrical analysis. Technological solutions for Infrastructures 4.0, to ensure efficient, safe and sustainable processes.","Analytics, Building Maintenance, Industrial Automation, Information Services, Information Technology, Infrastructure, Machine Learning, Predictive Analytics, Software",https://www.sigmaindustrialprecision.com,,"Mataró, Catalonia, Spain, Europe",,256000,EUR,291563,Seed,5,,,,,"508,262"
Pre Seed Round - UniFox,https://www.crunchbase.com/funding_round/unifox-pre-seed--5d9f8401,UniFox,https://www.crunchbase.com/organization/unifox,Pre-Seed,2000,EUR,2368,2021-09-01,Seed,,,,Yes,Advanced investment solution that allow our clients to maximize their return while contributing to the ecology through our Web3 ecosystem.,"Artificial Intelligence (AI), Bitcoin, Blockchain, Cryptocurrency, Ethereum, Finance, FinTech, GreenTech, Sharing Economy, Web3",http://unifox.ai,,"Bordeaux, Aquitaine, France, Europe",,27000,EUR,29422,Seed,3,,,,,"630,385"
Pre Seed Round - GROWII,https://www.crunchbase.com/funding_round/growii-pre-seed--112bebaf,GROWII,https://www.crunchbase.com/organization/growii,Pre-Seed,100000,EUR,115939,2021-10-01,Seed,,,,Yes,GROWII is a developer of a talent management platform.,"Artificial Intelligence (AI), Human Resources, Online Portals",https://www.growii.es,,"Málaga, Andalucia, Spain, Europe",,100000,EUR,115939,Seed,1,Demium Capital,Demium Capital,1,,"655,982"
Pre Seed Round - EyeGage,https://www.crunchbase.com/funding_round/eyegage-pre-seed--ebdbe057,EyeGage,https://www.crunchbase.com/organization/eyegage,Pre-Seed,36455,USD,36455,2021-03-23,Seed,,,,Yes,"Data-driven drug screening tech, powered by eyes.","Artificial Intelligence (AI), Computer Vision, Construction, Insurance, Law Enforcement, Mobile Apps, Software, Transportation",https://eyegage.com/,"Black Founded, Black Led, Women Founded","Atlanta, Georgia, United States, North America",Less than $1M,625455,USD,625455,Seed,5,,,,,"201,304"
Pre Seed Round - Whelp,https://www.crunchbase.com/funding_round/whelp-pre-seed--22726012,Whelp,https://www.crunchbase.com/organization/whelp,Pre-Seed,120000,USD,120000,2021-04-05,Seed,,,,Yes,Conversational Commerce Platform,"Artificial Intelligence (AI), Big Data, Call Center, Customer Service, E-Commerce, Information Technology, SaaS, Small and Medium Businesses, Software",https://whelp.co,,"New York, New York, United States, North America",$1M to $10M,250000,USD,250000,Seed,5,Techstars,Techstars,1,1,"617,866"
Pre Seed Round - Cryptorama,https://www.crunchbase.com/funding_round/cryptorama-pre-seed--4242cad9,Cryptorama,https://www.crunchbase.com/organization/cryptorama,Pre-Seed,145000,USD,145000,2021-07-01,Seed,,,,Yes,Cryptorama is a social networking platform that offers a social chat platform for cryptocurrency.,"Artificial Intelligence (AI), Blockchain, Cryptocurrency, Stock Exchanges",http://www.cryptorama.com,"Hispanic / Latine Founded, Hispanic / Latine Led","Miami, Florida, United States, North America",$1M to $10M,245000,USD,245000,Seed,2,,,,,"203,395"
Grant - Queritel.com,https://www.crunchbase.com/funding_round/queritel-com-grant--f0a37cc3,Queritel.com,https://www.crunchbase.com/organization/queritel-com,Grant,40000,USD,40000,2021-08-01,,,,,No,Queritel is a Latam crowdsourced in-store data as a service (DAAS) provider.,"Analytics, Artificial Intelligence (AI), Crowdsourcing, Freelance, Market Research, SaaS",https://www.queritel.com/,,"Las Condes, Region Metropolitana, Chile, South America",,105000,USD,105000,,4,,Parallel18,1,,"313,187"
Equity Crowdfunding - Transparent Path spc,https://www.crunchbase.com/funding_round/transparent-path-equity-crowdfunding--3a122f54,Transparent Path spc,https://www.crunchbase.com/organization/transparent-path,Equity Crowdfunding,20000,USD,20000,2021-09-22,,,,,Yes,"Transparent Path offers supply chain visibility tools that help to decrease costs, waste, and risk.","AgTech, Predictive Analytics, Productivity Tools, Sensor, Software, Supply Chain Management",https://transparentpath.com,"East Asian Founded, East Asian Led, South Asian Founded, South Asian Led, Women Founded","Seattle, Washington, United States, North America",Less than $1M,1963773,USD,1963773,Seed,8,,Netcapital,1,,"597,008"
Funding Round - Leanmote,https://www.crunchbase.com/funding_round/leanmote-undisclosed--03ca0af7,Leanmote,https://www.crunchbase.com/organization/leanmote,Funding Round,50000,USD,50000,2021-01-18,,,,,Yes,"Single source of truth for your team's performance and wellbeing data. Be near, stop the exit and increase productivity.","Analytics, Application Performance Management, Human Resources, Predictive Analytics, Social Network, Wellness",https://leanmote.com/,,"Sydney, New South Wales, Australia, Oceania",Less than $1M,100000,USD,100000,,2,,,,,"598,590"
Seed Round - Vozy,https://www.crunchbase.com/funding_round/vozy-inc-seed--ee71c475,Vozy,https://www.crunchbase.com/organization/vozy-inc,Seed,42600,USD,42600,2021-05-01,Seed,,,,Yes,Vozy provides a voice AI platform that help evolve conversations at SCALE for the Enterprise.,"Artificial Intelligence (AI), Enterprise Software, SaaS, Software, Speech Recognition, Virtual Assistant",https://www.vozy.co,,"Medellín, Antioquia, Colombia, South America",$1M to $10M,8082600,USD,8082600,Seed,11,,Enlaces,1,,"598,976"
Pre Seed Round - OptimAIze Marketing Solutions Kft.,https://www.crunchbase.com/funding_round/optimaize-marketing-solutions-kft-pre-seed--81300d95,OptimAIze Marketing Solutions Kft.,https://www.crunchbase.com/organization/optimaize-marketing-solutions-kft,Pre-Seed,20000000,HUF,67467,2021-06-30,Seed,,,,Yes,OptimAIze Marketing Solutions offers software helps companies to find their main audience when they use Google ads.,"Artificial Intelligence (AI), Data Management, Machine Learning, Marketing",https://www.optimaize-marketing.com,,"Debrecen, Debrecen, Hungary, Europe",,20000000,HUF,67467,Seed,1,,Hiventures,1,,"600,547"
Pre Seed Round - NeuralSpace,https://www.crunchbase.com/funding_round/neural-space-pre-seed--f58026e0,NeuralSpace,https://www.crunchbase.com/organization/neural-space,Pre-Seed,120000,USD,120000,2021-01-10,Seed,,,,Yes,The one-stop solution for all your language AI needs in 100+ languages,"Artificial Intelligence (AI), Developer Tools, Machine Learning, Natural Language Processing, SaaS, Software, Speech Recognition",https://www.neuralspace.ai,,"London, England, United Kingdom, Europe",$1M to $10M,2970000,USD,2970000,Seed,3,Techstars,Techstars,1,1,"547,938"
Corporate Round - Kognita,https://www.crunchbase.com/funding_round/kognita-corporate-round--99e9005a,Kognita,https://www.crunchbase.com/organization/kognita,Corporate Round,1000000,BRL,177236,2021-03-01,,12000000,BRL,2126830,Yes,"Kognita is an Artificial Inteligence company. We build products and solutions that help our clients make better decisions, faster.","Artificial Intelligence (AI), Machine Learning, SaaS, Sales Automation, Software",https://kognita.com.br,,"Brasil, Sao Paulo, Brazil, South America",Less than $1M,2075000,BRL,441732,,3,,,,,"474,391"
Seed Round - Dynaccurate,https://www.crunchbase.com/funding_round/dynaccurate-seed--d078ec8d,Dynaccurate,https://www.crunchbase.com/organization/dynaccurate,Seed,170000,USD,170000,2021-12-16,Seed,,,,Yes,Dynaccurate SARL is a start-up company launched in May 2021. Its core product is an AI that provides semantic interoperability,"Artificial Intelligence (AI), Health Care, Information Technology, Knowledge Management, Semantic Web, Software",https://www.dynaccurate.com/,,"Esch-sur-alzette, Luxembourg, Luxembourg, Europe",Less than $1M,370000,USD,370000,Seed,2,,,,,"548,161"
Pre Seed Round - IN-D,https://www.crunchbase.com/funding_round/in-d-pre-seed--ac7bc1c6,IN-D,https://www.crunchbase.com/organization/in-d,Pre-Seed,120000,USD,120000,2021-02-24,Seed,,,,Yes,"IN-D is an AI powered platform to help organizations do KYC, customer onboarding, insurance claims administration and processing invoices.","Artificial Intelligence (AI), Digital Media",https://in-d.ai/,,"Singapore, Central Region, Singapore, Asia",,1370000,USD,1370000,M&A,3,EY Foundry,EY Foundry,1,2,"272,819"
Pre Seed Round - Tenyks,https://www.crunchbase.com/funding_round/tenyks-pre-seed--850ab4cb,Tenyks,https://www.crunchbase.com/organization/tenyks,Pre-Seed,125000,USD,125000,2021-08-31,Seed,,,,Yes,Tenyks helps AI developers build reliable vision systems.,"Artificial Intelligence (AI), Computer Vision, Image Recognition, Machine Learning, Software",http://tenyks.ai,,"Cambridge, Cambridgeshire, United Kingdom, Europe",,3550832,USD,3550832,Seed,4,,Y Combinator,1,,"263,967"
Convertible Note - Buddy.ai,https://www.crunchbase.com/funding_round/mybuddy-ai-convertible-note--b7a85d72,Buddy.ai,https://www.crunchbase.com/organization/mybuddy-ai,Convertible Note,150000,USD,150000,2021-05-26,,,,,No,Buddy.ai is a voice-based virtual English tutor for kids that uses speech and virtual human technologies.,"Apps, Artificial Intelligence (AI), E-Learning, EdTech, Education, Language Learning, Software, Tutoring",https://buddy.ai,,"Mountain View, California, United States, North America",$1M to $10M,2230000,USD,2230000,,9,,"JOINT JOURNEY, YellowRockets",2,,"441,455"
Pre Seed Round - VLADAM,https://www.crunchbase.com/funding_round/vladam-pre-seed--70dc0e97,VLADAM,https://www.crunchbase.com/organization/vladam,Pre-Seed,115000,EUR,133395,2021-11-01,Seed,,,,Yes,Vladam is an automated AI-powered cryptocurrency trading platform developed by traders for traders.,"Artificial Intelligence (AI), Cryptocurrency, FinTech",https://vladam.ai/,,"Novi Sad, Vojvodina, Serbia, Europe",,175000,EUR,202959,Seed,2,Innovation Fund Serbia,Innovation Fund Serbia,1,,"441,662"
Debt Financing - Urbio,https://www.crunchbase.com/funding_round/urbio-0008-debt-financing--4a774d26,Urbio,https://www.crunchbase.com/organization/urbio-0008,Debt Financing,100000,CHF,110404,2021-02-25,,,,,No,Urbio is a software that accelerates the transition of utilities towards clean energy.,"Artificial Intelligence (AI), CleanTech, Information Services, Smart Cities, Software",https://www.urb.io,,"Sion, Valais, Switzerland, Europe",$1M to $10M,2110404,USD,2110404,Seed,6,Foundation for Technological Innovation (FIT),Foundation for Technological Innovation (FIT),1,,"549,969"
Seed Round - Remedy Logic,https://www.crunchbase.com/funding_round/remedy-logic-seed--e2851d1d,Remedy Logic,https://www.crunchbase.com/organization/remedy-logic,Seed,100000,USD,100000,2021-06-01,Seed,,,,Yes,Remedy Logic provides an AI-based diagnosis platform for doctors.,"Artificial Intelligence (AI), Health Care, Health Insurance",https://remedylogic.com,,"New York, New York, United States, North America",$1M to $10M,100000,USD,100000,Seed,1,Antler,Antler,1,,"442,089"
Pre Seed Round - Cratoflow,https://www.crunchbase.com/funding_round/cratoflow-pre-seed--30cbcf86,Cratoflow,https://www.crunchbase.com/organization/cratoflow,Pre-Seed,100000,USD,100000,2021-11-18,Seed,,,,Yes,A B2B SaaS Platform that Automates Day-to-Day Bookkeeping Processes using Virtual Live Assistant built using Conversational AI & ML,Artificial Intelligence (AI),https://www.cratoflow.com/,"Women Founded, Women Led","Los Angeles, California, United States, North America",Less than $1M,450000,USD,450000,Seed,2,Forum Ventures,"Forum Ventures, Right Side Capital Management",2,,"374,789"
Pre Seed Round - CoTreat,https://www.crunchbase.com/funding_round/cotreat-pre-seed--aba137f9,CoTreat,https://www.crunchbase.com/organization/cotreat,Pre-Seed,100000,AUD,70874,2021-12-02,Seed,,,,Yes,CoTreat is an AI diagnostics platform for dentistry.,"Artificial Intelligence (AI), Dental, Health Diagnostics",https://cotreat.ai/,,"Melbourne, Victoria, Australia, Oceania",,1100000,AUD,780994,Seed,2,,Archangel Ventures,1,,"443,907"
Pre Seed Round - KineticAI,https://www.crunchbase.com/funding_round/kineticai-pre-seed--109b1c06,KineticAI,https://www.crunchbase.com/organization/kineticai,Pre-Seed,50488,USD,50488,2021-05-01,Seed,,,,Yes,KineticAI is a research-oriented organization that utilizes cutting-edge technology developments to design custom software and hardware.,"Analytics, Artificial Intelligence (AI), Computer Vision, Consulting, Embedded Systems, Industrial Automation, Machine Learning, Manufacturing, Software",https://www.kineticai.com,South Asian Founded,"The Woodlands, Texas, United States, North America",Less than $1M,50488,USD,50488,Seed,1,,,,,"444,316"
Pre Seed Round - Zolnoi,https://www.crunchbase.com/funding_round/zolnoi-pre-seed--69dfa944,Zolnoi,https://www.crunchbase.com/organization/zolnoi,Pre-Seed,55000,USD,55000,2021-09-28,Seed,,,,Yes,Integrate+ | SaaS for Predictive Maintenance | Data Science for Manufacturers,"Analytics, Machine Learning, Manufacturing, SaaS, Software",https://zolnoi.com,,"Bengaluru, Karnataka, India, Asia",,55000,USD,55000,Seed,2,Entrepreneur First,Entrepreneur First,1,,"377,218"
