Series A - Greeneye Technology,https://www.crunchbase.com/funding_round/green-eye-technology-series-a--b1800aea,Greeneye Technology,https://www.crunchbase.com/organization/green-eye-technology,Series A,22000000,USD,22000000,2021-12-16,Early Stage Venture,,,,Yes,Greeneye's mission is to dramatically reduce chemical usage while increasing productivity and profitability for farmers.,"Agriculture, AgTech, Artificial Intelligence (AI), Big Data, Farming, Internet of Things, Software",,"Tel Aviv, Tel Aviv, Israel, Asia",http://www.greeneye.ag,$1M to $10M,51000000,USD,51000000,,7,Jerusalem Venture Partners (JVP),"AGCO, Hyperplane, Jerusalem Venture Partners (JVP), KdT Ventures, One Way Ventures, Syngenta Ventures",6,2,"389,874"
Series C - Ceres Imaging,https://www.crunchbase.com/funding_round/ceres-imaging-series-c--15b6ca1d,Ceres Imaging,https://www.crunchbase.com/organization/ceres-imaging,Series C,23000000,USD,23000000,2021-09-29,Late Stage Venture,,,,Yes,Ceres Imaging is a SaaS-based aerial spectral imagery and analytics company that serves farmers and agribusinesses.,"Agriculture, AgTech, Enterprise Software, Machine Learning, SaaS, Software",,"Oakland, California, United States, North America",http://www.ceresimaging.net/,$10M to $50M,83836385,USD,83836385,,7,"REMUS Capital, XTX Ventures","B37 Ventures, Insight Partners, REMUS Capital, XTX Ventures",4,4,"530,326"
Series C - Pliops,https://www.crunchbase.com/funding_round/pliops-series-c--a09f7336,Pliops,https://www.crunchbase.com/organization/pliops,Series C,65000000,USD,65000000,2021-02-24,Late Stage Venture,,,,Yes,Pliops is a creator of new category of product that enables cloud and enterprise data centers.,"Analytics, Artificial Intelligence (AI), Big Data, Cloud Data Services, Data Storage, Database, Machine Learning, Product Design, Semiconductor",,"Abba Hillel, HaDarom, Israel, Asia",http://www.pliops.com/,$10M to $50M,205000000,USD,205000000,Late Stage Venture,5,Koch Disruptive Technologies,"Expon Capital, Intel Capital, Koch Disruptive Technologies, SBVA, State of Mind Ventures, Sweetwood Capital, Viola Ventures, Western Digital, Xilinx",9,2,"530,847"
Venture Round - Mesh-AI,https://www.crunchbase.com/funding_round/mesh-ai-series-unknown--969ff9eb,Mesh-AI,https://www.crunchbase.com/organization/mesh-ai,Venture - Series Unknown,30000000,USD,30000000,2021-10-05,,,,,Yes,"Mesh-AI is a consulting firm that offers data engineering, software, artificial intelligence, and consulting services.","Artificial Intelligence (AI), Machine Learning, Software",,"London, England, United Kingdom, Europe",https://www.mesh-ai.com,$1M to $10M,30000000,USD,30000000,,2,Columbia Capital,Columbia Capital,1,1,"247,959"
Series A - Volta Medical,https://www.crunchbase.com/funding_round/volta-medical-series-a--325cdd17,Volta Medical,https://www.crunchbase.com/organization/volta-medical,Series A,28000000,USD,28000000,2021-01-05,Early Stage Venture,,,,Yes,Volta Medical is an AI-driven start-up developing intelligent software solutions to guide cardiologists during interventional procedures.,"Artificial Intelligence (AI), Health Care, Medical Device, Software",,"Marseille, Provence-Alpes-Cote d'Azur, France, Europe",https://www.volta-medical.com/,$10M to $50M,68870570,USD,68870570,Early Stage Venture,6,Gilde Healthcare,"Gilde Healthcare, Groupe Pasteur Mutualité",2,1,"530,996"
Series A - BackBox,https://www.crunchbase.com/funding_round/backbox-series-a--5dc52590,BackBox,https://www.crunchbase.com/organization/backbox,Series A,32000000,USD,32000000,2021-10-26,Early Stage Venture,,,,Yes,BackBox is the provider of solutions for automated backup and recovery software for security and network devices.,"Cloud Computing, Consulting, Information Technology, Intelligent Systems, Network Security, Software",,"Tel Aviv-yafo, Tel Aviv, Israel, Asia",https://backbox.com/,$10M to $50M,32000000,USD,32000000,Early Stage Venture,1,Elsewhere Partners,Elsewhere Partners,1,3,"531,055"
Debt Financing - CARS24,https://www.crunchbase.com/funding_round/cars24-debt-financing--f574bd7b,CARS24,https://www.crunchbase.com/organization/cars24,Debt Financing,110000000,USD,110000000,2021-09-20,,,,,No,CARS24 is as AutoTech company that utilizes technology and dealer network for buying and selling pre-owned cars.,"Artificial Intelligence (AI), Automotive, E-Commerce, Marketplace",,"Gurgaon, Haryana, India, Asia",https://www.cars24.com,$100M to $500M,1347590799,USD,1347590799,,17,,,,,"531,343"
Series A - AIFORWARD,https://www.crunchbase.com/funding_round/aiforward-series-a--58cc666f,AIFORWARD,https://www.crunchbase.com/organization/aiforward,Series A,400000000,CNY,61227614,2021-01-01,Early Stage Venture,,,,Yes,AIFORWARD is an AIoT building intelligence and smart community solution provider.,"Artificial Intelligence (AI), Cloud Management, Internet of Things",,"Tianjing, Tianjin, China, Asia",http://www.aiforward.com/,,500000000,CNY,76602531,Early Stage Venture,2,Sunac Services,Sunac Services,1,,"531,576"
Series G - Collibra,https://www.crunchbase.com/funding_round/collibra-series-g--3246de00,Collibra,https://www.crunchbase.com/organization/collibra,Series G,250000000,USD,250000000,2021-11-09,Late Stage Venture,5000000000,USD,5000000000,Yes,Collibra delivers an end-to-end Data Intelligence platform to accelerate digital business transformation.,"Analytics, Artificial Intelligence (AI), Data Integration, Data Management, Enterprise Software, Infrastructure",,"Brussels, Brussels Hoofdstedelijk Gewest, Belgium, Europe",http://www.collibra.com,$10M to $50M,596486133,USD,596486133,,9,"Sequoia Capital Global Equities, Sofina","Battery Ventures, CapitalG, Dawn Capital, Durable Capital Partners, ICONIQ Capital, Index Ventures, Sequoia Capital Global Equities, Sofina, Tiger Global Management",9,7,"531,783"
Series E - ThreatBook,https://www.crunchbase.com/funding_round/threatbook-series-e--302c5489,ThreatBook,https://www.crunchbase.com/organization/threatbook,Series E,500000000,CNY,76874587,2021-03-17,Late Stage Venture,,,,Yes,ThreatBook is China’s first security threat intelligence company.,"Business Intelligence, Cyber Security, Machine Learning, Network Security, SaaS, Security",,"Beijing, Beijing, China, Asia",https://www.threatbook.cn/,$1M to $10M,1365000000,CNY,207540728,Late Stage Venture,8,CPE,"CPE, V Fund Management",2,,"578,509"
Series B - Vianai,https://www.crunchbase.com/funding_round/vianai-series-b--a05352a0,Vianai,https://www.crunchbase.com/organization/vianai,Series B,140000000,USD,140000000,2021-06-16,Early Stage Venture,,,,Yes,Vianai provides enterprise artificial intelligence solutions.,"Artificial Intelligence (AI), Computer, Information Technology, Intelligent Systems, Machine Learning, Software",,"Palo Alto, California, United States, North America",https://www.vian.ai,$1M to $10M,190000000,USD,190000000,Early Stage Venture,2,SoftBank Vision Fund,"George R Roberts, Henry Kravis, Jerry Yang, Jim Davidson, SoftBank Vision Fund",5,1,"580,065"
Series B - Lifebit,https://www.crunchbase.com/funding_round/lifebit-ai-series-b--196c50cf,Lifebit,https://www.crunchbase.com/organization/lifebit-ai,Series B,60000000,USD,60000000,2021-09-28,Early Stage Venture,,,,Yes,"Lifebit CloudOS is the intelligent genomics platform that is the industry standard for unified, secure research over distributed big data.","Artificial Intelligence (AI), Bioinformatics, Biotechnology, Cloud Data Services, Genetics, Life Science, Machine Learning, Pharmaceutical, Software",,"London, England, United Kingdom, Europe",http://lifebit.ai,Less than $1M,70620000,USD,70620000,Early Stage Venture,5,Tiger Global Management,"Beacon Capital, Eurazeo, Pentech Ventures, Tiger Global Management",4,2,"324,552"
Series B - Netomi,https://www.crunchbase.com/funding_round/netomi-series-b--e1cfb146,Netomi,https://www.crunchbase.com/organization/netomi,Series B,30000000,USD,30000000,2021-11-17,Early Stage Venture,180000000,USD,180000000,Yes,Netomi provides multimodal and omnichannel Sanctioned Generative AI for enterprises.,"Artificial Intelligence (AI), Customer Service, Digital Marketing, Enterprise Software, Machine Learning, SaaS, Software",,"San Mateo, California, United States, North America",https://www.netomi.com/,$10M to $50M,52000000,USD,52000000,Early Stage Venture,4,,"Eldridge Industries, Fin Capital, Indicator Ventures, WndrCo",4,1,"383,532"
Series A - Nabla,https://www.crunchbase.com/funding_round/nabla-series-a--38cf1fd5,Nabla,https://www.crunchbase.com/organization/nabla,Series A,20600000,USD,20600000,2021-04-09,Early Stage Venture,,,,Yes,"Nabla is the developer of Nabla Copilot, an ambient AI that helps clinicians enjoy care again.","Artificial Intelligence (AI), Electronic Health Record (EHR), Health Care, Machine Learning",,"Paris, Ile-de-France, France, Europe",https://www.nabla.com,$1M to $10M,44700345,USD,44700345,Early Stage Venture,3,,,,,"228,645"
Private Equity Round - Artur'In,https://www.crunchbase.com/funding_round/artur-in-private-equity--1f38927b,Artur'In,https://www.crunchbase.com/organization/artur-in,Private Equity,42000000,EUR,51279484,2021-06-02,Private Equity,,,,Yes,Artur'In is an AI-based platform to help real-estate professionals deploy an advanced digital marketing solution.,"Advertising, Advertising Platforms, Artificial Intelligence (AI), Marketing, Real Estate",,"Paris, Ile-de-France, France, Europe",https://www.arturin.com/,$10M to $50M,47500000,EUR,57729924,Private Equity,2,PSG Equity,PSG Equity,1,2,"384,323"
Series A - Qianhai Yueshi Information Technology,https://www.crunchbase.com/funding_round/qianhai-yueshi-information-technology-series-a--4d9a2f69,Qianhai Yueshi Information Technology,https://www.crunchbase.com/organization/qianhai-yueshi-information-technology,Series A,390000000,CNY,61240834,2021-12-16,Early Stage Venture,,,,Yes,Qianhai Yueshi Information Technology is a provider of an AI based supply chain management platform for China's cold chain industry.,"Artificial Intelligence (AI), Logistics, Software, Supply Chain Management",,"Shenzhen, Guangdong, China, Asia",http://www.xxllps.com,,1010000000,CNY,147099140,Early Stage Venture,3,,"Changhe Capital, Goldport Capital, Kingdom, QF Capital, Tahua Ziben, Tang Lei, Venture Workshop, VenturesLab",8,1,"384,716"
Series A - ElectroNeek,https://www.crunchbase.com/funding_round/electroneek-series-a--bea617b9,ElectroNeek,https://www.crunchbase.com/organization/electroneek,Series A,20000000,USD,20000000,2021-06-01,Early Stage Venture,80000000,USD,80000000,Yes,ElectroNeek is a robotic process automation platform for MSPs & IT service providers.,"Artificial Intelligence (AI), B2B, Developer Platform, Developer Tools, Information Technology, Robotic Process Automation (RPA), Software",,"Austin, Texas, United States, North America",http://www.electroneek.com/,$10M to $50M,23655000,USD,23655000,Early Stage Venture,8,Baring Vostok Capital Partners,"Andrew Izyumov, Angelsdeck Global Ventures, Association and CPA.com Startup Accelerator, Baring Vostok Capital Partners, Dragon Capital, Gokul Rajaram, I2BF Global Ventures, YellowRockets",8,1,"385,467"
Series B - TSLC,https://www.crunchbase.com/funding_round/tslc-series-b--abb2d9d1,TSLC,https://www.crunchbase.com/organization/tslc,Series B,25000000,USD,25000000,2021-11-11,Early Stage Venture,,,,Yes,TSLC is an AI/ML-driven credit enablement platform company.,"Credit, Financial Services, FinTech, Machine Learning",,"Singapore, Central Region, Singapore, Asia",https://www.tslcglobal.com,$10M to $50M,25000000,USD,25000000,Early Stage Venture,1,ARV Investments,ARV Investments,1,,"385,763"
Series A - WeaveGrid,https://www.crunchbase.com/funding_round/weave-grid-series-a--f375440c,WeaveGrid,https://www.crunchbase.com/organization/weave-grid,Series A,15000000,USD,15000000,2021-05-20,Early Stage Venture,,,,Yes,WeaveGrid develops electrification software for the scalable deployment of electric vehicles on the electric grid.,"Automotive, Electric Vehicle, Machine Learning, Renewable Energy, Software, Transportation",,"San Francisco, California, United States, North America",https://www.weavegrid.com,$10M to $50M,50000000,USD,50000000,Early Stage Venture,4,Coatue,"Breakthrough Energy Ventures, Climactic VC, Coatue, Grok Ventures, Josh Felser, Ramez Naam, The Westly Group",7,4,"532,725"
Venture Round - Evozyne,https://www.crunchbase.com/funding_round/evozyne-series-unknown--cca60db1,Evozyne,https://www.crunchbase.com/organization/evozyne,Venture - Series Unknown,54183709,USD,54183709,2021-04-21,,,,,Yes,Evozyne is a generative AI company that focuses on therapeutic discovery and drug development.,"Artificial Intelligence (AI), Biotechnology, Life Science, Medical, Therapeutics",,"Chicago, Illinois, United States, North America",https://evozyne.com,Less than $1M,144367382,USD,144367382,Early Stage Venture,3,,,,,"533,085"
Series C - Mythic,https://www.crunchbase.com/funding_round/mythic-ai-series-c--b048129b,Mythic,https://www.crunchbase.com/organization/mythic-ai,Series C,70000000,USD,70000000,2021-05-11,Late Stage Venture,,,,Yes,Mythic develops analog matrix processors and key cards based on analog compute-in-memory.,"Artificial Intelligence (AI), Computer Vision, Machine Learning, Software Engineering",,"Austin, Texas, United States, North America",https://mythic.ai,$10M to $50M,164650000,USD,164650000,,6,"BlackRock, Hewlett Packard Enterprise","Alumni Ventures, BlackRock, Hewlett Packard Enterprise, UDC Ventures",4,2,"441,432"
Initial Coin Offering - Nodle,https://www.crunchbase.com/funding_round/nodle-io-initial-coin-offering--f3a96c3d,Nodle,https://www.crunchbase.com/organization/nodle-io,Initial Coin Offering,31000000,USD,31000000,2021-12-16,,,,,Yes,The Nodle network connects the world by using smartphones as nodes to create a digital trust network for social good.,"Artificial Intelligence (AI), Blockchain, Energy, Internet, Internet of Things, Mobile Apps, Mobile Payments, Telecommunications",,"San Francisco, California, United States, North America",https://nodle.com,$1M to $10M,36250000,USD,36250000,,5,,,,,"361,247"
Series A - Overjet,https://www.crunchbase.com/funding_round/overjet-series-a--01a10d45,Overjet,https://www.crunchbase.com/organization/overjet,Series A,27000000,USD,27000000,2021-08-26,Early Stage Venture,,,,Yes,Overjet is an AI-powered dental technology company that provides algorithms to analyze dental images and deliver diagnoses.,"Artificial Intelligence (AI), Dental, Electronic Health Record (EHR), Health Diagnostics, Software","Women Founded, Women Led","Cambridge, Massachusetts, United States, North America",https://www.overjet.ai,$10M to $50M,130550000,USD,130550000,Late Stage Venture,5,"General Catalyst, Insight Partners","Crosslink Capital, General Catalyst, Insight Partners, The E14 Fund",4,3,"388,549"
Post-IPO Equity - Doma,https://www.crunchbase.com/funding_round/states-title-post-ipo-equity--c4d932f6,Doma,https://www.crunchbase.com/organization/states-title,Post-IPO Equity,300000000,USD,300000000,2021-07-29,,,,,Yes,Doma is an insurtech platform that uses machine intelligence to remove friction from residential real estate transactions.,"Artificial Intelligence (AI), Commercial Real Estate, InsurTech, Machine Learning, Real Estate",,"Miami, Florida, United States, North America",https://www.doma.com,$100M to $500M,679615152,USD,679615152,IPO,8,,"BlackRock, Fidelity, Lennar Ventures, SoftBank Capital, Spencer Rascoff, The Gores Group, Wells Capital Management",7,,"536,054"
Debt Financing - Leukocare,https://www.crunchbase.com/funding_round/leukocare-debt-financing--8a848a80,Leukocare,https://www.crunchbase.com/organization/leukocare,Debt Financing,15000000,USD,15000000,2021-06-23,,,,,No,"Leukocare is a biotechnology company, specialized in the field of biopharmaceutical formulation development.","Artificial Intelligence (AI), Biotechnology, Health Diagnostics, Medical Device",,"Martinsried, Bayern, Germany, Europe",http://www.leukocare.com,$10M to $50M,17500000,USD,17500000,,3,Petrichor Healthcare Capital Management,Petrichor Healthcare Capital Management,1,1,"379,541"
Series A - BoostUp.ai,https://www.crunchbase.com/funding_round/boostup-ai-sales-intelligence-series-a--5fab5408,BoostUp.ai,https://www.crunchbase.com/organization/boostup-ai-sales-intelligence,Series A,22000000,USD,22000000,2021-04-28,Early Stage Venture,,,,Yes,BoostUp helps companies achieve predictability and scaleable growth through accurate forecasting.,"Accounting, Analytics, Artificial Intelligence (AI), Finance, Information Technology, Machine Learning, Predictive Analytics, Sales, Sales Automation, Software",,"Santa Clara, California, United States, North America",https://boostup.ai/,$1M to $10M,56750000,USD,56750000,Early Stage Venture,3,Canaan Partners,"Benhamou Global Ventures, Canaan Partners, Emergent Ventures, Lorimer Ventures",4,1,"380,634"
Series C - Interos,https://www.crunchbase.com/funding_round/interos-series-c--a6b48cea,Interos,https://www.crunchbase.com/organization/interos,Series C,100000000,USD,100000000,2021-07-22,Late Stage Venture,900000000,USD,900000000,Yes,Interos helps companies manage risk and continuously monitor their supply chain and business relationships to avoid disruptions.,"Artificial Intelligence (AI), Cyber Security, Machine Learning, Risk Management, SaaS, Supply Chain Management","Women Founded, Women Led","Arlington, Virginia, United States, North America",http://www.interos.ai,$1M to $10M,134850000,USD,134850000,,7,NightDragon,"Kleiner Perkins, NightDragon, Venrock",3,2,"381,016"
Series A - Heuron,https://www.crunchbase.com/funding_round/heuron-series-a--8fcf782b,Heuron,https://www.crunchbase.com/organization/heuron,Series A,15000000,USD,15000000,2021-05-31,Early Stage Venture,,,,Yes,"Heuron co., Ltd. is an AI-based medical imaging and diagnostic solutions for Neurodegenerative disease.","Artificial Intelligence (AI), Computer Vision, Health Care, Health Diagnostics, Image Recognition, Information Technology, Machine Learning, Medical Device, Software",,"Incheon, Inch'on-jikhalsi, South Korea, Asia",https://iheuron.com,$1M to $10M,33270000,USD,33270000,Early Stage Venture,2,,,,,"372,524"
Post-IPO Equity - Axilion Smart Mobility,https://www.crunchbase.com/funding_round/axilion-post-ipo-equity--38f3cb73,Axilion Smart Mobility,https://www.crunchbase.com/organization/axilion,Post-IPO Equity,19000000,USD,19000000,2021-01-05,,,,,Yes,Reduce Congestion. Reduce Pollution. Increase Safety. With AI Today.,"Artificial Intelligence (AI), Public Transportation, SaaS, Software, Transportation",,"Tel Aviv, Tel Aviv, Israel, Asia",http://www.axilion.com,Less than $1M,25000000,USD,25000000,IPO,3,,,,,"372,809"
Convertible Note - CoreWeave,https://www.crunchbase.com/funding_round/coreweave-convertible-note--0a262bc8,CoreWeave,https://www.crunchbase.com/organization/coreweave,Convertible Note,50000000,USD,50000000,2021-11-10,,,,,No,"CoreWeave is a AI hyperscaler, delivering a cloud platform that manages complexity through automation, making supercomputing accessible.","Artificial Intelligence (AI), Cloud Computing, Cloud Infrastructure, Information Technology, Machine Learning",,"Roseland, New Jersey, United States, North America",https://www.coreweave.com,$10M to $50M,12118500000,USD,12118500000,Late Stage Venture,10,Magnetar Capital,Magnetar Capital,1,1,"394,237"
Venture Round - Nexxiot,https://www.crunchbase.com/funding_round/nexxiot-series-unknown--babd402e,Nexxiot,https://www.crunchbase.com/organization/nexxiot,Venture - Series Unknown,25000000,USD,25000000,2021-06-08,,,,,Yes,"Nexxiot is a TradeTech pioneer with a mission to enable easier, safer, and cleaner transportation for all stakeholders in the supply chain.","Artificial Intelligence (AI), Enterprise Software, Information Technology, Internet of Things, Logistics, Software, Supply Chain Management",,"Zürich, Zurich, Switzerland, Europe",https://www.nexxiot.com/en,Less than $1M,184080493,USD,184080493,,12,QVIDTVM,QVIDTVM,1,,"394,721"
Series A - UserGems,https://www.crunchbase.com/funding_round/usergems-series-a--3ca3a6a7,UserGems,https://www.crunchbase.com/organization/usergems,Series A,20000000,USD,20000000,2021-10-26,Early Stage Venture,,,,Yes,An AI-powered solution that combines relationship data and trigger events to identify buyers who will most likely buy from you,"Artificial Intelligence (AI), Machine Learning, Marketing, Predictive Analytics, SaaS, Sales",,"San Francisco, California, United States, North America",https://www.usergems.com/,$1M to $10M,22400000,USD,22400000,Early Stage Venture,3,Craft Ventures,"Battery Ventures, Corp Capital, Craft Ventures, Everywhere Ventures (The Fund), Tiger Global Management, Uncork Capital",6,4,"374,539"
Series B - Findem,https://www.crunchbase.com/funding_round/findem-series-b--881b9fc0,Findem,https://www.crunchbase.com/organization/findem,Series B,30000000,USD,30000000,2021-12-09,Early Stage Venture,,,,Yes,Automate talent acquisition workflows and consolidate top-of-funnel activities in Findem's Talent Data Cloud.,"Analytics, Artificial Intelligence (AI), Computer, Human Resources, Recruiting, SaaS, Software",,"Redwood City, California, United States, North America",https://www.findem.ai/,$1M to $10M,37300000,USD,37300000,Early Stage Venture,2,"Four Rivers Group, Quarry","Corner Ventures, Four Rivers Group, Quarry, Wing Venture Capital",4,2,"651,601"
Series A - Malbek,https://www.crunchbase.com/funding_round/malbek-series-a--6ddf6bb9,Malbek,https://www.crunchbase.com/organization/malbek,Series A,15300000,USD,15300000,2021-09-28,Early Stage Venture,,,,Yes,"Malbek is an AI fueled enterprise contract management solution that streamlines request, review, signature, and commitment tracking.","Artificial Intelligence (AI), Enterprise Software, Legal Tech, SaaS, Software","South Asian Founded, South Asian Led","Princeton, New Jersey, United States, North America",https://www.malbek.io,$1M to $10M,20550000,USD,20550000,Early Stage Venture,5,Noro-Moseley Partners,"Noro-Moseley Partners, Osage Venture Partners, TDF Ventures",3,2,"374,446"
Series G - Outreach,https://www.crunchbase.com/funding_round/outreach-series-g--7ebbea3f,Outreach,https://www.crunchbase.com/organization/outreach,Series G,200000000,USD,200000000,2021-06-02,Late Stage Venture,4200000000,USD,4200000000,Yes,Outreach is a sales engagement platform that uses AI for predictive analytics as it relates to sales.,"Artificial Intelligence (AI), CRM, Enterprise Software, SaaS, Sales, Sales Enablement","Hispanic / Latine Founded, Hispanic / Latine Led","Seattle, Washington, United States, North America",https://www.outreach.io,$100M to $500M,489018000,USD,489018000,Late Stage Venture,13,"PremjiInvest, Steadfast Capital Management, Steadfast Financial","DFJ Growth, Lone Pine Capital, Mayfield Fund, PremjiInvest, Salesforce Ventures, Sands Capital Ventures, Sequoia Capital Global Equities, Steadfast Capital Management, Steadfast Financial, Tiger Global Management, Trinity Ventures, Vista Equity Partners",12,4,"375,027"
Series B - Phantom AI,https://www.crunchbase.com/funding_round/phantom-ai-series-b--29dc14bc,Phantom AI,https://www.crunchbase.com/organization/phantom-ai,Series B,17000000,USD,17000000,2021-03-09,Early Stage Venture,,,,Yes,Phantom AI creates and delivers an advanced computer vision and related ADAS technology to automotive OEMs and Tier 1s.,"Artificial Intelligence (AI), Automotive, Machine Learning, Software",,"Mountain View, California, United States, North America",https://phantom.ai,$1M to $10M,85700000,USD,85700000,Late Stage Venture,4,Renaissance Asset Management,Renaissance Asset Management,1,,"374,910"
Series B - Hugging Face,https://www.crunchbase.com/funding_round/hugging-face-series-b--0e7b9f58,Hugging Face,https://www.crunchbase.com/organization/hugging-face,Series B,40000000,USD,40000000,2021-03-11,Early Stage Venture,,,,Yes,"Hugging Face allows users to build, train, and deploy art models using the reference open source in machine learning.","Artificial Intelligence (AI), Generative AI, Machine Learning, Natural Language Processing, Open Source, Software",,"Brooklyn, New York, United States, North America",https://huggingface.co,$10M to $50M,395200000,USD,395200000,Late Stage Venture,7,Addition,"A.Capital Ventures, Addition, Alex Wang, Augusto ""Aghi"" Marietti, Betaworks Ventures, Dev Ittycheria, Florian Douetteau, Kevin Durant, Lux Capital, Olivier Pomel, Paul St. John, Rich Kleiman, Richard Socher",13,2,"397,015"
Series B - Paro,https://www.crunchbase.com/funding_round/paro-2-series-b--002f54d4,Paro,https://www.crunchbase.com/organization/paro-2,Series B,25000000,USD,25000000,2021-07-20,Early Stage Venture,,,,Yes,Paro provides on-demand bookkeeping and financial services powered by AI technology.,"Accounting, Artificial Intelligence (AI), Business Development, Finance, Financial Services, Freelance",Women Led,"Chicago, Illinois, United States, North America",https://www.paro.ai,Less than $1M,68500000,USD,68500000,Late Stage Venture,7,Madrona,"Alumni Ventures, KGC Capital, Madrona, Revolution Ventures, Sierra Ventures, Transform Capital, WP Global Partners",7,3,"376,387"
Series C - Vercel,https://www.crunchbase.com/funding_round/vercel-series-c--0f817e69,Vercel,https://www.crunchbase.com/organization/vercel,Series C,102000000,USD,102000000,2021-06-23,Late Stage Venture,998000000,USD,998000000,Yes,"Vercel's frontend cloud gives developers frameworks, workflows, and infrastructure to build a faster, more personalized web.","Apps, Artificial Intelligence (AI), Developer Platform, Internet, Software",,"Covina, California, United States, North America",https://vercel.com,,563000000,USD,563000000,Late Stage Venture,5,Bedrock,"8VC, Accel, Bedrock, Buckley Ventures, CRV, Flex Capital, Geodesic Capital, Google Ventures, Greenoaks, Latacora, Notable Capital, Salesforce Ventures, Tiger Global Management",13,4,"397,534"
