Series A - Shazura,https://www.crunchbase.com/funding_round/shazura-series-a--5b27a29b,Shazura,https://www.crunchbase.com/organization/shazura,Series A,2829000,USD,2829000,2021-11-29,Early Stage Venture,,,,Yes,True visual AI for real-time identification & authentication at scale. Fingerprint patented bio-inspired Edge-to-Cloud Computer Vision.,"Artificial Intelligence (AI), Biometrics, Embedded Software, Emerging Markets, Fraud Detection, Industrial Automation, Industrial Manufacturing, Intelligent Systems, Predictive Analytics, SaaS","Women Founded, Women Led","San Francisco, California, United States, North America",https://shazura.com,$1M to $10M,4435000,USD,4435000,Early Stage Venture,3,"BY Venture Partners, CIH Investment Capital Limited","BY Venture Partners, CIH Investment Capital Limited",2,,"645,013"
Seed Round - Bareways,https://www.crunchbase.com/funding_round/bareways-seed--42bcffe5,Bareways,https://www.crunchbase.com/organization/bareways,Seed,1200000,EUR,1364039,2021-11-15,Seed,,,,Yes,Bareways develops AI driven software solutions to enable mobility innovations in rural areas.,"Apps, Artificial Intelligence (AI), Automotive, Information Technology, Software",,"Lübeck, Schleswig-Holstein, Germany, Europe",https://www.bareways.com,,4150000,EUR,4619867,Early Stage Venture,4,,,,,"535,353"
Seed Round - Avalo,https://www.crunchbase.com/funding_round/avalo-seed--894f49a4,Avalo,https://www.crunchbase.com/organization/avalo,Seed,2900000,USD,2900000,2021-07-13,Seed,,,,Yes,Avalo is a plant biotech company using AI and evolution to make a more sustainable and resilient food system.,"Agriculture, Biotechnology, Machine Learning",,"Durham, North Carolina, United States, North America",https://www.avalo.ai,$1M to $10M,3900000,USD,3900000,Early Stage Venture,4,"Better Ventures, Giant Ventures","At One Ventures, Better Ventures, Giant Ventures, SOSV",4,1,"253,394"
Corporate Round - HR Messenger,https://www.crunchbase.com/funding_round/hr-messenger-corporate-round--1221363f,HR Messenger,https://www.crunchbase.com/organization/hr-messenger,Corporate Round,1200000,USD,1200000,2021-12-29,,,,,Yes,Automate recruitment funnel and onboarding using conversational AI and RPA,"Artificial Intelligence (AI), Human Resources, Information Technology, Internet, Machine Learning, Mobile Apps, Software",,"Almaty, Almaty City, Kazakhstan, Asia",https://hrmessenger.com/en,,1700000,USD,1700000,M&A,4,,Avito,1,,"536,826"
Seed Round - Array,https://www.crunchbase.com/funding_round/launchcloud-seed--0609bb17,Array,https://www.crunchbase.com/organization/launchcloud,Seed,1300000,USD,1300000,2021-04-20,Seed,,,,Yes,Digitize and automate data collection and business processes in a no-code environment,"Brand Marketing, Business Development, Data Collection and Labeling, Data Integration, Industrial Automation, Intelligent Systems",Women Founded,"Lewes, Delaware, United States, North America",http://buildarray.com,$1M to $10M,2165756,USD,2165756,Seed,6,Active Capital,Active Capital,1,1,"145,428"
Seed Round - Moises,https://www.crunchbase.com/funding_round/moises-seed--f70e509e,Moises,https://www.crunchbase.com/organization/moises,Seed,1600000,USD,1600000,2021-08-03,Seed,,,,Yes,Moises is an audio-tech company that leverages machine learning and data science in relation to music and audio processing.,"Artificial Intelligence (AI), Machine Learning, Music","Hispanic / Latine Founded, Hispanic / Latine Led","Salt Lake City, Utah, United States, North America",https://moises.ai,$1M to $10M,10425709,USD,10425709,Seed,2,Kickstart,"Index Ventures, Kickstart, Norwest Venture Partners, Valutia, VERVE CAPITAL",5,1,"536,898"
Series A - Hepta Airborne,https://www.crunchbase.com/funding_round/hepta-group-airborne-ltd-series-a--b2db4c73,Hepta Airborne,https://www.crunchbase.com/organization/hepta-group-airborne-ltd,Series A,2000000,EUR,2407286,2021-02-02,Early Stage Venture,,,,Yes,"Automating defect analysis for power lines. Bringing 3 dimensional world to everyone, everywhere.","Analytics, Artificial Intelligence (AI), Autonomous Vehicles, Big Data, CleanTech, Drones, Predictive Analytics, Software, Software Engineering",,"Tallinn, Harjumaa, Estonia, Europe",https://heptaairborne.com,$1M to $10M,2650000,EUR,3144222,,4,"EIT InnoEnergy, SpeedUp Venture Capital Group","Contrarian Ventures, EIT InnoEnergy, Expansion Capital, Markku Jääskelainen, SpeedUp Venture Capital Group, Thorgate Ventures",6,2,"255,358"
Series C - Bobble AI,https://www.crunchbase.com/funding_round/bobble-app-series-c--bb71d900,Bobble AI,https://www.crunchbase.com/organization/bobble-app,Series C,220000000,INR,3013181,2021-06-10,Late Stage Venture,,,,Yes,"Bobble AI is a conversation media app, making smartphone conversations personalized, expressive, and smarter with deep tech innovations.","Artificial Intelligence (AI), Digital Media, Mobile, Software",,"Haryana, Haryana, India, Asia",https://bobble.ai,$10M to $50M,56537909,USD,56537909,,7,,Affle,1,1,"191,048"
Series A - Medipixel,https://www.crunchbase.com/funding_round/medipixel-series-a--0de286f7,Medipixel,https://www.crunchbase.com/organization/medipixel,Series A,3578313650,KRW,3096097,2021-09-03,Early Stage Venture,,,,Yes,Medipixel is a healthcare technology company that has created a number of AI-enhanced solutions for intervention surgeons.,"Artificial Intelligence (AI), Health Care, Machine Learning, Robotics",,"Seoul, Seoul-t'ukpyolsi, South Korea, Asia",http://www.medipixel.io,$1M to $10M,28422290526,KRW,22595428,Early Stage Venture,6,Mirae Asset Capital,Mirae Asset Capital,1,,"468,462"
Debt Financing - PrimeAI,https://www.crunchbase.com/funding_round/dataprime-inc-debt-financing--354d06b6,PrimeAI,https://www.crunchbase.com/organization/dataprime-inc,Debt Financing,1077000,USD,1077000,2021-12-07,,,,,No,PrimeAI deploys accessible AI/machine learning engines through our PrimeAI Portal to drive significant EBITDA for our customers,"Artificial Intelligence (AI), Machine Learning, Software",,"Leesburg, Virginia, United States, North America",https://prime.ai/,,2102000,USD,2102000,Seed,3,,,,,"298,076"
Grant - Sinopia Biosciences,https://www.crunchbase.com/funding_round/sinopia-biosciences-grant--1bb0ea9e,Sinopia Biosciences,https://www.crunchbase.com/organization/sinopia-biosciences,Grant,2200000,USD,2200000,2021-02-15,,,,,No,"Sinopia Biosciences enables data-driven drug discovery by means of multi-omics data, machine learning, network analyses, and disease models.","Artificial Intelligence (AI), Biopharma, Biotechnology, Machine Learning, Neuroscience",Women Led,"San Diego, California, United States, North America",http://www.sinopiabio.com,$1M to $10M,14409000,USD,14409000,,14,National Institute of General Medical Science,National Institute of General Medical Science,1,,"471,394"
Series A - Buydepa,https://www.crunchbase.com/funding_round/buydepa-series-a--87953680,Buydepa,https://www.crunchbase.com/organization/buydepa,Series A,2000000,USD,2000000,2021-11-26,Early Stage Venture,11500000,USD,11500000,Yes,Latin American iBuyer,"Artificial Intelligence (AI), Finance, Real Estate",,"Santiago, Region Metropolitana, Chile, South America",http://www.buydepa.com,$1M to $10M,9600000,USD,9600000,Early Stage Venture,3,,,,,"403,779"
Convertible Note - Braight,https://www.crunchbase.com/funding_round/epeer-convertible-note--b1a91a62,Braight,https://www.crunchbase.com/organization/epeer,Convertible Note,1000000,EUR,1156109,2021-10-30,,,,,No,Braight develops a cross-industry adaptable behavioral analysis tool using AI to create efficient process optimization solutions.,"Artificial Intelligence (AI), Big Data, Data Mining, Finance, Machine Learning, Software",,"Toronto, British Columbia, Canada, North America",http://www.braight.tech,,3443288,USD,3443288,IPO,4,Lighthouse Ventures,Lighthouse Ventures,1,,"300,932"
Angel Round - CoCoPIE,https://www.crunchbase.com/funding_round/cocopie-angel--8952d1aa,CoCoPIE,https://www.crunchbase.com/organization/cocopie,Angel,1700000,USD,1700000,2021-06-01,Seed,,,,Yes,CoCoPIE is a startup developing a platform to optimize AI models for edge devices.,"Artificial Intelligence (AI), Information Technology, Machine Learning, Software",,"Irvine, California, United States, North America",https://www.cocopie.ai/,$1M to $10M,3154700,USD,3154700,Early Stage Venture,4,Chuxin Partners Capital,Chuxin Partners Capital,1,,"194,874"
Seed Round - viAct,https://www.crunchbase.com/funding_round/viact-ai-seed--931ce956,viAct,https://www.crunchbase.com/organization/viact-ai,Seed,2000000,USD,2000000,2021-03-24,Seed,,,,Yes,"Automating Monitoring with World's First Scenario-Based AI in Construction and Manufacturing to improve Safety, Productivity and Environment","Artificial Intelligence (AI), Computer Vision, Construction, Facility Management, Manufacturing, Mining, Oil and Gas, Property Development, Property Management",,"Hong Kong, Hong Kong Island, Hong Kong, Asia",https://www.viact.ai/,$10M to $50M,2000000,USD,2000000,Seed,4,Vector Ventures,"Alibaba Entrepreneurs Fund, Artesian VC, Particle Accelerator Limited (ParticleX), Vector Ventures",4,,"301,387"
Series A - Dexter Energy Services,https://www.crunchbase.com/funding_round/dexter-energy-services-series-a--919e9878,Dexter Energy Services,https://www.crunchbase.com/organization/dexter-energy-services,Series A,2000000,EUR,2383554,2021-03-18,Early Stage Venture,,,,Yes,"Dexter offers forecasting and dispatching solutions based on AI and cloud-based technology, increasing efficiency and lowering costs.","Artificial Intelligence (AI), Energy Efficiency, Renewable Energy",,"Amsterdamsche Veld I, Drenthe, The Netherlands, Europe",https://dexterenergy.ai,$1M to $10M,12500000,EUR,13907301,Early Stage Venture,3,Newion,"Newion, PDENH",2,,"168,788"
Seed Round - Nagro,https://www.crunchbase.com/funding_round/nagro-seed--7cf49d4b,Nagro,https://www.crunchbase.com/organization/nagro,Seed,1400000,USD,1400000,2021-12-15,Seed,,,,Yes,"Nagro is a brazilian agfintech, delivering credit to small and midsize farmers and helping agribusiness chain reduce risk throughs BigData.","Agriculture, AgTech, Artificial Intelligence (AI), Big Data, Financial Services, FinTech, Lending, Machine Learning",,"Uberlândia, Minas Gerais, Brazil, South America",https://nagro.com.br/,Less than $1M,50425000,USD,50425000,Early Stage Venture,6,,,,,"169,873"
Seed Round - Limna,https://www.crunchbase.com/funding_round/limna-seed--ef1f4fbd,Limna,https://www.crunchbase.com/organization/limna,Seed,2500000,USD,2500000,2021-09-01,Seed,,,,Yes,The AI-powered Art Advisor in your Pocket,"Art, Artificial Intelligence (AI), Blockchain, Information Technology, Machine Learning",,"London, England, United Kingdom, Europe",https://limna.ai/,,2645000,USD,2645000,Seed,2,Tekton Ventures,"Tekton Ventures, Weng Fine Art",2,,"170,092"
Venture Round - Zeitworks,https://www.crunchbase.com/funding_round/zeitworks-series-unknown--83dc0119,Zeitworks,https://www.crunchbase.com/organization/zeitworks,Venture - Series Unknown,2000000,USD,2000000,2021-07-07,,,,,Yes,Zeitworks is a provider of a machine learning powered business process improvement platform.,"Enterprise Software, Machine Learning, SaaS, Software",Women Founded,"Seattle, Washington, United States, North America",https://zeitworks.com/,$1M to $10M,6500000,USD,6500000,,2,Jazz Venture Partners,"Jazz Venture Partners, Madrona",2,2,"388,816"
Seed Round - INHUBBER,https://www.crunchbase.com/funding_round/inhubber-seed--6f32cda2,INHUBBER,https://www.crunchbase.com/organization/inhubber,Seed,1000000,EUR,1177856,2021-04-01,Seed,3200000,EUR,3769140,Yes,INHUBBER is the world's safest SaaS contract lifecycle management platform with a native digital signature.,"Artificial Intelligence (AI), B2B, Blockchain, Information Technology, SaaS, Small and Medium Businesses",,"Berlin, Berlin, Germany, Europe",https://inhubber.com/,$1M to $10M,1845000,EUR,2161195,Seed,7,Investitionsbank Berlin,Investitionsbank Berlin,1,,"171,337"
Seed Round - Stemly AI,https://www.crunchbase.com/funding_round/stemly-seed--90b60710,Stemly AI,https://www.crunchbase.com/organization/stemly,Seed,2500000,USD,2500000,2021-06-08,Seed,,,,Yes,"Decision Intelligence Platform for enterprise and SMEs for integrated supply chain, finance and sustainability planning / optimization","Machine Learning, SaaS",,"Singapore, Central Region, Singapore, Asia",https://www.stemly.ai,$1M to $10M,2500000,USD,2500000,Seed,1,,"EDB New Ventures, Elev8.VC, HH Family, ING Ventures, Resolution Ventures",5,2,"173,170"
Grant - Autogrid,https://www.crunchbase.com/funding_round/autogrid-grant--9137af3b,Autogrid,https://www.crunchbase.com/organization/autogrid,Grant,2250000,USD,2250000,2021-01-14,,,,,No,AutoGrid Systems organizes energy data and employs big data analytics to generate real-time predictions that create actionable data.,"Analytics, Artificial Intelligence (AI), Cloud Computing, Electric Vehicle, Energy, Energy Storage, Internet of Things, Renewable Energy",,"Redwood City, California, United States, North America",http://www.auto-grid.com,$10M to $50M,161000000,USD,161000000,M&A,11,ARPA-E,ARPA-E,1,,"173,556"
Seed Round - Whalemap,https://www.crunchbase.com/funding_round/whalemap-seed--871235d5,Whalemap,https://www.crunchbase.com/organization/whalemap,Seed,1600000,USD,1600000,2021-12-08,Seed,,,,Yes,Whalemap is a blockchain analytics company that uses data science to deliver actionable trading insights by looking at big market players.,"Analytics, Blockchain, Data Visualization, Predictive Analytics",,"London, England, United Kingdom, Europe",https://whalemap.io,$1M to $10M,1600000,USD,1600000,Seed,1,Momentum 6,"Anthony Pompliano, European Internet Ventures, Ghaf Capital Partners, Momentum 6, NFT Tech, RR² CAPITAL",6,,"480,265"
Seed Round - Dxcover,https://www.crunchbase.com/funding_round/dxcover-seed--0a132b38,Dxcover,https://www.crunchbase.com/organization/dxcover,Seed,1100000,GBP,1528302,2021-03-04,Seed,,,,Yes,Dxcover is a cancer diagnostics startup that uses liquid biopsy and artificial intelligence for early diagnosis of cancers.,"Biotechnology, Health Care, Health Diagnostics, Machine Learning, Medical",,"Glasgow, Glasgow City, United Kingdom, Europe",http://www.dxcover.com,,14400000,GBP,18198177,Early Stage Venture,7,,"Eos, Norcliffe Capital, University of Strathclyde",3,1,"597,952"
Seed Round - Deep Neuron Lab,https://www.crunchbase.com/funding_round/deep-neuron-lab-seed--b21bb22c,Deep Neuron Lab,https://www.crunchbase.com/organization/deep-neuron-lab,Seed,1000000,EUR,1196745,2021-02-04,Seed,,,,Yes,Deep Neuron Lab develops AI products to produce financial data that free people from tedious processes.,"Artificial Intelligence (AI), Finance, Machine Learning, Software",,"Berlin, Berlin, Germany, Europe",https://www.dnl.ai/,$1M to $10M,3000000,EUR,3281453,Seed,3,Cannonball Capital,Cannonball Capital,1,,"238,959"
Seed Round - West Indian Mining Company: WIMCo,https://www.crunchbase.com/funding_round/west-indian-mining-company-seed--af2991a3,West Indian Mining Company: WIMCo,https://www.crunchbase.com/organization/west-indian-mining-company,Seed,3100000,USD,3100000,2021-10-01,Seed,60000000,USD,60000000,Yes,West Indian Mining Company is an energy-tech company solving the global emissions crisis by mining Bitcoin.,"Artificial Intelligence (AI), Clean Energy, Cryptocurrency, Data Center",,"Port-of-spain, Port-of-Spain, Trinidad and Tobago, North America",,,3100000,USD,3100000,Seed,1,,,,,"221,162"
Seed Round - T-Lab,https://www.crunchbase.com/funding_round/t-lab-7253-seed--c94bd991,T-Lab,https://www.crunchbase.com/organization/t-lab-7253,Seed,22700000000,IDR,1591291,2021-09-23,Seed,,,,Yes,T-Lab is an AI-driven international Chinese language learning platform.,"Artificial Intelligence (AI), E-Learning, Education, Online Portals",,"Singapore, Central Region, Singapore, Asia",https://www.tlab.fun/,,22700000000,IDR,1591291,Seed,1,East Ventures,"Blue Elephant Capital, East Ventures, K3 Ventures, Plug and Play",4,1,"213,301"
Pre Seed Round - Peakperformer,https://www.crunchbase.com/funding_round/peakperformer-pre-seed--464cb08d,Peakperformer,https://www.crunchbase.com/organization/peakperformer,Pre-Seed,2670000,USD,2670000,2021-07-05,Seed,,,,Yes,"A goal-oriented, outcome-driven AI platform to help organisations build futuristic leaders in every vertical.","Artificial Intelligence (AI), E-Learning, Information Services, Information Technology",,"Bangalore, Karnataka, India, Asia",https://peakperformer.io/,$1M to $10M,5670000,USD,5670000,Seed,2,Antler,"Antler, Gaurav Munjal, Saket Agarwal",3,1,"222,431"
Secondary Market - Fiture,https://www.crunchbase.com/funding_round/fiture-chengdu-secondary-market--25a81cb2,Fiture,https://www.crunchbase.com/organization/fiture-chengdu,Secondary Market,1250000,USD,1250000,2021-09-14,,,,,No,Fiture is a smart household fitness equipment brand.,"Artificial Intelligence (AI), Fitness, Robotics, Sports",,"Chengdu, Sichuan, China, Asia",http://www.fiture.com/,,392250000,USD,392250000,Early Stage Venture,5,,Victor Koch,1,,"223,128"
Seed Round - Better Origin,https://www.crunchbase.com/funding_round/betterorigin-seed--aecf9f54,Better Origin,https://www.crunchbase.com/organization/betterorigin,Seed,3000000,USD,3000000,2021-02-23,Seed,,,,Yes,The food chain is broken. Our technology fixes it.,"Agriculture, Artificial Intelligence (AI), Biofuel, Farming",,"Cambridge, Cambridgeshire, United Kingdom, Europe",http://www.betterorigin.co.uk,$1M to $10M,22172344,USD,22172344,Early Stage Venture,7,"Fly Ventures, Nick Boyle","Fly Ventures, Metavallon VC, Nick Boyle",3,,"223,183"
Pre Seed Round - Fêtefully,https://www.crunchbase.com/funding_round/fêtefully-pre-seed--81acfdca,Fêtefully,https://www.crunchbase.com/organization/fêtefully,Pre-Seed,1275000,USD,1275000,2021-09-21,Seed,,,,Yes,Fêtefully provides affordable and personalized wedding and event planning services.,"Artificial Intelligence (AI), E-Commerce, Machine Learning","Black Led, Women Founded, Women Led","Dallas, Texas, United States, North America",https://www.fetefully.com,,2575000,USD,2575000,Seed,2,Techstars,"Chris Yeh, Gurtin Ventures, John Kim, Slauson & Co., Techstars",5,1,"223,983"
Seed Round - Komodo,https://www.crunchbase.com/funding_round/komodo-monitr-seed--ff8a65c7,Komodo,https://www.crunchbase.com/organization/komodo-monitr,Seed,1800000,NZD,1259502,2021-08-30,Seed,,,,Yes,"The data-driven, proactive approach to school wellbeing","Data Visualization, EdTech, Predictive Analytics, Software",,"Christchurch, Canterbury, New Zealand, Oceania",https://www.komodowellbeing.com,$1M to $10M,1334502,USD,1334502,Seed,3,Folklore Ventures,"Chloe Hamman, Flying Fox Ventures, Folklore Ventures, Icehouse Ventures, Kirsti Grant, Rod Hamilton",6,,"224,026"
Seed Round - KingsCrowd,https://www.crunchbase.com/funding_round/kingscrowd-seed--256f6e45,KingsCrowd,https://www.crunchbase.com/organization/kingscrowd,Seed,1100000,USD,1100000,2021-03-31,Seed,,,,Yes,KingsCrowd is an online private market rating and analytics platform for equity crowdfunding research and rating service.,"Analytics, Artificial Intelligence (AI), Financial Services, FinTech, Machine Learning, Venture Capital",,"Westwood, Massachusetts, United States, North America",https://kingscrowd.com/,$1M to $10M,6791696,USD,6791696,Early Stage Venture,9,,,,,"288,156"
Seed Round - Cardio Intelligence,https://www.crunchbase.com/funding_round/cardio-intelligence-seed--3de913db,Cardio Intelligence,https://www.crunchbase.com/organization/cardio-intelligence,Seed,140000000,JPY,1310273,2021-03-01,Seed,,,,Yes,Cardio Intelligence develops an AI automated diagnostic system.,"Artificial Intelligence (AI), Health Care, Information Technology, Machine Learning, Nursing and Residential Care",,"Tokyo, Tokyo, Japan, Asia",https://www.cardio-i.com/,$1M to $10M,175000000,JPY,1638435,Seed,3,,"ANRI, Daiwa Corporate Investment, Gemseki, M3, SMBC Venture Capital",5,,"388,012"
Venture Round - SuperMEM,https://www.crunchbase.com/funding_round/supermem-series-unknown--27f692d8,SuperMEM,https://www.crunchbase.com/organization/supermem,Venture - Series Unknown,1500000,USD,1500000,2021-06-07,,,,,Yes,SuperMEM develops a lightweight chip designed to enable AI on devices.,"Artificial Intelligence (AI), Computer, Information Technology",,"San Diego, California, United States, North America",https://www.supermemtech.com,,2200000,USD,2200000,,4,,,,,"245,082"
Series B - TRYETING,https://www.crunchbase.com/funding_round/tryeting-series-b--6621e7db,TRYETING,https://www.crunchbase.com/organization/tryeting,Series B,350000000,JPY,3172876,2021-03-30,Early Stage Venture,,,,Yes,TRYETING provides an AI platform that integrates various types of software.,"Artificial Intelligence (AI), Product Research, Recruiting, Software",,"Nagoya, Aichi, Japan, Asia",https://www.tryeting.jp,,1020000000,JPY,8743740,Early Stage Venture,5,,"MUFG Bank, Tokyu Fudosan",2,,"225,655"
Seed Round - Intrinsic Semiconductor Technologies,https://www.crunchbase.com/funding_round/intrinsic-semiconductor-technologies-seed--4a1d0035,Intrinsic Semiconductor Technologies,https://www.crunchbase.com/organization/intrinsic-semiconductor-technologies,Seed,1350000,GBP,1871006,2021-03-22,Seed,,,,Yes,Intrinsic Semiconductor Technologies is established to developed silicon-oxide based RRAM technologies.,"Artificial Intelligence (AI), Electronics, Information Technology, Manufacturing, Semiconductor",,"London, England, United Kingdom, Europe",https://www.intrinsicsemi.com,$1M to $10M,9350000,GBP,11605296,,4,"IP Group, UCL Technology Fund","IP Group, UCL Technology Fund",2,2,"389,437"
Seed Round - Norse Feedback,https://www.crunchbase.com/funding_round/norse-feedback-seed--97a947f8,Norse Feedback,https://www.crunchbase.com/organization/norse-feedback,Seed,19000000,NOK,2276531,2021-05-05,Seed,,,,Yes,Norse Feedback delivers adaptive software solutions for mental health providers based on research.,"Health Care, Information Technology, Mental Health, Predictive Analytics, Product Research, Software",,"Førde, Sogn og Fjordane, Norway, Europe",https://www.norsefeedback.com/,$1M to $10M,39000000,NOK,4499608,,6,Laho AS,"Laho AS, Seriva AS",2,,"245,879"
Seed Round - Competera,https://www.crunchbase.com/funding_round/competera-seed--d1f9797e,Competera,https://www.crunchbase.com/organization/competera,Seed,1500000,USD,1500000,2021-10-25,Seed,,,,Yes,Competera enables retailers and brands to increase customer trust by setting and maintaining optimal price positions on a real-time basis.,"Analytics, Artificial Intelligence (AI), Big Data, E-Commerce, Enterprise Software, Information Technology, Machine Learning, Retail, Retail Technology, Software",,"West Hollywood, California, United States, North America",https://competera.net,$10M to $50M,7300000,USD,7300000,Seed,6,Flyer One Ventures,Flyer One Ventures,1,1,"389,869"
Seed Round - United Robots,https://www.crunchbase.com/funding_round/united-robots-i-sverige-ab-seed--0591e9f4,United Robots,https://www.crunchbase.com/organization/united-robots-i-sverige-ab,Seed,1500000,EUR,1766281,2021-07-13,Seed,,,,Yes,United Robots is a service solution for automated editorial content.,"Artificial Intelligence (AI), Information Services, Information Technology",,"Malmö, Skane Lan, Sweden, Europe",http://unitedrobots.ai/,$1M to $10M,1500000,EUR,1766281,Seed,1,Investment AB Spiltan,Investment AB Spiltan,1,1,"530,144"
Pre Seed Round - automaited,https://www.crunchbase.com/funding_round/aiconomix-pre-seed--aaecd1b1,automaited,https://www.crunchbase.com/organization/aiconomix,Pre-Seed,1000000,EUR,1224849,2021-05-25,Seed,,,,Yes,"World’s first general process AI that automatically automates any business process. Quick, easy, efficient.","Artificial Intelligence (AI), B2B, Software",,"Köln, Nordrhein-Westfalen, Germany, Europe",https://automaited.com/,,5000000,EUR,5426309,Seed,2,"TechVision Fund, Visionaries Club","TechVision Fund, Visionaries Club",2,2,"247,471"
Seed Round - HaiXAI,https://www.crunchbase.com/funding_round/haixai-seed--91d2b4e6,HaiXAI,https://www.crunchbase.com/organization/haixai,Seed,2900000,USD,2900000,2021-04-08,Seed,,,,Yes,"HaiX building an AI Neural-Search Platform helps companies stay-ahead with actionable insights on vast unstructured data(Social, Enterprise)","Artificial Intelligence (AI), Machine Learning, Natural Language Processing, Predictive Analytics",,"London, England, United Kingdom, Europe",https://haixai.co,,2900000,USD,2900000,Seed,1,,,,,"428,525"
Pre Seed Round - eyes3,https://www.crunchbase.com/funding_round/eyes3-pre-seed--dd6d0c16,eyes3,https://www.crunchbase.com/organization/eyes3,Pre-Seed,2880000,USD,2880000,2021-01-05,Seed,98880000,USD,98880000,Yes,eyes3 is a Edge AI based technology company. Providing a platform for all software & hardware AI sport analytic start-up.,"Analytics, Artificial Intelligence (AI), Information Services, Information Technology, Software, Sports",,"Kwun Tong, Kowloon, Hong Kong, Asia",https://www.eyes3.com,,2880000,USD,2880000,Seed,1,,Kung Sing Cheng,1,,"531,839"
Pre Seed Round - Colabra,https://www.crunchbase.com/funding_round/colabra-app-pre-seed--ad127f99,Colabra,https://www.crunchbase.com/organization/colabra-app,Pre-Seed,1500000,USD,1500000,2021-09-06,Seed,,,,Yes,Accelerating the world's R&D.,"Artificial Intelligence (AI), Market Research, Project Management",,"San Francisco, California, United States, North America",https://www.colabra.ai/,$1M to $10M,3050000,USD,3050000,Seed,3,,"BoxOne Ventures, Builders VC, Duro Ventures, Inovia Capital, Jude Gomila, Longtail Health Ventures, On Deck, Village Global",8,1,"578,085"
