Seed Round - Airtrain AI,https://www.crunchbase.com/funding_round/sematic-2bbe-seed--0a429da9,Airtrain AI,https://www.crunchbase.com/organization/sematic-2bbe,Seed,3200000,USD,3200000,2022-11-17,Seed,,,,Yes,"Airtrain AI is an AI data platform that specializes in data curation, fine-tuning, and evaluation for LLMs.","Artificial Intelligence (AI), Cloud Infrastructure, Developer Tools, Machine Learning",,"San Francisco, California, United States, North America",https://www.airtrain.ai,,3200000,USD,3200000,Seed,1,Race Capital,"Brandon Leonardo, Fundament, Jeremy Stanley, Leonis Capital, Oliver Cameron, Pioneer Fund, Race Capital, Soma Capital, Y Combinator",9,1,"475,889"
Venture Round - Harvesting,https://www.crunchbase.com/funding_round/harvesting-inc-series-unknown--70198d6c,Harvesting,https://www.crunchbase.com/organization/harvesting-inc,Venture - Series Unknown,4000000,USD,4000000,2022-08-25,,,,,Yes,"Harvesting provides an agriculture intelligence engine that will help bring speed, accuracy, and transparency.","Agriculture, Big Data, Credit, Emerging Markets, Finance, Predictive Analytics, SaaS, Software",,"Fremont, California, United States, North America",http://www.harvesting.co,Less than $1M,4400000,USD,4400000,,4,Social Capital,"Elliott Donnelley, Peggy Dulany, Social Capital",3,1,"477,126"
Seed Round - Fairgen,https://www.crunchbase.com/funding_round/fairgen-seed--c5d34818,Fairgen,https://www.crunchbase.com/organization/fairgen,Seed,2500000,USD,2500000,2022-06-01,Seed,,,,Yes,Fairgen is a data debiasing platform with generative AI for more equitable data.,"Artificial Intelligence (AI), Generative AI, Information Technology, Machine Learning, Software",,"Tel Aviv, Tel Aviv, Israel, Asia",https://www.fairgen.ai,,10500000,USD,10500000,Seed,2,Tal Ventures,"Catherine Lenson, Creator Fund, Jonathan Lenson, Tal Ventures",4,,"489,995"
Venture Round - TAYGO,https://www.crunchbase.com/funding_round/taygo-series-unknown--d5a77cb3,TAYGO,https://www.crunchbase.com/organization/taygo,Venture - Series Unknown,4125325,USD,4125325,2022-07-27,,,,,Yes,TAYGO is a developer of a digital branding and marketing platform designed to expand business outreach.,"Artificial Intelligence (AI), Digital Marketing, Information Technology, Machine Learning, Marketing, Software",Women Founded,"San Carlos, California, United States, North America",https://taygo.com,Less than $1M,4125325,USD,4125325,,1,,,,,"322,679"
Pre Seed Round - My Telescope,https://www.crunchbase.com/funding_round/graviz-telescope-pre-seed--49d0248c,My Telescope,https://www.crunchbase.com/organization/graviz-telescope,Pre-Seed,2500000,EUR,2790365,2022-03-30,Seed,,,,Yes,We convert massive amount of data into insightful market facts. Introducing the Share of Search analytical platform My Telescope,"Analytics, Business Development, Machine Learning, Predictive Analytics, SaaS, Software",,"Stockholm, Stockholms Lan, Sweden, Europe",https://www.mytelescope.io,$1M to $10M,2500000,EUR,2790365,Seed,2,Vendep Capital,"Trind Ventures, Vendep Capital",2,,"327,007"
Seed Round - Fixie.ai,https://www.crunchbase.com/funding_round/fixie-ai-seed--af1deb23,Fixie.ai,https://www.crunchbase.com/organization/fixie-ai,Seed,4999998,USD,4999998,2022-07-27,Seed,,,,Yes,Fixie develops an automation platform for large language models.,"Artificial Intelligence (AI), Information Technology, Machine Learning, Software",,"Seattle, Washington, United States, North America",https://fixie.ai,,16999998,USD,16999998,Seed,2,"SignalFire, Zetta Venture Partners","Bloomberg Beta, Kearny Jackson, SignalFire, Zetta Venture Partners",4,1,"610,024"
Venture Round - Summer Robotics,https://www.crunchbase.com/funding_round/summer-robotics-series-unknown--e9601bec,Summer Robotics,https://www.crunchbase.com/organization/summer-robotics,Venture - Series Unknown,3439994,USD,3439994,2022-08-12,,,,,Yes,Summer Robotics is a machine vision company that builds robotic perception software for the industrial manufacturing and mobility markets.,"Artificial Intelligence (AI), Machine Learning, Software",,"Campbell, California, United States, North America",https://summerrobotics.ai,,3439994,USD,3439994,,1,,,,,"327,299"
Venture Round - Reynen Court,https://www.crunchbase.com/funding_round/reynen-court-series-unknown--2fe962fd,Reynen Court,https://www.crunchbase.com/organization/reynen-court,Venture - Series Unknown,4300000,USD,4300000,2022-03-08,,,,,Yes,Reynen Court enables law firms and corporate legal departments to speed their adoption of AI and other new technologies.,"Artificial Intelligence (AI), Legal Tech, Machine Learning, SaaS",,"Amsterdam, Noord-Holland, The Netherlands, Europe",https://www.reynencourt.com,$500M to $1B,23139706,USD,23139706,,5,"Bryce Catalyst, Forefront Venture Partners","Bryce Catalyst, Clifford Chance, Forefront Venture Partners, Latham & Watkins, Ventech",5,2,"610,845"
Seed Round - Sparrow Software,https://www.crunchbase.com/funding_round/sparrow-software-seed--b90f9d94,Sparrow Software,https://www.crunchbase.com/organization/sparrow-software,Seed,2500000,USD,2500000,2022-01-15,Seed,,,,Yes,"Sparrow.AI offers a no-code, AI-accessible software automation studio for healthcare systems and medical device companies.","Artificial Intelligence (AI), Health Care, Information Technology, Medical Device, Software",Women Founded,"Austin, Texas, United States, North America",https://sparrow.ai/,$1M to $10M,3500000,USD,3500000,Seed,2,,Nicklaus Brown,1,,"512,478"
Seed Round - Talentpair,https://www.crunchbase.com/funding_round/talentpair-seed--bcf460e5,Talentpair,https://www.crunchbase.com/organization/talentpair,Seed,3764879,USD,3764879,2022-12-25,Seed,,,,Yes,"Talentpair is the World's Largest Hiring and Talent Management Community for Candidates, Hiring Teams and Growth Partners.","Artificial Intelligence (AI), Human Resources, Recruiting, Software",,"Boise, Idaho, United States, North America",http://www.talentpair.com,$1M to $10M,3764879,USD,3764879,Seed,1,Quest Groups,Quest Groups,1,1,"355,731"
Series A - Dragonfly AI,https://www.crunchbase.com/funding_round/dragonfly-ai-series-a--8f4c8ad7,Dragonfly AI,https://www.crunchbase.com/organization/dragonfly-ai,Series A,3000000,GBP,3907028,2022-04-11,Early Stage Venture,,,,Yes,Dragonfly AI is a predictive visual analytics platform that simulates how attention works in the brain to show what the audience sees first.,"Analytics, Artificial Intelligence (AI), Machine Learning",,"London, England, United Kingdom, Europe",http://www.dragonflyai.co,$1M to $10M,3875000,GBP,5081266,Early Stage Venture,3,Guinness Ventures,"Capita, Downing Ventures, Guinness Ventures",3,3,"640,733"
Series A - Proportunity,https://www.crunchbase.com/funding_round/proportunity-series-a--6a22793f,Proportunity,https://www.crunchbase.com/organization/proportunity,Series A,2509000,EUR,2612344,2022-05-14,Early Stage Venture,,,,Yes,Proportunity is a financial services organisation made possible by technology.,"Artificial Intelligence (AI), Consumer Lending, Financial Services, FinTech, Lending, Machine Learning, Real Estate, Software",,"London, England, United Kingdom, Europe",https://www.proportunity.co,$1M to $10M,175291099,USD,175291099,Early Stage Venture,8,,"Kibo Ventures, VentureFriends",2,,"356,678"
Grant - Koidra,https://www.crunchbase.com/funding_round/koidra-grant--17061558,Koidra,https://www.crunchbase.com/organization/koidra,Grant,3770000,USD,3770000,2022-10-24,,,,,No,Koidra is an IT company that transforms agriculture and industrial automation with AIoT.,"Artificial Intelligence (AI), Industrial Automation, Information Technology, Internet of Things",,"Seattle, Washington, United States, North America",https://www.koidra.ai/,$1M to $10M,8270000,USD,8270000,Seed,3,U.S. Department of Agriculture,U.S. Department of Agriculture,1,,"641,793"
Seed Round - Flower,https://www.crunchbase.com/funding_round/krafthem-seed--b9d47ab0,Flower,https://www.crunchbase.com/organization/krafthem,Seed,46700000,SEK,4953357,2022-04-05,Seed,,,,Yes,Developing knowledge and AI to efficiently deploy electricity flexibility,"Artificial Intelligence (AI), Energy, Energy Efficiency, Energy Management, Hydroelectric, Power Grid",,"Stockholm, Stockholms Lan, Sweden, Europe",https://www.flowertech.se/,$1M to $10M,8926910,USD,8926910,,3,41an Invest,41an Invest,1,,"142,207"
Series A - Play Secret,https://www.crunchbase.com/funding_round/play-secret-series-a--f8462fae,Play Secret,https://www.crunchbase.com/organization/play-secret,Series A,26000000,CNY,3596625,2022-10-27,Early Stage Venture,,,,Yes,Play Secret is the most advanced life field in China,"Artificial Intelligence (AI), Machine Learning",,"Beijing, Beijing, China, Asia",http://www.happyhuo.com,,56000000,CNY,8040575,Early Stage Venture,4,,"Changshu Southeast Industrial Investment, QF Capital, Suzhou International Development Venture Capital",3,,"252,984"
Grant - Neuron Soundware,https://www.crunchbase.com/funding_round/neuron-software-grant--329506c4,Neuron Soundware,https://www.crunchbase.com/organization/neuron-software,Grant,2500000,EUR,2614423,2022-06-15,,,,,No,We develop AI solutions to maximize the performance of industrial equipment and processes by analyzing sound and other physical parameters,"Artificial Intelligence (AI), Information Technology, Internet of Things, Machine Learning, Predictive Analytics, Software",,"Prague, Hlavni mesto Praha, Czech Republic, Europe",http://neuronsw.com/,Less than $1M,13365376,USD,13365376,,10,European Innovation Council,European Innovation Council,1,,"535,378"
Series A - SimpliContract,https://www.crunchbase.com/funding_round/simplicontract-series-a--48a7b584,SimpliContract,https://www.crunchbase.com/organization/simplicontract,Series A,3500000,USD,3500000,2023-04-12,Early Stage Venture,,,,Yes,SimpliContract is an AI and SaaS-based end-to-end Contract Lifecycle Management platform for authoring and managing contracts.,"Artificial Intelligence (AI), Contact Management, Legal Tech, Productivity Tools, SaaS",,"Pleasanton, California, United States, North America",https://simplicontract.com,$1M to $10M,5300000,USD,5300000,Early Stage Venture,2,Emergent Ventures,"Emergent Ventures, Foster Ventures, Kalaari Capital, Leslie Ventures, Picus Capital, Sentinel Ventures",6,3,"253,213"
Seed Round - Timefold,https://www.crunchbase.com/funding_round/timefold-seed--97507e5c,Timefold,https://www.crunchbase.com/organization/timefold,Seed,2000000,EUR,2199252,2023-04-07,Seed,,,,Yes,The OpsAI platform for complex routing and scheduling,"Artificial Intelligence (AI), Open Source, Scheduling, Software",,"Ghent, Oost-Vlaanderen, Belgium, Europe",https://timefold.ai,,2000000,EUR,2199252,Seed,1,SmartFin,SmartFin,1,1,"535,674"
Series A - Applica,https://www.crunchbase.com/funding_round/applica-ai-series-a--86612b5f,Applica,https://www.crunchbase.com/organization/applica-ai,Series A,2000000,EUR,2259956,2022-02-02,Early Stage Venture,,,,Yes,Applica is a documentation automation platform.,"Analytics, Artificial Intelligence (AI), Machine Learning, Natural Language Processing",,"Warsaw, Mazowieckie, Poland, Europe",http://www.applica.ai,$1M to $10M,27279956,USD,27279956,M&A,8,,PKO VC,1,,"535,717"
Convertible Note - ConverSight,https://www.crunchbase.com/funding_round/thickstat-inc-convertible-note--a3bb5a34,ConverSight,https://www.crunchbase.com/organization/thickstat-inc,Convertible Note,4000000,USD,4000000,2022-01-27,,,,,No,"ConverSight is a leading unified decision intelligence solution empowering businesses with its AI assistant, Athena, and advanced analytics.","Analytics, Artificial Intelligence (AI), Generative AI, Natural Language Processing, Predictive Analytics, Software","East Asian Founded, East Asian Led","Indianapolis, Indiana, United States, North America",http://www.conversight.ai,$10M to $50M,15950000,USD,15950000,Early Stage Venture,8,Elevate Ventures,"Augment Ventures, Bread and Butter Ventures, Charmides Capital, Craig Fuller, Daren Cotter, Elevate Ventures, Rev1 Ventures, Surface Ventures",8,2,"536,625"
Series A - AIDIN ROBOTICS,https://www.crunchbase.com/funding_round/aidin-robotics-series-a--d7dddd6b,AIDIN ROBOTICS,https://www.crunchbase.com/organization/aidin-robotics,Series A,4500000000,KRW,3579159,2022-06-08,Early Stage Venture,,,,Yes,AIDIN ROBOTICS is a developer of AI-driven sensors and robotic systems.,"Artificial Intelligence (AI), Machine Learning, Robotics",,"Gunpo, Kyonggi-do, South Korea, Asia",https://www.aidinrobotics.com/,,4500000000,KRW,3579159,Early Stage Venture,2,,"BNK Venture Capital, DSC Investment, FuturePlay, Kolon Investment",4,,"190,123"
Grant - Methinks,https://www.crunchbase.com/funding_round/methinks-2e94-grant--54c1cb8d,Methinks,https://www.crunchbase.com/organization/methinks-2e94,Grant,2500000,EUR,2430375,2022-10-14,,,,,No,Deep learning in neuroimaging,"Artificial Intelligence (AI), Biotechnology, Information Technology, Life Science, Medical",,"Barcelona, Catalonia, Spain, Europe",http://www.methinks.ai/,Less than $1M,5000000,EUR,5105703,Seed,3,European Innovation Council,European Innovation Council,1,1,"537,604"
Seed Round - NLX,https://www.crunchbase.com/funding_round/nlx-b184-seed--36bf10b6,NLX,https://www.crunchbase.com/organization/nlx-b184,Seed,5000000,USD,5000000,2022-01-27,Seed,,,,Yes,NLX offers platform for automating customer experiences across channels with advanced AI and language models.,"Artificial Intelligence (AI), Customer Service, Machine Learning, SaaS",,"New York, New York, United States, North America",https://nlx.ai,$1M to $10M,21600000,USD,21600000,Early Stage Venture,4,Aquila Capital Partners,"Aquila Capital Partners, Flying Fish Partners, JetBlue Ventures, Rob Meyerson, Sage Venture Partners",5,,"402,521"
Pre Seed Round - Alltius Inc.,https://www.crunchbase.com/funding_round/alltius-inc-pre-seed--5030b45a,Alltius Inc.,https://www.crunchbase.com/organization/alltius-inc,Pre-Seed,2400000,USD,2400000,2023-05-30,Seed,,,,Yes,"Alltius develops secure, accurate, and reliable generative AI assistants for products that bring the control of LLMs to product owners.","Artificial Intelligence (AI), Customer Service, Generative AI, Machine Learning, Software",,"Los Angeles, California, United States, North America",https://www.alltius.ai,$1M to $10M,2400000,USD,2400000,Seed,2,"100x Entrepreneur, Blume Ventures, Stellaris Venture Partners","100x Entrepreneur, Amit Gupta, Ashish Gupta, Bharat Founders Fund, Binny Bansal, Blume Ventures, Deepak Garg, Eximius Ventures, Gaurav Kumar, Gemba Capital, Kartik Hosanagar, peercheque, Rahul Kumar, Serguei Netessine, Shastra VC, Stellaris Venture Partners, TiE SoCal Angels, Wharton Alumni Angels, Z5 Capital",19,1,"472,211"
Seed Round - Valory,https://www.crunchbase.com/funding_round/valory-seed--32523955,Valory,https://www.crunchbase.com/organization/valory,Seed,4000000,USD,4000000,2022-10-12,Seed,,,,Yes,"Valory is a team of scientists, engineers, and creatives who seek to deliver world architecture autonomy development at multi-agent systems.","Architecture, Artificial Intelligence (AI), Internet, Software",,"Zug, Zug, Switzerland, Europe",https://www.valory.xyz/,,4000000,USD,4000000,Seed,1,True Ventures,"Atka Capital, Primeblock Ventures, Proof Group, Semantic Ventures, Signature Ventures, True Ventures",6,,"404,774"
Seed Round - GPTZero,https://www.crunchbase.com/funding_round/gptzero-seed--41918598,GPTZero,https://www.crunchbase.com/organization/gptzero,Seed,3500000,USD,3500000,2023-05-09,Seed,,,,Yes,GPTZero develops an AI detection platform that discerns the generated content as AI produced or human written.,"Artificial Intelligence (AI), Information Technology, Natural Language Processing",,"New York, New York, United States, North America",https://gptzero.me,$1M to $10M,13500000,USD,13500000,Early Stage Venture,2,"Neo Capital, Uncork Capital","Altman Capital, Emad Mostaque, Mark Thompson, Neo Capital, Thomas Glocer, Uncork Capital",6,2,"170,489"
Seed Round - LETTRIA,https://www.crunchbase.com/funding_round/lettria-seed--72ac5c2e,LETTRIA,https://www.crunchbase.com/organization/lettria,Seed,5000000,EUR,4921924,2022-10-17,Seed,,,,Yes,LETTRIA is one of the most advanced Natural Language Processing players in the French-speaking market.,"Artificial Intelligence (AI), Education, Software",,"Paris, Ile-de-France, France, Europe",https://lettria.com,$1M to $10M,5000000,EUR,4921924,Seed,3,"Galion.exe, Jezby Ventures","Galion.exe, Jezby Ventures",2,2,"170,515"
Seed Round - Potential Motors,https://www.crunchbase.com/funding_round/potential-motors-seed--84349a87,Potential Motors,https://www.crunchbase.com/organization/potential-motors,Seed,4000000,CAD,3141073,2022-02-11,Seed,,,,Yes,Potential Motors builds computer vision software to enable vehicles to go anywhere.,"Artificial Intelligence (AI), Automotive, Electric Vehicle, Embedded Systems, Mining Technology, Recreational Vehicles",,"Fredericton, New Brunswick, Canada, North America",https://www.potentialmotors.com/,$1M to $10M,8500000,CAD,6369452,Seed,4,Brightspark Ventures,"Brightspark Ventures, Build Ventures, New Brunswick Innovation Foundation, Time Ventures",4,2,"285,102"
Pre Seed Round - Causely,https://www.crunchbase.com/funding_round/causely-509c-pre-seed--7cd9944e,Causely,https://www.crunchbase.com/organization/causely-509c,Pre-Seed,2500000,USD,2500000,2022-07-19,Seed,,,,Yes,Causely is an AI platform to eliminate human troubleshooting and enable resilient cloud application management.,Artificial Intelligence (AI),Women Founded,"Newton, Massachusetts, United States, North America",http://causely.io,$1M to $10M,13300000,USD,13300000,Seed,2,Amity Ventures,Amity Ventures,1,1,"237,665"
Seed Round - Calculum,https://www.crunchbase.com/funding_round/calculum-seed--7316b605,Calculum,https://www.crunchbase.com/organization/calculum,Seed,4191476,USD,4191476,2023-01-30,Seed,,,,Yes,Calculum is a data-as-a-service company that uses analytics and AI system to support the optimization of financial supply chains.,"Analytics, Artificial Intelligence (AI), Financial Services, FinTech, Payments, Software, Supply Chain Management",,"Miami, Florida, United States, North America",https://www.calculum.ai/,$1M to $10M,4191476,USD,4191476,Seed,1,Vestigo Ventures,"KD Venture Partners, Nevcaut Ventures, Revolution’s Rise of the Rest Seed Fund, Vestigo Ventures, XBTO Humla Ventures",5,1,"480,348"
Seed Round - Celeris Therapeutics,https://www.crunchbase.com/funding_round/celeris-therapeutics-seed--b3e207d7,Celeris Therapeutics,https://www.crunchbase.com/organization/celeris-therapeutics,Seed,3000000,EUR,3423302,2022-02-10,Seed,,,,Yes,Harnessing deep learning and lab automation to accelerate drug discovery in targeted protein degradation.,"Artificial Intelligence (AI), Biotechnology, Information Technology, Life Science, Pharmaceutical",,"Menlo Park, California, United States, North America",https://www.celeristx.com,$1M to $10M,16500000,EUR,16982404,,5,"i&i Prague, Pace Ventures Enigma","APEX Ventures, i&i Prague, Longevitytech.fund, Pace Ventures Enigma, R42 Group",5,2,"221,804"
Seed Round - FiVerity,https://www.crunchbase.com/funding_round/FiVerity-seed--6d33fe4d,FiVerity,https://www.crunchbase.com/organization/FiVerity,Seed,4000000,USD,4000000,2023-04-20,Seed,,,,Yes,Intelligent Solutions for Cyber Fraud Detection in Financial Institutions,"Artificial Intelligence (AI), Computer, Cyber Security, Financial Services, FinTech, Fraud Detection, Information Technology, Machine Learning, Software",,"Boston, Massachusetts, United States, North America",https://fiverity.com/,$1M to $10M,6000000,USD,6000000,Seed,5,Mendon Venture Partners,"Fin Capital, Grasshopper Bank, Mendon Venture Partners, Mendoza Ventures, Service Provider Capital",5,1,"221,977"
Debt Financing - Raydiant,https://www.crunchbase.com/funding_round/raydiant-debt-financing--179d477f,Raydiant,https://www.crunchbase.com/organization/raydiant,Debt Financing,5000000,USD,5000000,2022-02-16,,,,,No,Raydiant is the leading in-location experience platform for the world's largest brands,"Artificial Intelligence (AI), Digital Signage, Information Technology, Marketing",,"San Francisco, California, United States, North America",https://www.raydiant.com,$10M to $50M,70234358,USD,70234358,Early Stage Venture,7,,,,,"223,862"
Series A - Shuimu BioSciences,https://www.crunchbase.com/funding_round/shuimu-biosciences-series-a--ad6288f0,Shuimu BioSciences,https://www.crunchbase.com/organization/shuimu-biosciences,Series A,25000000,CNY,3928903,2022-04-03,Early Stage Venture,,,,Yes,Shuimu BioSciences provides one-stop solutions for cryo-EM-Powered drug discovery.,"Artificial Intelligence (AI), Biotechnology, Life Science",,"Cambridge, Massachusetts, United States, North America",https://shuimubio.com/,$1M to $10M,40000000,CNY,6083085,Early Stage Venture,2,,,,,"224,427"
Seed Round - Recast,https://www.crunchbase.com/funding_round/recast-28f3-seed--b061eb0b,Recast,https://www.crunchbase.com/organization/recast-28f3,Seed,3400000,USD,3400000,2022-12-14,Seed,21600000,USD,21600000,Yes,Recast is a media measurement platform developer for a wasted advertising budget.,"Artificial Intelligence (AI), Information Technology, Marketing Automation",,"Albany, New York, United States, North America",https://getrecast.com/,,4500000,USD,4500000,Seed,2,Lerer Hippeau,"Adam Grenier, Data Tech Fund, Jonah Goodhart, Lerer Hippeau, Vibe Capital",5,2,"389,038"
Seed Round - Reecall,https://www.crunchbase.com/funding_round/reecall-seed--cf363da3,Reecall,https://www.crunchbase.com/organization/reecall,Seed,3000000,EUR,2996249,2022-09-15,Seed,,,,Yes,Reecall is an IT firm that provides AI-based call management services.,"Artificial Intelligence (AI), Information Technology, Machine Learning, Service Industry, Software",,"Paris, Ile-de-France, France, Europe",https://reecall.com,,3000000,EUR,2996249,Seed,1,Newfund,"Evolem Start, Kima Ventures, Newfund",3,2,"389,271"
Venture Round - Optelos,https://www.crunchbase.com/funding_round/optelos-series-unknown--90c4bf5a,Optelos,https://www.crunchbase.com/organization/optelos,Venture - Series Unknown,3285429,USD,3285429,2022-10-05,,,,,Yes,Optelos is an AI visual inspection and data management platform for enterprises.,"Artificial Intelligence (AI), Data Management, Machine Learning, SaaS",,"Pflugerville, Texas, United States, North America",http://optelos.com/,$1M to $10M,3545429,USD,3545429,,2,,,,,"389,474"
Seed Round - Deep Breath Intelligence,https://www.crunchbase.com/funding_round/deep-breath-intelligence-seed--c3acf98a,Deep Breath Intelligence,https://www.crunchbase.com/organization/deep-breath-intelligence,Seed,2800000,USD,2800000,2022-07-25,Seed,,,,Yes,Deep Breath Intelligence provides breath analysis technology for medical research and daily clinical practice.,"Health Diagnostics, Machine Learning, Software",,"Rotkreuz, Zug, Switzerland, Europe",https://dbi.ch,$1M to $10M,2800000,USD,2800000,Seed,1,,,,,"246,385"
Seed Round - Aesop Technology,https://www.crunchbase.com/funding_round/aesop-technology-seed--f2f6728e,Aesop Technology,https://www.crunchbase.com/organization/aesop-technology,Seed,2950000,USD,2950000,2022-08-31,Seed,,,,Yes,"AESOP makes physician clinical documentation easier, faster and less error prone using Machine Learning on 3.2 billion patient visits.","Artificial Intelligence (AI), Health Care",,"San Francisco, California, United States, North America",https://aesoptek.com/,$1M to $10M,3935000,USD,3935000,Seed,6,Taiwania Capital Management Corporation,"500 Global, BE Capital, Colopl Next, Taiwania Capital Management Corporation",4,,"428,533"
Seed Round - Altan Insights,https://www.crunchbase.com/funding_round/altan-insights-seed--4b675c7a,Altan Insights,https://www.crunchbase.com/organization/altan-insights,Seed,4000000,USD,4000000,2022-05-24,Seed,,,,Yes,The leading platform for intelligent alternative asset investing.,"Analytics, Market Research, Predictive Analytics",,"New York, New York, United States, North America",https://www.altaninsights.com/,$1M to $10M,4000000,USD,4000000,Seed,2,Slow Ventures,"Alexis Ohanian, Courtside Ventures, Good Friends, Operator Partners, Slow Ventures",5,,"226,733"
Seed Round - Humanlinker,https://www.crunchbase.com/funding_round/humanlinker-seed--44fe9ca3,Humanlinker,https://www.crunchbase.com/organization/humanlinker,Seed,2500000,EUR,2716086,2022-04-07,Seed,,,,Yes,The cutting-edge AI guided technology for revenue generation teams,"Artificial Intelligence (AI), CRM, Lead Generation, SaaS, Sales, Software",,"Paris, Ile-de-France, France, Europe",https://www.humanlinker.com/,,3200000,EUR,3543379,Seed,2,Karista,"Clément Buyse, Frédéric Kingue Johnson, Jerome Joaug, Jonathan Benhamou, Karista, Nicolas Cazeneuve, Pascal Colin, Yohan Stern, Yvan-Michel Ehkirch",9,2,"579,926"
Series A - MOAIS,https://www.crunchbase.com/funding_round/moais-series-a--de88c04f,MOAIS,https://www.crunchbase.com/organization/moais,Series A,2500000000,KRW,2093496,2022-02-09,Early Stage Venture,,,,Yes,MOAIS develops a smartphone AI solution that analyzes golf swing problem and offers a lesson solution.,"Artificial Intelligence (AI), Software, Video",,"Seoul, Seoul-t'ukpyolsi, South Korea, Asia",http://www.moais.co.kr/,,2500000000,KRW,2093496,Early Stage Venture,4,,"Creatz, Daekyo Investment, KB Investment",3,1,"227,273"
Seed Round - Revero,https://www.crunchbase.com/funding_round/revero-seed--94b0bc75,Revero,https://www.crunchbase.com/organization/revero,Seed,5000000,USD,5000000,2022-11-03,Seed,,,,Yes,Our mission is to reverse autoimmune and other chronic diseases by addressing the root causes,"Health Care, Machine Learning, Medical","Middle Eastern / North African Founded, Women Founded, Women Led","San Francisco, California, United States, North America",https://revero.com,$1M to $10M,5000000,USD,5000000,Seed,3,,"Andreessen Horowitz, CapitalX, Goodwater Capital, Think + Ventures",4,,"227,744"
