Series A - nPlan,https://www.crunchbase.com/funding_round/nplan-series-a--6beaa975,nPlan,https://www.crunchbase.com/organization/nplan,Series A,13430000,GBP,18440431,2021-03-23,Early Stage Venture,,,,Yes,"Artificial Intelligence to provide schedule certainty for projects, by highlighting risk and suggesting optimal execution paths.","Artificial Intelligence (AI), Construction, Machine Learning, Project Management, Scheduling",,"London, England, United Kingdom, Europe",http://www.nplan.io,$1M to $10M,16430000,GBP,22381126,Early Stage Venture,4,Google Ventures,"Entrepreneur First, Google Ventures, Ian Davis, LocalGlobe, Pentech Ventures",5,1,"471,747"
Series B - Cogniac,https://www.crunchbase.com/funding_round/cogniac-series-b--829949f7,Cogniac,https://www.crunchbase.com/organization/cogniac,Series B,20000000,USD,20000000,2021-10-27,Early Stage Venture,,,,Yes,Cogniac is a SaaS-based computer vision platform.,"Artificial Intelligence (AI), Computer Vision, Enterprise, Software",Women Founded,"San Jose, California, United States, North America",http://www.cogniac.ai,$1M to $10M,40100000,USD,40100000,Early Stage Venture,6,National Grid Partners (NGP),"Autotech Ventures, Cisco Investments, Energy Innovation Capital, London Technology Club, National Grid Partners (NGP), Vanedge Capital, Wing Venture Capital",7,3,"214,783"
Series C - Astera Labs,https://www.crunchbase.com/funding_round/astera-labs-series-c--fc93631c,Astera Labs,https://www.crunchbase.com/organization/astera-labs,Series C,50000000,USD,50000000,2021-09-27,Late Stage Venture,900000000,USD,900000000,Yes,Astera Labs is a semiconductor company that provides connectivity solutions for intelligent systems.,"Automotive, Electronics, Intelligent Systems, Semiconductor",,"Santa Clara, California, United States, North America",https://www.asteralabs.com,$100M to $500M,206350000,USD,206350000,IPO,4,Fidelity,"Atreides Management, Avigdor Willenz, Fidelity, GlobalLink1 Capital, Intel Capital, Sutter Hill Ventures, Valor Equity Partners, VentureTech Alliance",8,2,"181,937"
Series A - IDVerse - An OCR Labs Company,https://www.crunchbase.com/funding_round/ocr-labs-series-a--58a01a43,IDVerse - An OCR Labs Company,https://www.crunchbase.com/organization/ocr-labs,Series A,15000000,USD,15000000,2021-06-15,Early Stage Venture,,,,Yes,IDVerse uses generative AI to deliver an end-to-end SaaS solution to global businesses for customer identity verification & fraud protection,"Artificial Intelligence (AI), Computer Vision, FinTech, Fraud Detection, Generative AI, Identity Management, Information Technology",,"London, England, United Kingdom, Europe",https://idverse.com/,$1M to $10M,45000000,USD,45000000,Early Stage Venture,2,OYAK,OYAK,1,,"182,545"
Series A - BigHat Biosciences,https://www.crunchbase.com/funding_round/bighat-biosciences-series-a--cbba8cab,BigHat Biosciences,https://www.crunchbase.com/organization/bighat-biosciences,Series A,19000000,USD,19000000,2021-02-10,Early Stage Venture,,,,Yes,BigHat Biosciences is a protein therapeutics company that develops an antibody design platform guided by artificial intelligence.,"Artificial Intelligence (AI), Biotechnology, Medical, Therapeutics",Women Founded,"San Mateo, California, United States, North America",http://www.bighatbio.com,,99302511,USD,99302511,Early Stage Venture,4,Andreessen Horowitz,"8VC, AME Cloud Ventures, Andreessen Horowitz, Innovation Endeavors",4,1,"182,865"
Series B - Physna,https://www.crunchbase.com/funding_round/physna-series-b--a7865b4d,Physna,https://www.crunchbase.com/organization/physna,Series B,56000000,USD,56000000,2021-07-01,Early Stage Venture,,,,Yes,"Physna is a geometric deep-learning and 3D search company that searches, compares, and analyzes 3D models.","3D Technology, Machine Learning, Software",,"Columbus, Ohio, United States, North America",https://physna.com/,Less than $1M,85000000,USD,85000000,Early Stage Venture,4,Tiger Global Management,"Google Ventures, Sequoia Capital, Tiger Global Management",3,3,"194,630"
Series E - Eightfold AI,https://www.crunchbase.com/funding_round/eightfold-series-e--65f7c0fe,Eightfold AI,https://www.crunchbase.com/organization/eightfold,Series E,220000000,USD,220000000,2021-06-10,Late Stage Venture,1880000000,USD,1880000000,Yes,"Eightfold AI provides a complete AI platform for talent management to help companies find, recruit, and retain workers.","Artificial Intelligence (AI), Business Intelligence, Human Resources, Information Technology, Recruiting, SaaS",,"Santa Clara, California, United States, North America",https://eightfold.ai,$50M to $100M,396750000,USD,396750000,Late Stage Venture,5,SoftBank Vision Fund,"Capital One Ventures, Foundation Capital, General Catalyst, IVP, Lightspeed Venture Partners, SoftBank Vision Fund",6,2,"428,383"
Series A - Lacuna Technologies,https://www.crunchbase.com/funding_round/lacuna-technologies-series-a--0739ac88,Lacuna Technologies,https://www.crunchbase.com/organization/lacuna-technologies,Series A,16000000,USD,16000000,2021-07-07,Early Stage Venture,,,,Yes,Lacuna Technologies helps transportation agencies better manage the public right-of-way.,"Artificial Intelligence (AI), Machine Learning, Software",,"Palo Alto, California, United States, North America",http://www.lacuna.ai,$1M to $10M,16000000,USD,16000000,Early Stage Venture,1,Xplorer Capital,"Citi Impact Fund, JetBlue Ventures, Lauder Partners, Playground Global, Xplorer Capital",5,3,"603,065"
Series B - Comet,https://www.crunchbase.com/funding_round/comet-ml-series-b--395ded3c,Comet,https://www.crunchbase.com/organization/comet-ml,Series B,50000000,USD,50000000,2021-11-18,Early Stage Venture,,,,Yes,"Comet allows data scientists to automatically track their datasets, code changes, experimentation history, and production models.","Artificial Intelligence (AI), Developer Tools, Machine Learning, Software",,"New York, New York, United States, North America",http://www.comet.com,$10M to $50M,69800000,USD,69800000,Early Stage Venture,5,OpenView,"OpenView, Scale Venture Partners, Trilogy Equity Partners, Two Sigma Ventures",4,4,"195,006"
Venture Round - Lunit,https://www.crunchbase.com/funding_round/lunit-inc-series-unknown--9d28ebde,Lunit,https://www.crunchbase.com/organization/lunit-inc,Venture - Series Unknown,61000000,USD,61000000,2021-11-29,,,,,Yes,Lunit is a medical technology company that specializes in developing and providing AI-powered medical imaging solutions.,"Artificial Intelligence (AI), Computer Vision, Health Diagnostics, Image Recognition, Machine Learning, Medical Device, Software",,"Seoul, Seoul-t'ukpyolsi, South Korea, Asia",https://www.lunit.io,$1M to $10M,560734566,USD,560734566,IPO,11,,"BrightEdge, Casdin Capital, HealthQuest Capital, IMM Investment, Kakao Ventures, Legend Capital, Mirae Asset Venture Investment, Naver, Naver Cloud, NSG Ventures, SBVA, Tybourne Capital Management",12,3,"428,623"
Series B - Lengoo,https://www.crunchbase.com/funding_round/lengoo-gmbh-series-b--cfd0484e,Lengoo,https://www.crunchbase.com/organization/lengoo-gmbh,Series B,30000000,USD,30000000,2021-02-09,Early Stage Venture,,,,Yes,Enterprise platform for expert AI systems,"Artificial Intelligence (AI), Machine Learning, Natural Language Processing, Software",,"Berlin, Berlin, Germany, Europe",https://www.lengoo.com,$1M to $10M,36578103,USD,36578103,Early Stage Venture,3,Inkef,"Atempo Growth, Creathor Ventures, Inkef, Matthias Hilpert, Michael Schmitt, Polipo Ventures, redalpine, Techstars, Volker Pyrtek",9,1,"195,132"
Series A - Moore Threads,https://www.crunchbase.com/funding_round/moore-threads-series-a--c7a6f42e,Moore Threads,https://www.crunchbase.com/organization/moore-threads,Series A,2000000000,CNY,313136058,2021-11-25,Early Stage Venture,,,,Yes,Moore Threads providing graphics processing unit technology and services to corporate clients.,"Artificial Intelligence (AI), Gaming, Hardware, Semiconductor",,"Haidian, Beijing, China, Asia",https://www.mthreads.com,,3500614792,CNY,528735039,Early Stage Venture,5,"5Y Capital, Bohai Industrial Investment Fund Management, Guosheng Group","5Y Capital, Bohai Industrial Investment Fund Management, ByteDance, CCB International, China Merchants Securities, Guosheng Group, Hubei Hongtai State-owned Capital Investment Operation Group, Qianhai Fund of Funds, Tencent",9,1,"195,701"
Series A - Ramon.Space,https://www.crunchbase.com/funding_round/ramon-space-series-a--a9f09564,Ramon.Space,https://www.crunchbase.com/organization/ramon-space,Series A,17500000,USD,17500000,2021-05-25,Early Stage Venture,,,,Yes,Ramon.Space builds space-resilient computing infrastructure,"Aerospace, Computer, Electronics, Machine Learning, Semiconductor, Software",Middle Eastern / North African Founded,"Los Altos, California, United States, North America",https://www.ramon.space,$10M to $50M,43500000,USD,43500000,Early Stage Venture,3,StageOne Ventures,"Deep Insight, Grove Ventures, StageOne Ventures, UMC Capital, WorldQuant Ventures LLC",5,5,"196,220"
Venture Round - Illumigyn,https://www.crunchbase.com/funding_round/illumigyn-series-unknown--0eb00d9b,Illumigyn,https://www.crunchbase.com/organization/illumigyn,Venture - Series Unknown,33000000,USD,33000000,2021-11-03,,,,,Yes,Illumigyn incorporates existing machine vision technologies into a compact imaging colposcope for medical applications.,"Artificial Intelligence (AI), Health Care, Health Diagnostics, Medical Device, Product Design",,"Neve Ilan, Yerushalayim, Israel, Asia",http://illumigyn.com/,$1M to $10M,33000000,USD,33000000,,1,"Ubicom Holdings, Yozma Group","Ubicom Holdings, Yozma Group",2,1,"197,267"
Series B - ClosedLoop,https://www.crunchbase.com/funding_round/closedloop-ai-series-b--9971f6f4,ClosedLoop,https://www.crunchbase.com/organization/closedloop-ai,Series B,34000000,USD,34000000,2021-08-17,Early Stage Venture,,,,Yes,"ClosedLoop is healthcare's data science platform, helping healthcare organizations use AI / ML to improve outcomes and reduce costs.","Artificial Intelligence (AI), Health Care, Machine Learning",,"Austin, Texas, United States, North America",https://www.closedloop.ai,$1M to $10M,49073138,USD,49073138,,6,Titanium Ventures,".406 Ventures, Adam Boehler, Breyer Capital, Greycroft, love spells lotto spells money spells marriage spells ( powerful spell caster), Sam Palmisano, Titanium Ventures",7,3,"198,297"
Series B - Owkin,https://www.crunchbase.com/funding_round/owkin-2-series-b--476b4821,Owkin,https://www.crunchbase.com/organization/owkin-2,Series B,180000000,USD,180000000,2021-11-18,Early Stage Venture,820000000,USD,820000000,Yes,Owkin is an AI precision medicine company with a vision to find the right drug for every patient.,"Artificial Intelligence (AI), Biotechnology, Clinical Trials, Machine Learning, Pharmaceutical, Precision Medicine",,"New York, New York, United States, North America",http://www.owkin.com,$1M to $10M,304100000,USD,304100000,Early Stage Venture,8,Sanofi,Sanofi,1,,"473,129"
Series B - Gaussian Robot,https://www.crunchbase.com/funding_round/gaussian-robot-series-b--014cd3fa,Gaussian Robot,https://www.crunchbase.com/organization/gaussian-robot,Series B,100000000,USD,100000000,2021-04-14,Early Stage Venture,370000000,USD,370000000,Yes,Gaussian Robot is a robotics company that develops intelligent cleaning robots.,"Artificial Intelligence (AI), Robotics",,"Shanghai, Shanghai, China, Asia",http://www.gs-robot.com/,$1M to $10M,394654068,USD,394654068,Late Stage Venture,10,Longfor Group,"Broad Vision Funds, Longfor Group, Meituan, Tencent",4,,"473,395"
Series B - Buildots,https://www.crunchbase.com/funding_round/buildots-series-b--78404993,Buildots,https://www.crunchbase.com/organization/buildots,Series B,30000000,USD,30000000,2021-08-04,Early Stage Venture,,,,Yes,Buildots specializes in transforming construction sites into a data-driven digital environment.,"Artificial Intelligence (AI), Construction, PropTech, Software",,"Tel Aviv, Tel Aviv, Israel, Asia",http://buildots.com,$10M to $50M,121000000,USD,121000000,,5,Lightspeed Venture Partners,"Future Energy Ventures, Lightspeed Venture Partners, Maor Investments, Tidhar, TLV Partners",5,3,"234,540"
Series A - Apella Technology,https://www.crunchbase.com/funding_round/apella-technology-series-a--a4cf093e,Apella Technology,https://www.crunchbase.com/organization/apella-technology,Series A,21000000,USD,21000000,2021-12-20,Early Stage Venture,,,,Yes,Apella Technology is an AI startup that brings modern engineering to improve surgery.,"Artificial Intelligence (AI), Health Care, Machine Learning, Medical, Sensor, Software, Wellness",,"Oakland, California, United States, North America",https://apella.io,$1M to $10M,24000000,USD,24000000,Early Stage Venture,2,Casdin Capital,"Casdin Capital, Operator Partners, PFM Health Sciences, Twine Ventures, Upside Partnership, Vensana Capital",6,2,"475,006"
Series A - Carta Healthcare,https://www.crunchbase.com/funding_round/carta-healthcare-series-a--3117e9c5,Carta Healthcare,https://www.crunchbase.com/organization/carta-healthcare,Series A,17300000,USD,17300000,2021-04-07,Early Stage Venture,,,,Yes,Carta Healthcare empowers hospitals to personalize the delivery of care to the individual needs of each patient.,"Delivery, Health Care, Hospital, Machine Learning",Women Founded,"San Francisco, California, United States, North America",http://www.carta.healthcare,Less than $1M,42300000,USD,42300000,Early Stage Venture,6,Storm Ventures,"Asset Management Ventures (AMV), Atypical Ventures, Healthy Ventures, Katalyst Ventures, Mass General Brigham Ventures, Maverick Ventures, Seven Peaks Ventures, Storm Ventures, The CU Healthcare Innovation Fund, Waterline Ventures",10,4,"638,258"
Series A - Lvzhou Technology,https://www.crunchbase.com/funding_round/lvzhou-technology-series-a--d8af29bb,Lvzhou Technology,https://www.crunchbase.com/organization/lvzhou-technology,Series A,90000000,CNY,14116097,2021-12-20,Early Stage Venture,,,,Yes,Lvzhou Technology is an AIOS control center platform based on AI and IoT to achieve intelligent management in the energy and battery areas.,"Artificial Intelligence (AI), Battery, Energy, Internet of Things",,"Hefei, Anhui, China, Asia",http://www.ahlzkj.com/,,90000000,CNY,14116097,Early Stage Venture,1,"CAS Star, CRYSTAL VENTURES, Hefei High-tech VC, Stone Capital, Zhejiang University","CAS Star, CRYSTAL VENTURES, Hefei High-tech VC, Stone Capital, Zhejiang University",5,,"476,764"
Series B - MachineMetrics,https://www.crunchbase.com/funding_round/machinemetrics-series-b--c3a0988c,MachineMetrics,https://www.crunchbase.com/organization/machinemetrics,Series B,20000000,USD,20000000,2021-06-16,Early Stage Venture,,,,Yes,MachineMetrics is an Industrial IoT analytics and machine monitoring platform that empowers customers through real-time data.,"Analytics, Industrial Automation, Internet, Manufacturing, Predictive Analytics, SaaS, Software",,"Northampton, Massachusetts, United States, North America",http://www.machinemetrics.com/,$1M to $10M,37654263,USD,37654263,Early Stage Venture,6,Teradyne,"Hyperplane, Ridgeline, Teradyne, Tola Capital",4,1,"477,037"
Seed Round - Healthee,https://www.crunchbase.com/funding_round/insurights-seed--1143476d,Healthee,https://www.crunchbase.com/organization/insurights,Seed,26000000,USD,26000000,2021-10-19,Seed,,,,Yes,Healthee is an AI-driven benefits administration technology that provides customized responses to employee health benefits questions.,"Artificial Intelligence (AI), Fitness, Health Care, InsurTech, Medical",,"New York, New York, United States, North America",https://healthee.co,$1M to $10M,59500000,USD,59500000,Early Stage Venture,5,Group 11,"Cresson Management, Good Company, Group 11, InsurTech Israel",4,1,"282,229"
Series A - Bodo.ai,https://www.crunchbase.com/funding_round/bodo-ai-series-a--1289b39e,Bodo.ai,https://www.crunchbase.com/organization/bodo-ai,Series A,22500000,USD,22500000,2021-12-15,Early Stage Venture,,,,Yes,The Python Supercomputing Analytics Platform,"Analytics, Artificial Intelligence (AI)",,"San Francisco, California, United States, North America",https://bodo.ai/,$1M to $10M,25500000,USD,25500000,Early Stage Venture,2,,"Candou Ventures, Dell Technologies Capital, Fusion Fund, Koch Disruptive Technologies, Snowflake, Uncorrelated Ventures, Xilinx",7,,"216,299"
Series B - WeRide,https://www.crunchbase.com/funding_round/werideai-series-b--e02c9264,WeRide,https://www.crunchbase.com/organization/werideai,Series B,300000000,USD,300000000,2021-01-13,Early Stage Venture,,,,Yes,WeRide is an autonomous driving company that provides safer and more efficient mobility services and solutions.,"Artificial Intelligence (AI), Autonomous Vehicles, Computer, Software",,"Guangzhou Shi, Guangdong, China, Asia",https://www.weride.ai,$10M to $50M,1110000000,USD,1110000000,,6,Zhengzhou Yutong Bus,"CDB Equipment Manufacturing Industial Investment Fund, CICC, CMC Capital Group, Hengjian Emerging Industries Fund, Huajin Capital, Qiming Venture Partners, Sinovation Ventures, Zhengzhou Yutong Bus",8,1,"516,161"
Seed Round - Spiden,https://www.crunchbase.com/funding_round/spiden-seed--bdf8d404,Spiden,https://www.crunchbase.com/organization/spiden,Seed,18000000,USD,18000000,2021-04-29,Seed,,,,Yes,Spiden provides and develops products that enable real-time and continuous monitoring of blood biomarkers.,"Artificial Intelligence (AI), Biotechnology",,"Freienbach, Schwyz, Switzerland, Europe",https://www.spiden.com,$1M to $10M,40250000,USD,40250000,Seed,3,Ornament Health,"b2venture, Daniel Gutenberg, Edward Ludwig, Geberit, Kirill Evstratov, Konstantin Othmer, Ornament Health, Young Sohn",8,,"217,297"
Series B - Recogni,https://www.crunchbase.com/funding_round/recogni-series-b--aafbb770,Recogni,https://www.crunchbase.com/organization/recogni,Series B,48900000,USD,48900000,2021-02-17,Early Stage Venture,,,,Yes,"Recogni is a system solution company that specializes in the design of high-performance, low-power AI inferencing","Artificial Intelligence (AI), Autonomous Vehicles, Semiconductor, Software",Women Founded,"San Jose, California, United States, North America",https://recogni.com,$1M to $10M,176050000,USD,176050000,Late Stage Venture,5,Celesta Capital,"BMW i Ventures, Bosch Ventures, Celesta Capital, Continental, DNS Capital, Fluxunit - Osram Ventures, GreatPoint Ventures, Mayfield Fund, Toyota Ventures",9,4,"219,611"
Series B - Briq,https://www.crunchbase.com/funding_round/brickschain-series-b--0baa9a96,Briq,https://www.crunchbase.com/organization/brickschain,Series B,30000000,USD,30000000,2021-06-07,Early Stage Venture,,,,Yes,Briq is a financial automation platform that utilizes artificial intelligence to automate finances in construction.,"Artificial Intelligence (AI), Construction, Financial Services, FinTech, SaaS",,"Santa Barbara, California, United States, North America",http://briq.com/,$1M to $10M,54000000,USD,54000000,Early Stage Venture,5,Tiger Global Management,"Blackhorn Ventures, Eniac Ventures, Tiger Global Management",3,6,"352,245"
Series C - ScreenPoint Medical,https://www.crunchbase.com/funding_round/screenpoint-medical-series-c--0655e776,ScreenPoint Medical,https://www.crunchbase.com/organization/screenpoint-medical,Series C,28000000,USD,28000000,2021-07-27,Late Stage Venture,,,,Yes,ScreenPoint develops Deep Learning and image analysis technology for automated reading of mammograms.,"Analytics, Artificial Intelligence (AI), Machine Learning, Medical, Software",,"Nijmegen, Gelderland, The Netherlands, Europe",https://www.screenpoint-medical.com,Less than $1M,33017444,USD,33017444,Late Stage Venture,2,Insight Partners,"Insight Partners, OostNL, Siemens Healthineers",3,1,"353,060"
Venture Round - mfine,https://www.crunchbase.com/funding_round/mfine-series-unknown--8cf72ec4,mfine,https://www.crunchbase.com/organization/mfine,Venture - Series Unknown,16000000,USD,16000000,2021-01-18,,,,,Yes,Mfine is a health-tech startup developing an AI-powered telemedicine mobile app.,"Apps, Artificial Intelligence (AI), Health Care, Hospital, Medical",,"Bengaluru, Karnataka, India, Asia",https://www.mfine.co/,$50M to $100M,97568082,USD,97568082,Late Stage Venture,7,Heritas Capital,"Alteria Capital, BEENEXT, Heritas Capital, SBI Investment, SBI Ven Capital, YS Investment",6,5,"353,308"
Series B - Deep Vision,https://www.crunchbase.com/funding_round/deep-vision-2-series-b--836f1e68,Deep Vision,https://www.crunchbase.com/organization/deep-vision-2,Series B,35000000,USD,35000000,2021-09-15,Early Stage Venture,,,,Yes,"Embedded deep learning computer vision solution for drones, robots, and IOT cameras","Artificial Intelligence (AI), Autonomous Vehicles, Big Data, Computer Vision, Machine Learning, Robotics",,"Los Altos, California, United States, North America",,Less than $1M,35000000,USD,35000000,Early Stage Venture,3,Tiger Global Management,"Exfinity Venture Partners, Silicon Motion Technology, Tiger Global Management, Western Digital",4,1,"353,331"
Series C - Botkeeper,https://www.crunchbase.com/funding_round/botkeeper-series-c--aec1e27d,Botkeeper,https://www.crunchbase.com/organization/botkeeper,Series C,42000000,USD,42000000,2021-11-04,Late Stage Venture,,,,Yes,"An intelligent bookkeeping automation platform powered by human-assisted AI, purpose built for accounting professionals.","Accounting, Artificial Intelligence (AI), Bookkeeping and Payroll, Business Intelligence, Finance, FinTech, Machine Learning, Software",Women Founded,"St. Petersburg, Florida, United States, North America",https://www.botkeeper.com/,$50M to $100M,89500000,USD,89500000,Late Stage Venture,4,Grand Oaks Capital,Grand Oaks Capital,1,,"169,235"
Series A - Wizard,https://www.crunchbase.com/funding_round/wizard-2993-series-a--ca1873b7,Wizard,https://www.crunchbase.com/organization/wizard-2993,Series A,50000000,USD,50000000,2021-10-06,Early Stage Venture,,,,Yes,Wizard operates a commerce technology startup to transform e-commerce with conversational AI.,"Artificial Intelligence (AI), E-Commerce, Machine Learning, Messaging, Natural Language Processing, SMS","Women Founded, Women Led","New York, New York, United States, North America",https://www.wizard-inc.us,,50000000,USD,50000000,Early Stage Venture,1,New Enterprise Associates,"Accel, Marc Lore, New Enterprise Associates",3,2,"406,297"
Series B - OctoAI,https://www.crunchbase.com/funding_round/octoml-series-b--2b723415,OctoAI,https://www.crunchbase.com/organization/octoml,Series B,28000000,USD,28000000,2021-03-17,Early Stage Venture,,,,Yes,OctoAI is a generative AI platform that powers high-scale applications.,"Artificial Intelligence (AI), Computer, Machine Learning, Software",,"Seattle, Washington, United States, North America",https://octo.ai,$1M to $10M,131900000,USD,131900000,Late Stage Venture,4,Addition,"Addition, Amplify Partners, Madrona",3,1,"355,708"
Series A - Anthropic,https://www.crunchbase.com/funding_round/anthropic-series-a--61db4cbd,Anthropic,https://www.crunchbase.com/organization/anthropic,Series A,124000000,USD,124000000,2021-05-28,Early Stage Venture,550000000,USD,550000000,Yes,Anthropic is an AI safety and research company that focuses on increasing the safety of large-scale AI systems.,"Artificial Intelligence (AI), Generative AI, Information Technology, Machine Learning",Women Founded,"San Francisco, California, United States, North America",https://www.anthropic.com,,9740377627,USD,9740377627,Late Stage Venture,10,Jaan Tallinn,"Center for Emerging Risk Research, Dustin Moskovitz, Eric Schmidt, Jaan Tallinn, James McClave",5,,"356,239"
Series C - Kore.ai,https://www.crunchbase.com/funding_round/kore-ai-series-c--19e58f62,Kore.ai,https://www.crunchbase.com/organization/kore-ai,Series C,50000000,USD,50000000,2021-09-29,Late Stage Venture,,,,Yes,Kore.ai offers AI-powered virtual assistants and applications for enhancing customer and employee experiences across various industries.,"Artificial Intelligence (AI), Chatbot, Collaboration, Enterprise Software, Generative AI, Machine Learning, Natural Language Processing",,"Orlando, Florida, United States, North America",https://kore.ai,$100M to $500M,223500000,USD,223500000,Late Stage Venture,6,"PNC, Vistara Growth","Beedie Capital, NextEquity Partners, Nicola Wealth Management, PNC, Vistara Growth",5,2,"357,165"
Series A - AXON Networks,https://www.crunchbase.com/funding_round/axon-networks-series-a--51bdf55f,AXON Networks,https://www.crunchbase.com/organization/axon-networks,Series A,27000000,USD,27000000,2021-04-13,Early Stage Venture,,,,Yes,"AXON Networks delivers an AI-driven, analytics-based orchestration platform.","Artificial Intelligence (AI), Information Technology",,"Irvine, California, United States, North America",https://www.axon-networks.com/,$1M to $10M,27000000,USD,27000000,Early Stage Venture,1,,,,,"459,958"
Post-IPO Debt - Veritone,https://www.crunchbase.com/funding_round/veritone-post-ipo-debt--6f87d476,Veritone,https://www.crunchbase.com/organization/veritone,Post-IPO Debt,201250000,USD,201250000,2021-11-17,,,,,No,Veritone has created a future-proof AI platform that comprehends and transforms multiple forms of data to create actionable intelligence.,"Artificial Intelligence (AI), Asset Management, CivicTech, GovTech, Information Technology, Machine Learning, Search Engine, Speech Recognition, Visual Search",,"Irvine, California, United States, North America",https://www.veritone.com,$100M to $500M,392775000,USD,392775000,IPO,7,,,,,"205,829"
