Transaction Name,Transaction Name URL,Organization Name,Organization Name URL,Funding Type,Money Raised,Money Raised Currency,Money Raised (in USD),Announced Date,Funding Stage,Pre-Money Valuation,Pre-Money Valuation Currency,Pre-Money Valuation (in USD),Equity Only Funding,Organization Description,Organization Industries,Diversity Spotlight,Organization Location,Organization Website,Organization Revenue Range,Total Funding Amount,Total Funding Amount Currency,Total Funding Amount (in USD),Funding Status,Number of Funding Rounds,Lead Investors,Investor Names,Number of Investors,Number of Partner Investors,CB Rank (Funding Round)
Series A - OfferFit,https://www.crunchbase.com/funding_round/offerfit-series-a--50c7646e,OfferFit,https://www.crunchbase.com/organization/offerfit,Series A,14000000,USD,14000000,2021-11-16,Early Stage Venture,,,,Yes,We are an automated experimentation platform that makes A/B testing obsolete.,"Artificial Intelligence (AI), Machine Learning, Marketing Automation",,"Boston, Massachusetts, United States, North America",http://OfferFit.ai,$10M to $50M,39000000,USD,39000000,Early Stage Venture,4,"Canvas Ventures, Harmony Partners","AfterWork Ventures, Alex Clayton, Alumni Ventures, Black Nova Group, Bradley Horowitz, Burst Capital, Canvas Ventures, Carbide Ventures, Frederic Kerrest, GTMfund, Harmony Partners, Jacques D. Kerrest, Jeffrey Bazar, Jeremy Stoppelman, Katelyn Donnelly, Kevin Stumpf, Luther Lowe, Michael Stoppelman, Pareto Holdings, Ryan Carlson, Samuel Adeyemo, Sean Buckley, TMD Ventures, Tushar Garg",24,4,"5,788"
Series C - Groq,https://www.crunchbase.com/funding_round/groq-series-c--e0766e1a,Groq,https://www.crunchbase.com/organization/groq,Series C,300000000,USD,300000000,2021-04-14,Late Stage Venture,800000000,USD,800000000,Yes,"Groq radically simplifies compute to accelerate workloads in artificial intelligence, machine learning, and high-performance computing.","Electronics, Machine Learning, Semiconductor",,"Mountain View, California, United States, North America",http://groq.com,,362550552,USD,362550552,,6,"D1 Capital Partners, Tiger Global Management","Addition, Alumni Ventures, Boardman Bay Capital Management, Castor Ventures, D1 Capital Partners, Firebolt Ventures, GCM Grosvenor, General Global Capital, Infinitum Partners, Junipero Capital, TDK Ventures, The Spruce House Partnership, Tiger Global Management, Tru Arrow Partners, Verdure Capital Management, XN, XTX Ventures",17,3,"6,109"
Series D - Tekion,https://www.crunchbase.com/funding_round/tekion-series-d--5068b137,Tekion,https://www.crunchbase.com/organization/tekion,Series D,250000000,USD,250000000,2021-10-05,Late Stage Venture,3250000000,USD,3250000000,Yes,Tekion is a software development company that develops business applications on the cloud.,"Artificial Intelligence (AI), Automotive, Big Data, Machine Learning, Management Information Systems, Software",,"Pleasanton, California, United States, North America",http://www.tekion.com,,635100000,USD,635100000,,7,"Alkeon Capital, Durable Capital Partners","Advent International, Alkeon Capital, Durable Capital Partners, Holman Growth Ventures, Hyundai Motor Company, Index Ventures",6,7,"8,783"
Series B - Inkbit,https://www.crunchbase.com/funding_round/inkbit-series-b--4ee8fab3,Inkbit,https://www.crunchbase.com/organization/inkbit,Series B,30000000,USD,30000000,2021-07-20,Early Stage Venture,,,,Yes,Inkbit creats a next-generation additive manufacturing platform that combines 3D printing with machine vision.,"3D Printing, 3D Technology, Machine Learning, Manufacturing, Software",Hispanic / Latine Founded,"Medford, Massachusetts, United States, North America",https://inkbit3d.com/,$1M to $10M,63824998,USD,63824998,,5,Phoenix Venture Partners,"3M, Alumni Ventures, Castor Ventures, DSM Venturing, IMA, MassVentures, Ocado Group, Phoenix Venture Partners, Saint-Gobain, Stratasys",10,1,"9,605"
Funding Round - AUI™ (Augmented Intelligence) Inc.,https://www.crunchbase.com/funding_round/augmentedintelligence-undisclosed--f67cfb0c,AUI™ (Augmented Intelligence) Inc.,https://www.crunchbase.com/organization/augmentedintelligence,Funding Round,22000000,USD,22000000,2021-01-03,,108000000,USD,108000000,Yes,Controllable Language Models™,Artificial Intelligence (AI),,"New York, New York, United States, North America",http://www.aui.io,$1M to $10M,43135000,USD,43135000,,5,,"Aron Ain, Bradley M. Bloom, Chris Varelas, David Mendels, David Perlmutter, James Whitehurst, Joshua Boger, New England Development, New Era Capital Partners, The Kraft Group",10,,"10,219"
Series C - DataStory,https://www.crunchbase.com/funding_round/datastory-series-c--cea3770d,DataStory,https://www.crunchbase.com/organization/datastory,Series C,150000000,CNY,23445926,2021-06-16,Late Stage Venture,,,,Yes,DataStory is a big data and AI intelligent business application provider.,"Artificial Intelligence (AI), Big Data, Information Technology",,"Guangzhou, Guangdong, China, Asia",https://www.datastory.com.cn/,$1M to $10M,104620747,USD,104620747,Late Stage Venture,4,,"Cathay Health, Guangdong Science and Technology Venture Capital, JCP Capital, Zhuhai Da Heng Qin",4,,"10,127"
Series A - Formlogic,https://www.crunchbase.com/funding_round/formlogic-3def-series-a--281e03c6,Formlogic,https://www.crunchbase.com/organization/formlogic-3def,Series A,20400000,USD,20400000,2021-06-10,Early Stage Venture,,,,Yes,Formlogic is an autonomous manufacturing company that uses machine learning and physics simulation to precision parts.,"Artificial Intelligence (AI), Industrial Automation, Industrial Engineering, Machine Learning, Manufacturing, Mechanical Engineering",,"Pittsburgh, Pennsylvania, United States, North America",https://www.formlogic.com/,,40400000,USD,40400000,Early Stage Venture,5,Two Sigma Ventures,"10x Founders, 116 Street Ventures, 8VC, Alumni Ventures, Blue Ivy Ventures, Quest Venture Partners, Streamlined Ventures, The Yard Ventures, Trinity Capital, Triphammer Ventures, Two Sigma Ventures",11,1,"10,314"
Venture Round - UISEE,https://www.crunchbase.com/funding_round/uisee-series-unknown--5092c0e7,UISEE,https://www.crunchbase.com/organization/uisee,Venture - Series Unknown,1000000000,CNY,154325751,2021-01-25,,,,,Yes,UISEE provides leading-edge products on autonomous driving and transformative services on mobility on demand.,"Autonomous Vehicles, Machine Learning, Robotics",,"Haidian, Beijing, China, Asia",http://www.uisee.com/,$50M to $100M,1000000000,CNY,154325751,Late Stage Venture,5,"National Manufacturing Transformation and Upgrading Fund, Upgrade Fund","CAS Star, Century Golden Resources Group, China Development Bank Capital, Keyuan Industry Fund, National Manufacturing Transformation and Upgrading Fund, Upgrade Fund, Wuxi Capital",7,,"10,508"
Private Equity Round - Penten,https://www.crunchbase.com/funding_round/penten-private-equity--6185a08f,Penten,https://www.crunchbase.com/organization/penten,Private Equity,50000000,USD,50000000,2021-08-15,Private Equity,,,,Yes,"Penten helps the digital transformation of defence & government - creating, building & operating new cyber tech for the modern workforce.","Artificial Intelligence (AI), Cyber Security, Electronics, Government, Information Technology, Military, National Security, Network Security, Software",,"Canberra, Australian Capital Territory, Australia, Oceania",https://www.penten.com/,,53134473,USD,53134473,Private Equity,3,Five V Capital,Five V Capital,1,,"11,654"
Venture Round - ActivePipe,https://www.crunchbase.com/funding_round/activepipe-series-unknown--004cc90f,ActivePipe,https://www.crunchbase.com/organization/activepipe,Venture - Series Unknown,51000000,USD,51000000,2021-03-23,,,,,Yes,ActivePipe Platform uses predictive data technology to identify high-value contacts in a real estate agent’s database.,"Artificial Intelligence (AI), Marketing, Real Estate",,"Melbourne, Victoria, Australia, Oceania",https://activepipe.com/,$1M to $10M,60606254,USD,60606254,M&A,7,SecondQuarter Ventures,"David Tarascio, Leigh Jasper, SecondQuarter Ventures",3,1,"11,598"
Series D - Soul,https://www.crunchbase.com/funding_round/soul-bd43-series-d--a390a095,Soul,https://www.crunchbase.com/organization/soul-bd43,Series D,177400000,USD,177400000,2021-06-01,Late Stage Venture,,,,Yes,SOUL is a social network that uses AI to help users find their soul mates.,"Apps, Artificial Intelligence (AI), Internet, Social Network",,"Shanghai, Shanghai, China, Asia",http://www.soulapp.cn,$50M to $100M,395600000,USD,395600000,Late Stage Venture,8,,"Boyu Capital, Janus Henderson Investors, miHoYo, Tencent",4,,"14,047"
Series B - Klue,https://www.crunchbase.com/funding_round/klue-series-b--b9563643,Klue,https://www.crunchbase.com/organization/klue,Series B,62000000,USD,62000000,2021-12-01,Early Stage Venture,,,,Yes,Klue is an AI powered competitive enablement platform that helps salespeople win the deals they should have won.,"Artificial Intelligence (AI), B2B, Enterprise Software, Machine Learning, SaaS",,"Vancouver, British Columbia, Canada, North America",http://klue.com,Less than $1M,83000000,USD,83000000,Early Stage Venture,5,Tiger Global Management,"BDC, Craft Ventures, Founders.ai, Hummer Winblad Venture Partners, OMERS Ventures, Rhino Ventures, Salesforce Ventures, SK Ventures, Tiger Global Management",9,2,"14,646"
Seed Round - Houmo.AI,https://www.crunchbase.com/funding_round/houmo-ai-seed--c34be912,Houmo.AI,https://www.crunchbase.com/organization/houmo-ai,Seed,46000000,USD,46000000,2021-08-24,Seed,,,,Yes,Houmo.AI is a semiconductor company that develops an integrated circuit storage technology for AI computing.,"Artificial Intelligence (AI), Cloud Computing, Semiconductor",,"Nanjing, Jiangsu, China, Asia",https://www.houmo.ai,,46000000,USD,46000000,,5,Qiming Venture Partners,"Heyu Capital, Matrix Partners China, Qiming Venture Partners, Wofo Capital, ZGC Group",5,1,"14,827"
Series G - DataRobot,https://www.crunchbase.com/funding_round/datarobot-series-g--8c2cd81c,DataRobot,https://www.crunchbase.com/organization/datarobot,Series G,300000000,USD,300000000,2021-06-27,Late Stage Venture,6000000000,USD,6000000000,Yes,DataRobot provides AI technology and ROI enablement services to global enterprises.,"Artificial Intelligence (AI), Enterprise Software, Machine Learning, SaaS",,"Boston, Massachusetts, United States, North America",http://datarobot.com,$100M to $500M,1050598000,USD,1050598000,Late Stage Venture,11,"Altimeter Capital, Tiger Global Management","Altimeter Capital, Ballistic Ventures, Counterpoint Global, Franklin Templeton, HMC Capital, J17 Capital, Page One Ventures, Salesforce Ventures, ServiceNow Ventures, Sutter Hill Ventures, Tiger Global Management",11,2,"15,163"
Seed Round - Mindcruise,https://www.crunchbase.com/funding_round/mindcruise-seed--11797279,Mindcruise,https://www.crunchbase.com/organization/mindcruise,Seed,100000000,CNY,15578023,2021-05-24,Seed,,,,Yes,Mindcruise provides autonomous driving solutions.,"Artificial Intelligence (AI), Autonomous Vehicles, Information Technology",,"Shanghai, Shanghai, China, Asia",http://www.mindcruise.cn/,,100000000,CNY,15578023,Seed,1,Jiangmen Venture Capital,"China Merchants Group, Jiangmen Venture Capital, Shenqi Capital",3,,"14,602"
Series D - 4Paradigm,https://www.crunchbase.com/funding_round/4paradigm-series-d--d632e368,4Paradigm,https://www.crunchbase.com/organization/4paradigm,Series D,700000000,USD,700000000,2021-01-22,Late Stage Venture,,,,Yes,4Paradigm is an AI tech firm that helps enterprises improve work efficiency while reducing risk and achieving greater commercial value.,"Artificial Intelligence (AI), Information Services, Machine Learning, Software",,"Beijing, Beijing, China, Asia",https://www.4paradigm.com/,$1B to $10B,1075261565,USD,1075261565,Late Stage Venture,6,"Boyu Capital, HOPU Investment Management Company, Primavera Capital Group","Boyu Capital, China Development Bank, China Jianyin Investment, China New Enterprise Investment, China Reform Holdings Corporation, China Securities, CITIC Construction Investment, CPE, FountainVest Partners, Goldman Sachs, Haitong Securities, HOPU Investment Management Company, Jinyi Capital, Junci Investment, Mubadala, National Manufacturing Transformation and Upgrading Fund, Primavera Capital Group, Sequoia Capital China",18,,"15,714"
Series A - Pinnacles Medical,https://www.crunchbase.com/funding_round/pinnacles-medical-series-a--8a3c69d8,Pinnacles Medical,https://www.crunchbase.com/organization/pinnacles-medical,Series A,300000000,CNY,46924124,2021-10-21,Early Stage Venture,,,,Yes,Pinnacles Medical is an AI based developing and researching firm that evaluate needs and integrates diagnosis to provide overall solutions.,"Artificial Intelligence (AI), Health Care, Internet, Medical",,"Minhang, Shanghai, China, Asia",http://www.pinnaclesdx.com/,,300000000,CNY,46924124,Early Stage Venture,1,Vertex Ventures China,"CTS Capital, Vertex Ventures China",2,1,"16,496"
Series C - Citycloud,https://www.crunchbase.com/funding_round/citycloud-series-c--b81b1152,Citycloud,https://www.crunchbase.com/organization/citycloud,Series C,500000000,CNY,78467067,2021-12-21,Late Stage Venture,,,,Yes,Citycloud is a Hangzhou-based company specializing in cloud computing and big data technologies.,"Artificial Intelligence (AI), Big Data, Cloud Computing, Computer, Machine Learning",,"Hangzhou, Zhejiang, China, Asia",http://www.citycloud.com.cn/en/about_w.html,$1M to $10M,151874241,USD,151874241,Late Stage Venture,4,Zhejiang State Enterprise Reform and Development Fund,"Winreal Investment, Yinxinggu Capital, Zhejiang State Enterprise Reform and Development Fund",3,,"17,270"
Series B - iOranges Automation,https://www.crunchbase.com/funding_round/ioranges-automation-series-b--388321cd,iOranges Automation,https://www.crunchbase.com/organization/ioranges-automation,Series B,100000000,CNY,15467426,2021-01-26,Early Stage Venture,,,,Yes,iOranges Automation is an AI and robotics company.,"Artificial Intelligence (AI), Robotics",,"Shenzhen, Guangdong, China, Asia",https://www.ioranges.cn/,$10M to $50M,33679346,USD,33679346,Early Stage Venture,6,V Fund Management,"Matrix Partners China, V Fund Management",2,1,"17,552"
Series E - Relativity Space,https://www.crunchbase.com/funding_round/relativity-space-series-e--a825ab99,Relativity Space,https://www.crunchbase.com/organization/relativity-space,Series E,650000000,USD,650000000,2021-06-08,Late Stage Venture,3550000000,USD,3550000000,Yes,"Relativity Space is an aerospace company that designs, develops, and builds 3D printed rockets.","3D Technology, Aerospace, Artificial Intelligence (AI), Manufacturing",,"Long Beach, California, United States, North America",http://relativityspace.com,$1M to $10M,1355719978,USD,1355719978,Late Stage Venture,9,Fidelity,"Baillie Gifford, BlackRock, Brad Buss, Centricus, Coatue, Ethos VC, Fidelity, Inertia Ventures, Jared Leto, K5 Global, Mark Cuban, Montauk Ventures, Salmira Investment Fund, Sand Hill Angels, Soroban Capital Partners LP, Spencer Rascoff, Taihill Venture, Tiger Global Management, Tribe Capital, Valia Ventures, XN",21,3,"18,563"
Series B - Hoteam Software,https://www.crunchbase.com/funding_round/hoteam-software-series-b--78d1ff02,Hoteam Software,https://www.crunchbase.com/organization/hoteam-software,Series B,28000000,USD,28000000,2021-07-08,Early Stage Venture,,,,Yes,Hoteam Software is a provider of enterprise transformation intelligent manufacturing solution services.,"Intelligent Systems, Manufacturing, Software",,"Jinan, Shandong, China, Asia",http://www.hoteamsoft.com,$1M to $10M,106644402,USD,106644402,Late Stage Venture,5,"Guotai Junan Securities, Silicon Harbor Capital","Guotai Junan Securities, Silicon Harbor Capital",2,1,"20,343"
Series B - FABU.ai,https://www.crunchbase.com/funding_round/fabu-ai-series-b--60e9f6f3,FABU.ai,https://www.crunchbase.com/organization/fabu-ai,Series B,15400000,USD,15400000,2021-08-20,Early Stage Venture,,,,Yes,FABU is an AI company that develops automated driving technology.,"Application Specific Integrated Circuit (ASIC), Artificial Intelligence (AI), Automotive, Autonomous Vehicles, Logistics, Semiconductor",,"Hangzhou, Zhejiang, China, Asia",http://www.fabu.ai/en,$10M to $50M,55400000,USD,55400000,Early Stage Venture,4,"Cowin Capital, Dyee Capital","Cowin Capital, Dyee Capital",2,,"22,418"
Series D - Infervision,https://www.crunchbase.com/funding_round/infervision-series-d--338600bb,Infervision,https://www.crunchbase.com/organization/infervision,Series D,140000000,USD,140000000,2021-07-23,Late Stage Venture,,,,Yes,Infervision is an AI high-tech company that uses deep learning technology and computer vision to help diagnose cancers.,"Artificial Intelligence (AI), Health Care, Health Diagnostics, Machine Learning, Medical, Software",,"Beijing, Beijing, China, Asia",https://global.infervision.com,$1M to $10M,214658586,USD,214658586,Late Stage Venture,6,Goldman Sachs Asset Management,"CCB Trust, Goldman Sachs Asset Management, New Alliance Capital, Z-Park Fund, Zhongguancun Science City Science",5,,"23,179"
Series B - Changmugu Medical,https://www.crunchbase.com/funding_round/longwood-valley-series-b--b4d5c0ae,Changmugu Medical,https://www.crunchbase.com/organization/longwood-valley,Series B,120000000,CNY,18647149,2021-02-09,Early Stage Venture,,,,Yes,Changmugu Medicalis an artificial intelligence (AI)-powered healthcare start-up providing AI-powered surgical robot solutions.,"Artificial Intelligence (AI), Health Care, Machine Learning, Medical, Robotics",,"Beijing, Beijing, China, Asia",https://changmugu.com/,,106044000,USD,106044000,Early Stage Venture,5,,"BioVenture, Lenovo Star",2,,"23,650"
Series B - Talent Today,https://www.crunchbase.com/funding_round/talent-today-series-b--2336ea87,Talent Today,https://www.crunchbase.com/organization/talent-today,Series B,100000000,CNY,15507723,2021-06-17,Early Stage Venture,900000000,CNY,139569506,Yes,"Talent Today is a platform-based human resources technology company driven by big data, algorithms, and artificial intelligence.","Artificial Intelligence (AI), Big Data, Consulting, Human Resources",,"Futian, Guangdong, China, Asia",https://www.jinrirencai.com,,200000000,CNY,29405491,Late Stage Venture,2,Capital Today,Capital Today,1,,"26,456"
Series B - Prospection,https://www.crunchbase.com/funding_round/prospection-series-b--12ac5bb2,Prospection,https://www.crunchbase.com/organization/prospection,Series B,45000000,AUD,33145875,2021-09-13,Early Stage Venture,,,,Yes,Leading provider of actionable real world evidence through artificial intelligence and machine learning technology.,"Analytics, Artificial Intelligence (AI), Big Data, Health Care, Information Technology, Machine Learning, Pharmaceutical, Predictive Analytics",,"Darlinghurst, New South Wales, Australia, Oceania",http://www.prospection.com,$1M to $10M,55000000,AUD,39773430,,4,Ellerston Capital,"Cicada Innovations, Ellerston Capital, Horizons Ventures, Main Sequence Ventures, Novotech",5,3,"25,357"
Series A - Seer,https://www.crunchbase.com/funding_round/seer-5904-series-a--d87c61b0,Seer,https://www.crunchbase.com/organization/seer-5904,Series A,34000000,AUD,24866052,2021-08-27,Early Stage Venture,,,,Yes,Seer is a medical technology company that specializes in addressing neurological conditions.,"Biotechnology, Health Care, Machine Learning",,"Rochester, Minnesota, United States, North America",https://www.seermedical.com,$1M to $10M,34000000,AUD,24866052,,2,,"Cochlear, EWM Group, Giant Leap Fund, SG Hiscock and Company",4,1,"26,918"
Post-IPO Debt - CrowdStrike,https://www.crunchbase.com/funding_round/crowdstrike-post-ipo-debt--fb4f738f,CrowdStrike,https://www.crunchbase.com/organization/crowdstrike,Post-IPO Debt,750000000,USD,750000000,2021-01-12,,,,,No,"CrowdStrike is a cybersecurity technology firm that provides cloud-delivered protection for cloud workloads, identity, and data.","Artificial Intelligence (AI), Cloud Data Services, Cloud Security, Cyber Security, Network Security",,"Sunnyvale, California, United States, North America",http://www.crowdstrike.com,$1B to $10B,1235600000,USD,1235600000,IPO,9,,,,,"27,831"
Series A - Good Driver Mutuality,https://www.crunchbase.com/funding_round/good-driver-mutuality-series-a--1702ad93,Good Driver Mutuality,https://www.crunchbase.com/organization/good-driver-mutuality,Series A,40400000,USD,40400000,2021-04-25,Early Stage Venture,,,,Yes,"FinTech, Automotive, Platform, Mutual Aid","Artificial Intelligence (AI), Automotive, FinTech, Internet",,"El Monte, California, United States, North America",https://www.gooddriver.ai/,,40400000,USD,40400000,Early Stage Venture,1,,"Hedosophia, Ribbit Capital",2,,"28,228"
Series D - Yunxi Technology,https://www.crunchbase.com/funding_round/yunxi-technology-series-d--e4fcf2a3,Yunxi Technology,https://www.crunchbase.com/organization/yunxi-technology,Series D,100000000,USD,100000000,2021-10-15,Late Stage Venture,,,,Yes,Yunxi Technology is an enterprise digital service provider.,"Cloud Computing, Digital Media, Intelligent Systems, Network Hardware",,"Hangzhou, Zhejiang, China, Asia",http://www.dtyunxi.com,$100M to $500M,194061150,USD,194061150,Late Stage Venture,6,Kaixin Capital,"BOCOM International, Hupan Hongsheng, Kaixin Capital, Silicon Harbor Capital",4,,"28,950"
Venture Round - FiscalNote,https://www.crunchbase.com/funding_round/fiscalnote-series-unknown--ce612f19,FiscalNote,https://www.crunchbase.com/organization/fiscalnote,Venture - Series Unknown,40000000,USD,40000000,2021-05-24,,1360000000,USD,1360000000,Yes,FiscalNote uses artificial intelligence and big data to deliver predictive analytics on government information to determine its impact.,"Artificial Intelligence (AI), Big Data, GovTech, Predictive Analytics, Software",,"Washington, District of Columbia, United States, North America",http://www.fiscalnote.com,$100M to $500M,631832510,USD,631832510,IPO,20,,"10X Capital, AS1 Growth Partners, Bossanova Investimentos, CBC Group, Chaac Ventures, Clearvision Ventures, Legendary Ventures, Maso Capital Partners",8,3,"29,155"
Seed Round - Silicon Box,https://www.crunchbase.com/funding_round/silicon-box-seed--a139b7f3,Silicon Box,https://www.crunchbase.com/organization/silicon-box,Seed,51000000,USD,51000000,2021-05-01,Seed,,,,Yes,Silicon Box is a semiconductor integration startup that focuses on providing semiconductor integration services.,"Artificial Intelligence (AI), Electronics, Manufacturing, Semiconductor",,"Singapore, Central Region, Singapore, Asia",https://www.silicon-box.com,,407600000,USD,407600000,Early Stage Venture,4,,"BlueRun Ventures, Byung Joon Han, Ignite Innovation Fund, Mike Han, Sehat Sutardja, Weili Dai",6,,"29,868"
Post-IPO Equity - Namaste Technologies,https://www.crunchbase.com/funding_round/namaste-technologies-95b4-post-ipo-equity--a17e30bd,Namaste Technologies,https://www.crunchbase.com/organization/namaste-technologies-95b4,Post-IPO Equity,23023000,CAD,18097367,2021-01-19,,,,,Yes,Namaste Technologies is a pharmaceutical company that specializes in manufacturing and selling cannabis-based products.,"Artificial Intelligence (AI), Cannabis, Logistics",,"Toronto, Ontario, Canada, North America",http://www.namastetechnologies.com,,69686862,USD,69686862,,3,,,,,"31,565"
Series B - Virtualitics,https://www.crunchbase.com/funding_round/virtualitics-series-b--d78e1878,Virtualitics,https://www.crunchbase.com/organization/virtualitics,Series B,18129000,USD,18129000,2021-04-14,Early Stage Venture,,,,Yes,Virtualitics is an analytics company that helps enterprises and governments make decisions with ready-to-use AI.,"Artificial Intelligence (AI), Augmented Reality, Machine Learning, Natural Language Processing, Virtual Reality",,"Pasadena, California, United States, North America",https://www.virtualitics.com,$1M to $10M,66644378,USD,66644378,Late Stage Venture,5,North Sound Ventures,"Centricus, North Sound Ventures, The Venture Reality Fund/VRF",3,1,"32,323"
Series B - Cobot,https://www.crunchbase.com/funding_round/cobot-bbd4-series-b--a0058d48,Cobot,https://www.crunchbase.com/organization/cobot-bbd4,Series B,100000000,CNY,15476043,2021-01-04,Early Stage Venture,,,,Yes,Chinese intelligent robot manipulation system provider.,"Artificial Intelligence (AI), Education, Industrial, Machine Learning, Operating Systems, Robotics",,"Wuhan, Hubei, China, Asia",http://www.cobotsys.com/,$1M to $10M,252000000,CNY,38175093,Late Stage Venture,6,,BOILING POINT INVESTMENT,1,,"32,424"
Post-IPO Equity - Nextech AR Solutions,https://www.crunchbase.com/funding_round/nextech-ar-solutions-post-ipo-equity--a0a829d1,Nextech AR Solutions,https://www.crunchbase.com/organization/nextech-ar-solutions,Post-IPO Equity,14000000,USD,14000000,2021-04-08,,,,,Yes,"Nextech AR Solutions is a publicly traded Metaverse company, specializing in augmented reality solutions, spatial mapping and 3D models.","3D Technology, Advertising, Artificial Intelligence (AI), Augmented Reality, E-Commerce, Geospatial, Mapping Services, Metaverse, Software",,"Toronto, Ontario, Canada, North America",http://www.nextechar.com,$1M to $10M,40889280,USD,40889280,IPO,5,,,,,"32,730"
Series A - Posh AI,https://www.crunchbase.com/funding_round/posh-700e-series-a--31c04b56,Posh AI,https://www.crunchbase.com/organization/posh-700e,Series A,27500000,USD,27500000,2021-12-09,Early Stage Venture,,,,Yes,Posh develops a conversational AI platform for the banking industry.,"Artificial Intelligence (AI), Banking, Customer Service, FinTech, Productivity Tools",,"Boston, Massachusetts, United States, North America",https://www.posh.ai,$10M to $50M,72500000,USD,72500000,Early Stage Venture,2,Canapi Ventures,"Canapi Ventures, Curql, Human Capital, JAM FINTOP, Piedmont Capital Investments, TruStage Ventures",6,1,"33,282"
