Pre Seed Round - GroupUps,https://www.crunchbase.com/funding_round/the-convoy-pre-seed--1ed70c40,GroupUps,https://www.crunchbase.com/organization/the-convoy,Pre-Seed,1000000,USD,1000000,2021-12-31,Seed,,,,Yes,GroupUps is the fastest way to buy and sell large equipment.,"Artificial Intelligence (AI), Dental, E-Commerce, Marketplace, Medical, Sales Automation, Sales Enablement, Small and Medium Businesses","Black Founded, Middle Eastern / North African Founded, Women Founded","Raleigh, North Carolina, United States, North America",https://groupups.com,,1000000,USD,1000000,Seed,5,,"Scot Wingo, Tim Young",2,,"206,781"
Seed Round - VOCHI,https://www.crunchbase.com/funding_round/vochi-seed--e3edefec,VOCHI,https://www.crunchbase.com/organization/vochi,Seed,2400000,USD,2400000,2021-07-23,Seed,,,,Yes,VOCHI is a video and photo editing application that enables the addition of effects to individual objects in real-time.,"Artificial Intelligence (AI), Computer Vision, Mobile Apps, Photo Editing, Video Editing",,"Nicosia, Nicosia, Cyprus, Europe",https://vochi.com,$1M to $10M,4400000,USD,4400000,M&A,4,ICLUB VC,"A.Partners, Angelsdeck Global Ventures, BRISE Capital, ICLUB VC, Kirill Voloshin, Kolas Ventures, Luba Pashkovskaya, Startup Wise Guys, TA Ventures",9,,"208,018"
Series A - SP Robotic Works Pvt Ltd,https://www.crunchbase.com/funding_round/sp-robotic-works-pvt-ltd-series-a--dc6d64bf,SP Robotic Works Pvt Ltd,https://www.crunchbase.com/organization/sp-robotic-works-pvt-ltd,Series A,3000000,USD,3000000,2021-07-30,Early Stage Venture,,,,Yes,A.I. Based LMS that orchestrates a customer experience from learning practically (with hardware kits) to interacting with fellow makers.,"E-Learning, Education, Machine Learning, Robotics",,"Chennai, Tamil Nadu, India, Asia",http://www.sproboticworks.com/,$1M to $10M,3750000,USD,3750000,Early Stage Venture,3,Mount Judi Ventures,"Ajai Chowdhry, Bharat Coking Coal, Indian Angel Network, Malabar Angels, Mount Judi Ventures, Native Angels Network, Nativelead Foundation, Raman Roy",8,2,"208,102"
Equity Crowdfunding - ThisWay,https://www.crunchbase.com/funding_round/thisway-global-equity-crowdfunding--33ecbdc5,ThisWay,https://www.crunchbase.com/organization/thisway-global,Equity Crowdfunding,1140000,USD,1140000,2021-12-09,,40500000,USD,40500000,Yes,ThisWay offers an unbiased candidate matching engine to identify top qualified candidates for every job.,"Artificial Intelligence (AI), Blockchain, Human Resources, Machine Learning, Recruiting, Software","Women Founded, Women Led","Austin, Texas, United States, North America",http://www.thiswayglobal.com,Less than $1M,3872512,USD,3872512,,6,,,,,"205,141"
Seed Round - Kogena,https://www.crunchbase.com/funding_round/kogena-seed--54c68c63,Kogena,https://www.crunchbase.com/organization/kogena,Seed,1000000,EUR,1186722,2021-07-30,Seed,,,,Yes,Kogena develops the first vendor-independent AI-powered platform for monitoring collaborative robots (cobots),"Analytics, Artificial Intelligence (AI), Machine Learning",,"Wroclaw, Dolnoslaskie, Poland, Europe",https://kogena.com,$1M to $10M,2460801,USD,2460801,Seed,3,Kogito Ventures,"Kogito Ventures, SATUS Starter",2,,"661,346"
Seed Round - Munai,https://www.crunchbase.com/funding_round/laura-3b95-seed--c0778923,Munai,https://www.crunchbase.com/organization/laura-3b95,Seed,10000000,BRL,1892936,2021-05-20,Seed,,,,Yes,Munai is healhtech which builds AI for Hospitals and Insurances to prevent damage & reduce costs.,"Artificial Intelligence (AI), Health Care, Hospital, Predictive Analytics",,"Curitiba, Parana, Brazil, South America",https://www.munai.com.br/,,10000000,BRL,1892936,Seed,1,,GAA Investments,1,,"661,361"
Seed Round - Wonderway,https://www.crunchbase.com/funding_round/wonderwerk-seed--ee586536,Wonderway,https://www.crunchbase.com/organization/wonderwerk,Seed,2200000,EUR,2484607,2021-12-09,Seed,,,,Yes,Sales performance platform proven to increase the revenue per rep with the right sales training and coaching.,"Education, Internet, Machine Learning, Sales, Sales Automation, Software, Training",,"Berlin, Berlin, Germany, Europe",https://www.wonderway.io,,3200000,EUR,3609156,Seed,2,,"Black Pearls VC, Founders, Sparkmind.vc, Spring Capital",4,,"661,610"
Series A - eSales Hub,https://www.crunchbase.com/funding_round/esales-hub-series-a--d8ae116a,eSales Hub,https://www.crunchbase.com/organization/esales-hub,Series A,1650000,GBP,2302700,2021-04-28,Early Stage Venture,,,,Yes,Data-Driven A.I. Powered Sales Platform,"Artificial Intelligence (AI), Software",,"Doncaster, Doncaster, United Kingdom, Europe",https://esaleshub.ai,$1M to $10M,1650000,GBP,2302700,Early Stage Venture,1,NPIF Maven Equity Finance,"Maven Capital Partners, NPIF Maven Equity Finance",2,1,"417,079"
Seed Round - Alectio,https://www.crunchbase.com/funding_round/alectio-seed--b0113948,Alectio,https://www.crunchbase.com/organization/alectio,Seed,1500000,USD,1500000,2021-04-01,Seed,,,,Yes,Artificial intelligence company specialized in DataPrepOps,"Artificial Intelligence (AI), Big Data, Information Technology, Machine Learning, Software","Women Founded, Women Led","Santa Clara, California, United States, North America",https://www.alectio.com,$1M to $10M,5350000,USD,5350000,Seed,4,Alven,Alven,1,1,"662,016"
Seed Round - Kuva Space,https://www.crunchbase.com/funding_round/kuva-space-seed--b342fd56,Kuva Space,https://www.crunchbase.com/organization/kuva-space,Seed,2500000,EUR,3054375,2021-06-01,Seed,,,,Yes,Smarter data for a stronger planet,"Analytics, Artificial Intelligence (AI), Satellite Communication",,"Espoo, Southern Finland, Finland, Europe",https://kuvaspace.com,$1M to $10M,23300000,EUR,25546648,Early Stage Venture,4,,"Nordic Foodtech VC, Voima Ventures",2,1,"662,018"
Series A - Green Eagle Solutions,https://www.crunchbase.com/funding_round/green-eagle-solutions-series-a--90e37151,Green Eagle Solutions,https://www.crunchbase.com/organization/green-eagle-solutions,Series A,2500000,EUR,3055633,2021-05-18,Early Stage Venture,,,,Yes,Green Eagle Solutions provides SCADA Solutions for wind farms and solar plants.,"Renewable Energy, Robotic Process Automation (RPA), Robotics, SaaS",,"Madrid, Madrid, Spain, Europe",https://greeneaglesolutions.com/,$1M to $10M,8500000,EUR,9642735,Early Stage Venture,2,"Kibo Ventures, SET Ventures","Kibo Ventures, SET Ventures",2,1,"662,195"
Seed Round - Sust Global,https://www.crunchbase.com/funding_round/sust-global-seed--89c1fbbd,Sust Global,https://www.crunchbase.com/organization/sust-global,Seed,3200000,USD,3200000,2021-10-28,Seed,,,,Yes,Sust Global aims to translate intricate climate science into clear financial indicators.,"Artificial Intelligence (AI), Business Intelligence, Machine Learning, Predictive Analytics, SaaS",,"San Francisco, California, United States, North America",https://www.sustglobal.com/,$1M to $10M,4710000,USD,4710000,,3,Salica,"Powerhouse Ventures, Salica, Thirdstream Partners, Vala Capital",4,2,"662,329"
Seed Round - TachyHealth,https://www.crunchbase.com/funding_round/tachyhealth-seed--2ba2e091,TachyHealth,https://www.crunchbase.com/organization/tachyhealth,Seed,1100000,USD,1100000,2021-09-03,Seed,,,,Yes,Building the next generation healthcare solutions to drive the value-based healthcare for payers and providers with AI and data science,"Artificial Intelligence (AI), Computer, Health Care, Health Insurance, Hospital, Information Technology, Machine Learning, Software",,"Delaware City, Delaware, United States, North America",https://www.tachyhealth.com,$1M to $10M,1240000,USD,1240000,Seed,2,Propeller Inc.,"JordInvest, Oman Technology Fund, Propeller Inc.",3,,"662,659"
Seed Round - Allelica,https://www.crunchbase.com/funding_round/allelica-seed--38caab81,Allelica,https://www.crunchbase.com/organization/allelica,Seed,1750000,USD,1750000,2021-03-05,Seed,,,,Yes,Allelica is a genomics software company driving the transition of Polygenic Risk Score from Genomic research to clinical application.,"Bioinformatics, Biotechnology, Genetics, Health Care, Information Technology, Life Science, Predictive Analytics, Web Development",,"New York, New York, United States, North America",https://www.allelica.com/,$1M to $10M,1750000,USD,1750000,Seed,2,Valor Ventures,"Pi Campus, Valor Ventures",2,1,"418,630"
Seed Round - Vidrovr,https://www.crunchbase.com/funding_round/vidrovr-seed--e5b4eebd,Vidrovr,https://www.crunchbase.com/organization/vidrovr,Seed,2500000,USD,2500000,2021-08-18,Seed,,,,Yes,"Vidrovr develops multimodal computer vision and machine learning systems to index, tag, and understand video. ","Machine Learning, Video, Web Design",,"New York, New York, United States, North America",http://vidrovr.com,$1M to $10M,5294910,USD,5294910,Seed,10,Prefix Capital,"D20 Capital, Outlander VC, Prefix Capital",3,1,"419,496"
Seed Round - GoKoan,https://www.crunchbase.com/funding_round/gokoan-seed--f89fc069,GoKoan,https://www.crunchbase.com/organization/gokoan,Seed,1200000,USD,1200000,2021-09-06,Seed,,,,Yes,GoKoan is a digital teaching and learning tool designed to optimize the way students study using Artificial Intelligence,"Artificial Intelligence (AI), E-Learning, EdTech, Education, Machine Learning, Training",,"Valencia, Comunidad Valenciana, Spain, Europe",https://www.gokoan.com/,,1215387,USD,1215387,Seed,2,Sabadell Venture Capital,"Athos Capital, Draper B1, Sabadell Venture Capital, Valencia Institute of Finance",4,1,"144,818"
Seed Round - Conte.ai,https://www.crunchbase.com/funding_round/contenive-seed--25f97ba7,Conte.ai,https://www.crunchbase.com/organization/contenive,Seed,1500000,USD,1500000,2021-07-03,Seed,,,,Yes,Social media AI autopilot,"Artificial Intelligence (AI), Marketing, Marketing Automation, Social Media",,"London, England, United Kingdom, Europe",https://conte.ai,Less than $1M,2367992,USD,2367992,Seed,6,,"TMT Investments, YellowRockets",2,,"294,216"
Seed Round - Anything World,https://www.crunchbase.com/funding_round/anything-world-seed--584c9584,Anything World,https://www.crunchbase.com/organization/anything-world,Seed,1100000,GBP,1494244,2021-01-15,Seed,,,,Yes,"Anything World combines AI, speech computing, and 3D rendering with layers of behavioral intelligence.","Artificial Intelligence (AI), Augmented Reality, Media and Entertainment",,"London, England, United Kingdom, Europe",https://anything.world,$1M to $10M,9667909,USD,9667909,Seed,3,Supernode Global,"Acequica Capital, Possible Ventures, Supernode Global",3,3,"420,671"
Seed Round - ContractZen,https://www.crunchbase.com/funding_round/contractzen-seed--a804e398,ContractZen,https://www.crunchbase.com/organization/contractzen,Seed,1000000,EUR,1221750,2021-06-01,Seed,,,,Yes,"Instantly ready-to-use cloud service with contract management, board portal, VDR, eSignatures and more!","Artificial Intelligence (AI), Cloud Data Services, File Sharing, Legal Tech, Meeting Software, Online Portals, SaaS, Security, Software",,"Helsinki, Southern Finland, Finland, Europe",https://www.contractzen.com/,$1M to $10M,2421750,USD,2421750,Seed,4,,Nordic Eye Venture Capital,1,,"518,347"
Pre Seed Round - Prescient AI,https://www.crunchbase.com/funding_round/prescient-46b0-pre-seed--55f7293e,Prescient AI,https://www.crunchbase.com/organization/prescient-46b0,Pre-Seed,2200000,USD,2200000,2021-07-14,Seed,,,,Yes,"Predictive automation platform based on confidence in forecasted CAC, ROAS, and other profitability-based KPIs across the DTC industry.","E-Commerce, E-Commerce Platforms, Machine Learning, Marketing, Predictive Analytics, SaaS, Simulation, Software",,"Miami, Florida, United States, North America",https://www.prescient-ai.io/,$1M to $10M,16700000,USD,16700000,Early Stage Venture,3,focal,"Dasein Capital, focal, Green Egg Ventures, Maccabee Ventures, Outbound Ventures, Side Door Ventures, Stadia Ventures",7,2,"295,998"
Seed Round - MURF.AI,https://www.crunchbase.com/funding_round/murf-ai-seed--fe7925e3,MURF.AI,https://www.crunchbase.com/organization/murf-ai,Seed,1500000,USD,1500000,2021-07-29,Seed,,,,Yes,"Murf AI is a synthetic speech technology startup developing lifelike AI voices for podcasts, slideshows, and professional presentations.","Artificial Intelligence (AI), Audio, Machine Learning, Speech Recognition",Women Founded,"Salt Lake City, Utah, United States, North America",https://murf.ai,,11500000,USD,11500000,Early Stage Venture,2,Elevation Capital,"Ashish Goel, Elevation Capital, Kashyap Deorah, Sanjeev Barnwal, Vidit Aatrey",5,1,"296,012"
Seed Round - Neuro Rehab VR,https://www.crunchbase.com/funding_round/neuro-rehab-vr-seed--56502c1a,Neuro Rehab VR,https://www.crunchbase.com/organization/neuro-rehab-vr,Seed,1600000,USD,1600000,2021-10-04,Seed,,,,Yes,Develop VR/AR therapy exercises for physical and cognitive therapy leveraging the concepts of neuroplasticity,"Artificial Intelligence (AI), Corporate Training, Fitness, Health Care, Home Health Care, Virtual Reality, Wellness","South Asian Founded, Women Founded","Fort Worth, Texas, United States, North America",https://www.neurorehabvr.com,Less than $1M,1824893,USD,1824893,Seed,2,,,,,"520,081"
Seed Round - DeckRobot,https://www.crunchbase.com/funding_round/deckrobot-seed--5d9e544a,DeckRobot,https://www.crunchbase.com/organization/deckrobot,Seed,1000000,USD,1000000,2021-08-01,Seed,,,,Yes,DeckRobot is a Generative AI to communicate business ideas through corporate documents,"Artificial Intelligence (AI), Enterprise Software, Generative AI, Machine Learning, SaaS",,"San Francisco, California, United States, North America",http://www.deckrobot.com,,5850000,USD,5850000,,6,,"Flyer One Ventures, Pragmatech Ventures",2,,"297,637"
Seed Round - iSPORTiSTiCS,https://www.crunchbase.com/funding_round/isportistics-seed--5716deb6,iSPORTiSTiCS,https://www.crunchbase.com/organization/isportistics,Seed,1500000,USD,1500000,2021-11-30,Seed,,,,Yes,We train algorithms to interpret sporting events like a human would.,"Artificial Intelligence (AI), Computer Vision, Content, Machine Learning, Marketing, Predictive Analytics, Software, Sports, Video, Video Editing",,"São Paulo, Sao Paulo, Brazil, South America",https://www.isportistics.com/,$1M to $10M,2009650,USD,2009650,Seed,4,,Airborne Ventures,1,1,"520,776"
Seed Round - LGN,https://www.crunchbase.com/funding_round/lgn-seed--e49ab14a,LGN,https://www.crunchbase.com/organization/lgn,Seed,1400000,GBP,1922309,2021-03-23,Seed,,,,Yes,"LGN builds the worlds most advanced Edge AI deployment software, automatically detecting anomalies at the edge for instant fine-tuning.","Artificial Intelligence (AI), Hardware, Information Technology, Sensor",,"London, England, United Kingdom, Europe",https://lgn.ai/,$1M to $10M,2903054,USD,2903054,Seed,6,,"Claudio Simao, InMotion Ventures, John Taysom, Luminous Ventures, Trucks Venture Capital",5,3,"520,808"
Venture Round - Sewer AI,https://www.crunchbase.com/funding_round/sewer-ai-series-unknown--c6986b92,Sewer AI,https://www.crunchbase.com/organization/sewer-ai,Venture - Series Unknown,1500000,USD,1500000,2021-10-22,,,,,Yes,SewerAI uses AI tools to improve sewer condition assessment and inspection data management.,"Artificial Intelligence (AI), Infrastructure, Machine Learning, Software",,"San Francisco, California, United States, North America",http://www.sewerai.com,$1M to $10M,18500000,USD,18500000,Early Stage Venture,5,Bentley iTwin Ventures,"Bentley iTwin Ventures, Builders VC, Burnt Island Ventures, EPIC Ventures",4,2,"298,323"
Seed Round - Kiko Live,https://www.crunchbase.com/funding_round/kiko-tv-seed--b455c12c,Kiko Live,https://www.crunchbase.com/organization/kiko-tv,Seed,1000000,USD,1000000,2021-11-01,Seed,,,,Yes,Kiko Live enables neighborhood retailers to get discovered and sell digitally. It also enables retailers to sell on ONDC,"Artificial Intelligence (AI), E-Commerce, Social Shopping, Video, Video Chat",,"Mumbai, Maharashtra, India, Asia",https://kiko.live/,$1M to $10M,1900000,USD,1900000,Seed,5,GSF,"Amarjit Singh Batra, GSF, Powerhouse Ventures, SATYAM SINGH, Venture Catalysts",5,2,"454,767"
Convertible Note - Miso,https://www.crunchbase.com/funding_round/ask-miso-convertible-note--8d258442,Miso,https://www.crunchbase.com/organization/ask-miso,Convertible Note,1050000,USD,1050000,2021-02-01,,,,,No,Building the future of search and discovery with API-powered personalization,"Developer APIs, Machine Learning, Natural Language Processing, Personalization, Privacy, Product Search, SaaS, Visual Search",,"San Francisco, California, United States, North America",https://miso.ai/,$100M to $500M,6241000,USD,6241000,,5,,,,,"274,608"
Seed Round - HarvestAi,https://www.crunchbase.com/funding_round/harvestai-seed--637741e8,HarvestAi,https://www.crunchbase.com/organization/harvestai,Seed,2700000,EUR,3198366,2021-07-01,Seed,,,,Yes,SaaS for predicting plant growth and optimizing operations in greenhouses.,"Artificial Intelligence (AI), Farming, Machine Learning, SaaS",,"Potsdam, Brandenburg, Germany, Europe",https://www.harvest-ai.com,$1M to $10M,2700000,EUR,3198366,Seed,1,,,,,"522,681"
Series A - Saturn Cloud,https://www.crunchbase.com/funding_round/saturn-cloud-series-a--437f6113,Saturn Cloud,https://www.crunchbase.com/organization/saturn-cloud,Series A,3000000,USD,3000000,2021-08-17,Early Stage Venture,,,,Yes,"Saturn Cloud is a platform for AI & ML development, deployment, and data pipelines in the cloud.","Artificial Intelligence (AI), Cloud Data Services, Cloud Infrastructure, Generative AI, Machine Learning, SaaS, Software",,"New York, New York, United States, North America",https://www.saturncloud.io,$1M to $10M,9500000,USD,9500000,Early Stage Venture,3,NVIDIA,NVIDIA,1,,"300,953"
Seed Round - Plentina,https://www.crunchbase.com/funding_round/plentina-seed--61ccc6fc,Plentina,https://www.crunchbase.com/organization/plentina,Seed,2200000,USD,2200000,2021-11-14,Seed,,,,Yes,Plentina builds an alternative credit score and application that provides store credit financing to buy essentials.,"Credit, Financial Services, FinTech, Lending, Machine Learning",,"Parañaque, Rizal, Philippines, Asia",https://www.plentina.com/,$1M to $10M,5070000,USD,5070000,Seed,5,TMV,"AV Ventures, Global Founders Capital, Techstars, TMV, Unpopular Ventures",5,1,"176,490"
Seed Round - Truligent,https://www.crunchbase.com/funding_round/truligent-a482-seed--75812b84,Truligent,https://www.crunchbase.com/organization/truligent-a482,Seed,1790000,USD,1790000,2021-03-04,Seed,,,,Yes,"Truligent builds and acquires market-leading, profitable software businesses globally","Artificial Intelligence (AI), Machine Learning, SaaS, Software",,"London, England, United Kingdom, Europe",https://truligent.co,,1790000,USD,1790000,Seed,1,,,,,"177,097"
Seed Round - CHAOS,https://www.crunchbase.com/funding_round/chaos-architects-seed--3e23b5ac,CHAOS,https://www.crunchbase.com/organization/chaos-architects,Seed,1500000,EUR,1817999,2021-01-28,Seed,,,,Yes,CHAOS is an urban forecasting company for creating liveable cities.,"Architecture, Artificial Intelligence (AI), Geospatial, Location Based Services, Machine Learning, SaaS, Service Industry, Smart Cities, Software",,"Helsinki, Southern Finland, Finland, Europe",http://www.chaosarchitects.com,,2107999,USD,2107999,Seed,2,Nidoco,"Kai Keituri, Nidoco, Stefan Lindeberg, Tapio Heikkilä",4,1,"413,841"
Pre Seed Round - Yoodli,https://www.crunchbase.com/funding_round/yoodli-pre-seed--443434b0,Yoodli,https://www.crunchbase.com/organization/yoodli,Pre-Seed,1000000,USD,1000000,2021-10-07,Seed,,,,Yes,Yoodli is an AI-enabled platform that provides feedback on its user's communication skills.,"Artificial Intelligence (AI), Information Technology, Software",Women Founded,"Seattle, Washington, United States, North America",https://www.yoodli.ai/,$1M to $10M,7000000,USD,7000000,Seed,2,,"Allen Institute for Artificial Intelligence, Madrona",2,1,"414,225"
Equity Crowdfunding - ELEM Biotech,https://www.crunchbase.com/funding_round/elem-biotech-equity-crowdfunding--8dcc2114,ELEM Biotech,https://www.crunchbase.com/organization/elem-biotech,Equity Crowdfunding,1200000,EUR,1348818,2021-12-17,,,,,Yes,Alya Red is a “virtual human” designed to optimise medical treatments for patients to improve and extend their lives.,"Artificial Intelligence (AI), Biotechnology, Health Care, Life Science, Medical, Pharmaceutical, Software",,"Barcelona, Catalonia, Spain, Europe",https://elem.bio/,$1M to $10M,3682097,EUR,3809039,Seed,3,,,,,"178,273"
Debt Financing - Leverage Edu,https://www.crunchbase.com/funding_round/leverage-edu-debt-financing--e4dbf0d5,Leverage Edu,https://www.crunchbase.com/organization/leverage-edu,Debt Financing,2000000,USD,2000000,2021-06-09,,,,,No,AI-enabled marketplace designed to help students with their higher education and career growth plans,"Artificial Intelligence (AI), Career Planning, EdTech, Education, Higher Education, Internet, Marketplace",,"New Delhi, Delhi, India, Asia",http://www.leverageedu.com,$100M to $500M,73773326,USD,73773326,Late Stage Venture,10,Trifecta Capital Advisors,Trifecta Capital Advisors,1,1,"178,402"
Seed Round - Datrix,https://www.crunchbase.com/funding_round/datrix-059e-seed--046d81b5,Datrix,https://www.crunchbase.com/organization/datrix-059e,Seed,2500000,EUR,2984098,2021-06-22,Seed,,,,Yes,"Datrix is a data-driven tech firm that develops software solutions of augmented analytics for marketing, sales, publishing, and investing.","Analytics, Artificial Intelligence (AI), Information Services, Information Technology, Marketing, Software",,"Milano, Lombardia, Italy, Europe",https://datrix.it/,$10M to $50M,2500000,EUR,2984098,IPO,2,"8a + INVESTMENTS, Ocs","8a + INVESTMENTS, Ocs",2,,"179,295"
Seed Round - Simetric,https://www.crunchbase.com/funding_round/connected-analytics-06a0-seed--ee45b147,Simetric,https://www.crunchbase.com/organization/connected-analytics-06a0,Seed,1000000,USD,1000000,2021-03-01,Seed,,,,Yes,Simetric is a software company providing real-time insights across carriers for the global scale of connected devices.,"Analytics, Information Technology, Internet, Internet of Things, Predictive Analytics, Software",,"Alpharetta, Georgia, United States, North America",https://simetric.com,$1M to $10M,3228000,USD,3228000,Seed,4,Ocean Azul Partners,"Ocean Azul Partners, Ross Brown",2,,"289,297"
Seed Round - Bzigo,https://www.crunchbase.com/funding_round/bzigo-seed--8ff165ae,Bzigo,https://www.crunchbase.com/organization/bzigo,Seed,3000000,USD,3000000,2021-11-16,Seed,,,,Yes,Bzigo is a device that actively detects and locates mosquitoes.,"Artificial Intelligence (AI), Computer Vision, Consumer, Consumer Electronics, Consumer Goods, Electronics, Sensor",,"Dover, Delaware, United States, North America",https://bzigo.com/,$1M to $10M,3000000,USD,3000000,Seed,1,,Nimo Rotem,1,,"415,688"
Debt Financing - BEDROCK - Humanised Intelligence augmented,https://www.crunchbase.com/funding_round/bedrock-data-by-design-debt-financing--a465cd94,BEDROCK - Humanised Intelligence augmented,https://www.crunchbase.com/organization/bedrock-data-by-design,Debt Financing,1100000,EUR,1338037,2021-01-26,,11000000,USD,11000000,No,Data Science & AI with a human-centred approach to business digitalisation that delivers value.,"Artificial Intelligence (AI), Consulting, Digital Media, Human Computer Interaction, Machine Learning, Media and Entertainment",,"Gijón, Asturias, Spain, Europe",https://bedrockdbd.com/,,1100000,EUR,1338037,,1,Alex Lawton,Alex Lawton,1,1,"180,222"
Series A - Deepixel,https://www.crunchbase.com/funding_round/deepixel-series-a--c3e0a707,Deepixel,https://www.crunchbase.com/organization/deepixel,Series A,2000000000,KRW,1725012,2021-08-31,Early Stage Venture,,,,Yes,Deepixel is a visual intelligence tech-startup that change how people interact with the digital world by providing a user interface.,"Artificial Intelligence (AI), Computer Vision, Machine Learning",,"Seoul, Seoul-t'ukpyolsi, South Korea, Asia",http://www.deepixel.xyz,$1M to $10M,2000000000,KRW,1725012,Early Stage Venture,1,,eBEST,1,,"180,861"
Venture Round - Cappasity,https://www.crunchbase.com/funding_round/cappasity-inc-series-unknown--94606bc8,Cappasity,https://www.crunchbase.com/organization/cappasity-inc,Venture - Series Unknown,1000000,USD,1000000,2021-11-01,,,,,Yes,"Cappasity is a cloud-based platform that lets online stores easily create and deliver 3D, AR and NFT shopping experiences","3D Technology, Analytics, Augmented Reality, B2B, E-Commerce Platforms, Fashion, Machine Learning, Retail Technology, Shopping, Virtual Reality","Women Founded, Women Led","Santa Clara, California, United States, North America",https://www.cappasity.com,$10M to $50M,7450000,USD,7450000,,8,,,,,"450,984"
Seed Round - CreditEnable,https://www.crunchbase.com/funding_round/creditenable-seed--3e3c65ce,CreditEnable,https://www.crunchbase.com/organization/creditenable,Seed,2000000,USD,2000000,2021-01-19,Seed,,,,Yes,"CreditEnable provides data analytics, deep learning, AI and technology to build solutions to financial challenges.","Analytics, Artificial Intelligence (AI), Credit, Financial Services, FinTech, Information Technology",,"London, England, United Kingdom, Europe",https://www.creditenable.com/,$1M to $10M,8145000,USD,8145000,Seed,6,"JPIN, Venture Catalysts","JPIN, Venture Catalysts",2,2,"450,988"
Series A - Trust Science,https://www.crunchbase.com/funding_round/trust-science-series-a--df7f5eb5,Trust Science,https://www.crunchbase.com/organization/trust-science,Series A,2000000,USD,2000000,2021-03-31,Early Stage Venture,,,,Yes,Trust Science is a provider of AI-powered alternative credit scoring solutions.,"Big Data, Credit Bureau, FinTech, Information and Communications Technology (ICT), Information Services, Intelligent Systems, Predictive Analytics, SaaS",,"Edmonton, Alberta, Canada, North America",https://www.trustscience.com,Less than $1M,20300000,USD,20300000,Early Stage Venture,5,,,,,"323,410"
