Seed Round - Idiomatic,https://www.crunchbase.com/funding_round/idiomatic-seed--e42852e9,Idiomatic,https://www.crunchbase.com/organization/idiomatic,Seed,4000000,USD,4000000,2022-05-25,Seed,,,,Yes,We analyze customer conversations to provide a customer driven way of improving your product experience and service experience,"Analytics, Apps, Artificial Intelligence (AI), Customer Service, Machine Learning, Product Management, Software","Black Founded, Black Led, East Asian Founded, East Asian Led","Palo Alto, California, United States, North America",https://idiomatic.com,$1M to $10M,4000000,USD,4000000,Seed,3,Freestyle Capital,"Freestyle Capital, Gaingels, Gert Lanckriet, Hyphen Capital, Scott Belsky, Xoogler",6,1,"107,654"
Seed Round - INCRMNTAL,https://www.crunchbase.com/funding_round/incrmntal-seed--822a0f7f,INCRMNTAL,https://www.crunchbase.com/organization/incrmntal,Seed,4100000,USD,4100000,2022-07-25,Seed,,,,Yes,INCRMNTAL is an AI and Causality software company offering marketing incrementality measurement,"Advertising, Artificial Intelligence (AI), Digital Marketing, Machine Learning, Marketing, Mobile, Mobile Advertising, SaaS, Software",,"Tel Aviv, Tel Aviv, Israel, Asia",https://www.incrmntal.com,$1M to $10M,5500000,USD,5500000,Seed,2,Play Ventures,"Eric Seufert, Heracles Capital, Play Ventures",3,2,"105,561"
Seed Round - Klearly,https://www.crunchbase.com/funding_round/klearly-seed--e565b66b,Klearly,https://www.crunchbase.com/organization/klearly,Seed,4000000,USD,4000000,2022-06-07,Seed,,,,Yes,"Klearly powers B2B revenue teams with the visibility and confidence to know where, when, and how to grow revenue.","Computer, Machine Learning, Marketing, SaaS, Sales, Software",,"Raleigh, North Carolina, United States, North America",https://klearly.com,$1M to $10M,7675000,USD,7675000,Seed,4,York IE,"Front Porch Venture Partners, IDEA Fund Partners, Studio VC, Triangle Tweener Fund, York IE",5,2,"105,812"
"Seed Round - Field Materials, Inc.",https://www.crunchbase.com/funding_round/field-materials-inc-seed--716b206a,"Field Materials, Inc.",https://www.crunchbase.com/organization/field-materials-inc,Seed,4650000,USD,4650000,2023-04-06,Seed,,,,Yes,Field Materials digitizes material procurement for construction contractors and vendors through its AI-powered mobile and web apps.,"Apps, Artificial Intelligence (AI), Construction, Procurement, Software",,"San Jose, California, United States, North America",https://fieldmaterials.com,$1M to $10M,8150000,USD,8150000,Seed,3,,"Blumberg Capital, Class 5 Global, s16vc, Zacua Ventures",4,,"105,774"
Seed Round - SignoAI,https://www.crunchbase.com/funding_round/signoai-seed--97261c38,SignoAI,https://www.crunchbase.com/organization/signoai,Seed,2100000,USD,2100000,2022-10-01,Seed,,,,Yes,AI-powered conversational bot for genuine matchmaking,"Artificial Intelligence (AI), Commercial, Fleet Management, Information and Communications Technology (ICT), Machine Learning",,"Noida, Uttar Pradesh, India, Asia",https://signoai.com,,2100000,USD,2100000,Seed,1,,,,,"108,249"
Series A - Canvass AI,https://www.crunchbase.com/funding_round/canvass-analytics-series-a--383a2bf9,Canvass AI,https://www.crunchbase.com/organization/canvass-analytics,Series A,3300000,USD,3300000,2022-08-09,Early Stage Venture,,,,Yes,"Canvass AI is a platform that delivers industrial AI for industrial manufacturers, and oil and gas companies.","Artificial Intelligence (AI), Industrial Automation, Industrial Manufacturing, Predictive Analytics, Software",,"Toronto, Ontario, Canada, North America",http://canvass.io,$1M to $10M,20730000,USD,20730000,Early Stage Venture,5,Yamaha Motor Ventures,Yamaha Motor Ventures,1,,"106,277"
Funding Round - MrMandoob,https://www.crunchbase.com/funding_round/mr-mandoob-undisclosed--d9827f7e,MrMandoob,https://www.crunchbase.com/organization/mr-mandoob,Funding Round,2933333,USD,2933333,2022-06-29,,,,,Yes,"A super app on a heroic mission to connect people in the Saudi Arabia and Egypt with the best delivery services, straight to their doors.","Courier Service, Delivery, Delivery Service, Food Delivery, Predictive Analytics",,"Riyadh, Ar Riyad, Saudi Arabia, Asia",https://www.mrmandoob.com/,,20263333,USD,20263333,,3,,,,,"106,424"
Pre Seed Round - Creim INC,https://www.crunchbase.com/funding_round/creim-inc-pre-seed--503ae86d,Creim INC,https://www.crunchbase.com/organization/creim-inc,Pre-Seed,2500000,USD,2500000,2022-01-03,Seed,30000000,USD,30000000,Yes,Connecting investors to founders with a click of a button,"Analytics, Artificial Intelligence (AI), FinTech",,"Sheridan, Wyoming, United States, North America",https://app.creim.io,,2500000,USD,2500000,Seed,1,Pari Ventures,Pari Ventures,1,1,"106,993"
Seed Round - Kertos,https://www.crunchbase.com/funding_round/kertos-seed--c79f33da,Kertos,https://www.crunchbase.com/organization/kertos,Seed,4000000,EUR,4409239,2023-05-04,Seed,,,,Yes,Kertos is a software company based in Europe that develops and provides a holistic compliance and privacy platform.,"Artificial Intelligence (AI), Compliance, Legal Tech, Machine Learning, Privacy, Software",,"München, Bayern, Germany, Europe",https://kertos.io,$1M to $10M,5000000,EUR,5462154,Seed,2,Redstone,"10x Founders, Christoph Baumeister, Pi Labs, Redstone, seed + speed Ventures, Superlyst Ventures, VR Ventures, xdeck",8,2,"107,116"
Angel Round - Technical Paradigm,https://www.crunchbase.com/funding_round/technical-paradigm-angel--33d1d130,Technical Paradigm,https://www.crunchbase.com/organization/technical-paradigm,Angel,3700000,USD,3700000,2023-05-05,Seed,,,,Yes,Technical Paradigm is more than just an IT staffing agency. We take a strategic approach staffing in niche technical talent.,"Artificial Intelligence (AI), Information Technology, Machine Learning, Management Information Systems, Recruiting, Software, Staffing Agency, Web Development",,"Chicago, Illinois, United States, North America",https://technicalparadigm.com,$1M to $10M,11200000,USD,11200000,Private Equity,2,,,,,"109,859"
Pre Seed Round - Acroo Labs,https://www.crunchbase.com/funding_round/acroo-co-pre-seed--58dfa509,Acroo Labs,https://www.crunchbase.com/organization/acroo-co,Pre-Seed,2400000,GBP,2866079,2023-02-24,Seed,48000000,GBP,57321578,Yes,Enhancing human resilience through the power of artificial-intelligence.,"Artificial Intelligence (AI), Information Technology",,"London, England, United Kingdom, Europe",https://acroo.co,,2480000,GBP,2965927,Seed,2,Family Office,Family Office,1,,"109,573"
Seed Round - Fabi.ai,https://www.crunchbase.com/funding_round/fabi-ai-seed--6a75fc47,Fabi.ai,https://www.crunchbase.com/organization/fabi-ai,Seed,3000000,USD,3000000,2023-04-28,Seed,,,,Yes,Fabi.ai is a conversational AI engine which frees data teams from writing SQL for ad hoc requests.,"Analytics, Artificial Intelligence (AI), Developer Tools",,"San Francisco, California, United States, North America",https://www.fabi.ai/,,3000000,USD,3000000,Seed,1,Eniac Ventures,Eniac Ventures,1,4,"109,909"
Grant - iLoF,https://www.crunchbase.com/funding_round/ilof-intelligent-lab-on-fiber-grant--0171155a,iLoF,https://www.crunchbase.com/organization/ilof-intelligent-lab-on-fiber,Grant,2500000,EUR,2676384,2023-01-01,,,,,No,iLoF is a digital health company pioneering a breakthrough AI-platform to accelerate the future of personalized medicine.,"Artificial Intelligence (AI), Biotechnology, Health Care, Health Diagnostics, Machine Learning, Medical Device, Precision Medicine",,"London, England, United Kingdom, Europe",https://ilof.tech/,$1M to $10M,10980063,USD,10980063,Seed,7,European Innovation Council,European Innovation Council,1,,"111,877"
Seed Round - Replica Studios,https://www.crunchbase.com/funding_round/replica-studios-seed--757c5444,Replica Studios,https://www.crunchbase.com/organization/replica-studios,Seed,4200000,USD,4200000,2022-11-01,Seed,,,,Yes,Replica Studios creates naturally expressive voice-overs and performances through an AI that can replicate the human voice.,"Artificial Intelligence (AI), Audiobooks, Automotive, Content Creators, Corporate Training, Information Technology, Media and Entertainment, Video Games",,"Brisbane, Queensland, Australia, Oceania",https://replicastudios.com,$1M to $10M,9573757,USD,9573757,Seed,3,,,,,"112,020"
Seed Round - Tennr,https://www.crunchbase.com/funding_round/tennr-seed--1b991728,Tennr,https://www.crunchbase.com/organization/tennr,Seed,4500000,USD,4500000,2023-05-01,Seed,,,,Yes,Tennr turns healthcare operations into growth.,"Artificial Intelligence (AI), Internet, Virtual Assistant",,"New York, New York, United States, North America",https://www.tennr.com,,23000000,USD,23000000,Early Stage Venture,3,,,,,"111,107"
Pre Seed Round - Flower Labs,https://www.crunchbase.com/funding_round/flower-1de8-pre-seed--b9d69633,Flower Labs,https://www.crunchbase.com/organization/flower-1de8,Pre-Seed,3600000,USD,3600000,2023-04-05,Seed,,,,Yes,"Flower is a federated learning, analytics, and evaluation platform.","Machine Learning, Open Source, SaaS, Software",,"Hamburg, Hamburg, Germany, Europe",https://flower.ai,$1M to $10M,23600000,USD,23600000,Early Stage Venture,2,"First Spark Ventures, Y Combinator","Betaworks, Clément Delangue, Factorial Capital, First Spark Ventures, Pioneer Fund, Y Combinator",6,,"110,328"
Seed Round - Talkie.ai,https://www.crunchbase.com/funding_round/talkie-ai-seed--2ccfebb0,Talkie.ai,https://www.crunchbase.com/organization/talkie-ai,Seed,2900000,USD,2900000,2022-07-22,Seed,,,,Yes,Talkie improves efficiency of Patient Access using AI-based phone virtual assistants.,"Artificial Intelligence (AI), Health Care, Machine Learning, Messaging, Natural Language Processing",,"Warszawa, Mazowieckie, Poland, Europe",https://talkie.ai,$1M to $10M,3900000,USD,3900000,Seed,2,4growth VC,"4growth VC, FundingBox Deep Tech Fund, Gateway Ventures, LT Capital, Movens Capital, NCBR Investment Fund ASI S.A., SATUS Starter, ZAKA VC",8,2,"110,594"
Seed Round - Rubik,https://www.crunchbase.com/funding_round/rubik-9055-seed--8f0c5534,Rubik,https://www.crunchbase.com/organization/rubik-9055,Seed,4666582,USD,4666582,2022-05-09,Seed,,,,Yes,Rubik is a financial data platform for single family homes.,"Financial Services, Machine Learning, Real Estate",,"New York, New York, United States, North America",https://rubikhomes.com,$10M to $50M,4791582,USD,4791582,Seed,4,Ulu Ventures,"AAF Management Ltd., Green Egg Ventures, Greg Waldorf, Remarkable Ventures, South Central Ventures, Ulu Ventures, Unpopular Ventures",7,1,"110,759"
Seed Round - Lavender,https://www.crunchbase.com/funding_round/lavender-32b8-seed--32114d0e,Lavender,https://www.crunchbase.com/organization/lavender-32b8,Seed,2200000,USD,2200000,2023-02-02,Seed,,,,Yes,Lavender is a software application that offers AI sales email coaches and web services.,"Artificial Intelligence (AI), Email Marketing, Software",,"New York, New York, United States, North America",https://www.lavender.ai,$1M to $10M,13200000,USD,13200000,Early Stage Venture,2,"Kyber Knight Capital, Signia Venture Partners","Alex Lieberman, Arash Ferdowsi, Braydan Young, CapitalX, Kyber Knight Capital, Position Ventures, Signia Venture Partners, Troy Osinoff",8,,"112,269"
Grant - Kvantify,https://www.crunchbase.com/funding_round/kvantify-grant--c2f826e5,Kvantify,https://www.crunchbase.com/organization/kvantify,Grant,2500000,EUR,2705604,2023-01-15,,,,,No,Kvantify provides Quantum computing and HPC software solutions that address hard computational challenges.,"Artificial Intelligence (AI), Cloud Computing, FinTech, Information Technology, Life Science, Machine Learning, Quantum Computing, Software",,"Copenhagen, Hovedstaden, Denmark, Europe",https://www.kvantify.dk/,,12500000,EUR,13449651,Seed,4,,European Innovation Council,1,,"111,666"
Product Crowdfunding - Heisenberg Robotics,https://www.crunchbase.com/funding_round/heisenberg-robotics-product-crowdfunding--f1e4350c,Heisenberg Robotics,https://www.crunchbase.com/organization/heisenberg-robotics,Product Crowdfunding,2308153,USD,2308153,2023-02-28,,,,,No,Heisenberg Robotics designs and develops autonomous lawn care robots using advanced vision and AI for consumer and commercial applications.,"Artificial Intelligence (AI), Computer Vision, Machine Learning, Robotics",,"Shenzhen, Guangdong, China, Asia",https://heisenberg-robotics.com/,,2308153,USD,2308153,Seed,2,,,,,"113,405"
Seed Round - Botco.ai,https://www.crunchbase.com/funding_round/botco-ai-c133-seed--db8c1fc7,Botco.ai,https://www.crunchbase.com/organization/botco-ai-c133,Seed,3000000,USD,3000000,2023-05-04,Seed,,,,Yes,The GenAI Chat Cloud empowers enterprises to leverage the power of generative AI in conversational interactions combining fine tunned LLMs.,"Artificial Intelligence (AI), Machine Learning",,"Scottsdale, Arizona, United States, North America",https://www.botco.ai,$1M to $10M,3000000,USD,3000000,Seed,1,,,,,"113,403"
Seed Round - Chargeflow,https://www.crunchbase.com/funding_round/chargeflow-seed--2efbc010,Chargeflow,https://www.crunchbase.com/organization/chargeflow,Seed,3000000,USD,3000000,2023-01-01,Seed,,,,Yes,"Chargeflow prevent, recovers and automates the process of credit card disputes for merchants with the power of AI.","Artificial Intelligence (AI), Credit Cards, E-Commerce, FinTech, Fraud Detection, Machine Learning, Payments, Software",,"Modi'in, HaMerkaz, Israel, Asia",https://chargeflow.io/,$1M to $10M,14000000,USD,14000000,Seed,2,,,,,"112,786"
Series A - MākuSafe,https://www.crunchbase.com/funding_round/makusafe-corp-series-a--4f2ee41a,MākuSafe,https://www.crunchbase.com/organization/makusafe-corp,Series A,4000000,USD,4000000,2023-04-15,Early Stage Venture,,,,Yes,"MākuSafe is a technology and data analytics company that offers wearable safety, data, and analytics solutions.","Analytics, Artificial Intelligence (AI), Big Data, InsurTech, SaaS",,"West Des Moines, Iowa, United States, North America",http://www.makusafe.com,$1M to $10M,21410000,USD,21410000,Early Stage Venture,8,,,,,"113,854"
Seed Round - Shoplift.ai,https://www.crunchbase.com/funding_round/shoplift-seed--28d7a2ba,Shoplift.ai,https://www.crunchbase.com/organization/shoplift,Seed,2500000,USD,2500000,2023-01-01,Seed,,,,Yes,Shoplift is the first intelligent storefront optimization engine for Shopify merchants,"Analytics, Artificial Intelligence (AI), E-Commerce Platforms, Retail Technology, SaaS",,"New York, New York, United States, North America",https://www.shoplift.ai/,$1M to $10M,2500000,USD,2500000,Seed,1,Loeb.nyc,Loeb.nyc,1,,"113,534"
Seed Round - RailVision Analytics,https://www.crunchbase.com/funding_round/railvision-analytics-seed--65fef167,RailVision Analytics,https://www.crunchbase.com/organization/railvision-analytics,Seed,4000000,USD,4000000,2022-11-03,Seed,,,,Yes,RailVision Analytics uses AI in a map-based application to reduce fuel consumption and improve safety in the rail industry.,"Artificial Intelligence (AI), Machine Learning, Railroad, Software, Transportation",,"Montréal, Quebec, Canada, North America",https://www.railvision.ca,$1M to $10M,4532580,USD,4532580,Seed,4,Trucks Venture Capital,"Active Impact Investments, Blackhorn Ventures, Incite.org, Measured Ventures, MUUS, Neil Murdoch, Trucks Venture Capital",7,1,"114,729"
Pre Seed Round - Tabula,https://www.crunchbase.com/funding_round/retable-pre-seed--eea7eb24,Tabula,https://www.crunchbase.com/organization/retable,Pre-Seed,2500000,USD,2500000,2022-03-01,Seed,,,,Yes,Tabula is an end-to-end data automation platform that enables true collaboration between business and data teams.,"Analytics, Artificial Intelligence (AI), Business Intelligence, Data Integration, Data Management, Data Visualization, Enterprise Software, Generative AI, Small and Medium Businesses, Software",,"Seattle, Washington, United States, North America",https://www.tabula.io/,,2500000,USD,2500000,Seed,1,,"DataPower Ventures, Zero Prime Ventures",2,1,"115,063"
Pre Seed Round - Twirl,https://www.crunchbase.com/funding_round/twirl-9d5c-pre-seed--24b31883,Twirl,https://www.crunchbase.com/organization/twirl-9d5c,Pre-Seed,2300000,EUR,2476980,2023-05-23,Seed,,,,Yes,Twirl is a platform for data teams that want to ship value rather than tooling.,"Analytics, Cloud Data Services, Machine Learning",,"Stockholm, Stockholms Lan, Sweden, Europe",https://twirldata.com/,,2300000,EUR,2476980,Seed,1,Creandum,"Cocoa, Creandum",2,2,"115,049"
Seed Round - Momentum,https://www.crunchbase.com/funding_round/moda-ai-seed--b22e3dca,Momentum,https://www.crunchbase.com/organization/moda-ai,Seed,3690000,USD,3690000,2022-02-01,Seed,,,,Yes,An AI-powered RPA platform enabling automation of repetitive daily tasks that seamlessly integrates with your existing software tools.,"Artificial Intelligence (AI), Machine Learning, Productivity Tools, Robotic Process Automation (RPA), Software",,"San Francisco, California, United States, North America",https://www.momentum.inc/,,3690000,USD,3690000,Seed,1,,,,,"116,149"
Pre Seed Round - PureCode AI,https://www.crunchbase.com/funding_round/purecode-software-pre-seed--73f2c1ac,PureCode AI,https://www.crunchbase.com/organization/purecode-software,Pre-Seed,3000000,USD,3000000,2022-09-01,Seed,,,,Yes,PureCode AI is a front-end developer tool where engineers can use text to describe and generate or customize software user interfaces.,"Artificial Intelligence (AI), Developer Tools, Information Services, Information Technology, Software, Software Engineering, Web Development",,"Austin, Texas, United States, North America",https://purecode.ai/,$1M to $10M,3000000,USD,3000000,Seed,1,Draper Associates,"Draper Associates, ff Venture Capital",2,,"116,706"
Convertible Note - Scibids,https://www.crunchbase.com/funding_round/scibids-convertible-note--8541e471,Scibids,https://www.crunchbase.com/organization/scibids,Convertible Note,2000000,EUR,2262602,2022-01-20,,,,,No,Scibids develops customizable AI for the digital media performance needs of brands.,"Advertising, Artificial Intelligence (AI), Marketing",,"Paris, Ile-de-France, France, Europe",https://scibids.com,Less than $1M,4260000,EUR,4880825,M&A,4,BlackSheep Ventures,BlackSheep Ventures,1,1,"117,123"
Seed Round - TestDynamics,https://www.crunchbase.com/funding_round/testdynamics-seed--0ca8c01b,TestDynamics,https://www.crunchbase.com/organization/testdynamics,Seed,3045000,USD,3045000,2022-08-22,Seed,,,,Yes,"TestDynamics provides health diagnostics, machine learning, computer vision, digital health, and medical imaging services.","Artificial Intelligence (AI), Health Care, Health Diagnostics, Machine Learning, Medical",,"New York, New York, United States, North America",https://testdynamics.net,,3045000,USD,3045000,Seed,2,World Trade Ventures,"Ahikam Kaufman, Silvertech Ventures, World Trade Ventures",3,,"116,371"
Pre Seed Round - UMAMI Bioworks,https://www.crunchbase.com/funding_round/umami-meats-pre-seed--241513e6,UMAMI Bioworks,https://www.crunchbase.com/organization/umami-meats,Pre-Seed,2400000,USD,2400000,2022-03-02,Seed,,,,Yes,"UMAMI Bioworks is building the development and production platform for seafood that is cultivated, not caught.","Food and Beverage, Food Processing, Innovation Management, Machine Learning, Manufacturing, Seafood",,"Singapore, Central Region, Singapore, Asia",https://www.umamibioworks.com,,2400000,USD,2400000,Seed,8,"Better Bite Ventures, Cult Food Science, Genedant","Better Bite Ventures, Cult Food Science, Genedant, Impact Venture Capital, Katapult Ocean, Plug and Play, Plug and Play Asia Pacific, Prithvi Ventures, Venture for America",9,2,"116,301"
Seed Round - Simplefin,https://www.crunchbase.com/funding_round/simplefin-4582-seed--af554139,Simplefin,https://www.crunchbase.com/organization/simplefin-4582,Seed,2700000,USD,2700000,2022-09-11,Seed,,,,Yes,Simplefin makes it easy to manage petty cash by replacing cash and physical receipts with prepaid cards and a software solution.,"Artificial Intelligence (AI), Blockchain, FinTech, Machine Learning, Prepaid Cards",,"Kharkiv, Sums'ka Oblast', Ukraine, Europe",https://simplefin.top,,2700000,USD,2700000,Seed,1,,,,,"117,089"
Seed Round - Oivi,https://www.crunchbase.com/funding_round/oivi-seed--7f3a6cb8,Oivi,https://www.crunchbase.com/organization/oivi,Seed,3000000,USD,3000000,2023-01-27,Seed,,,,Yes,"Smart and automated eye screening, anywhere.","Artificial Intelligence (AI), Health Care, Medical Device, Software",,"Oslo, Oslo, Norway, Europe",https://www.oivi.co,$1M to $10M,16046592,USD,16046592,Seed,14,,"Arali Ventures, Farvatn Venture, Stratel",3,,"395,820"
Seed Round - Skylark Labs,https://www.crunchbase.com/funding_round/skylark-labs-seed--07ba123f,Skylark Labs,https://www.crunchbase.com/organization/skylark-labs,Seed,2760000,USD,2760000,2023-02-23,Seed,,,,Yes,Skylark Labs develops Dual-Use Self-Learning AI that provides analytics to strengthen National Security.,"Artificial Intelligence (AI), Computer Vision, Machine Learning, National Security, Physical Security, Security",,"Palo Alto, California, United States, North America",https://skylarklabs.ai/,$1M to $10M,3510000,USD,3510000,Seed,2,,"Kube VC, ShockVentures, The Josephine Collective",3,,"117,288"
Seed Round - Attentive,https://www.crunchbase.com/funding_round/attentive-ai-seed--7f0ab12f,Attentive,https://www.crunchbase.com/organization/attentive-ai,Seed,5000000,USD,5000000,2022-07-12,Seed,,,,Yes,Attentive is an AI based SaaS platform for the landscaping and outdoor service industry,"Artificial Intelligence (AI), Information Technology, Landscaping, SaaS, Software",,"Wilmington, Delaware, United States, North America",https://attentive.ai,$10M to $50M,14000000,USD,14000000,Early Stage Venture,4,,"Info Edge ventures, Surge",2,1,"398,339"
Seed Round - Bizbaz,https://www.crunchbase.com/funding_round/bizbaz-seed--3df954bf,Bizbaz,https://www.crunchbase.com/organization/bizbaz,Seed,4000000,USD,4000000,2022-09-30,Seed,,,,Yes,Bizbaz offers credit scoring and risk assessment solutions for unbanked populations in Asia.,"Business Intelligence, Credit, Financial Services, FinTech, Predictive Analytics",,"Singapore, Central Region, Singapore, Asia",https://bizbaz.tech,$1M to $10M,4300000,USD,4300000,Seed,3,HSBC Asset Management,"HSBC Asset Management, SOSV, Vynn Capital",3,1,"661,511"
Seed Round - Lavita,https://www.crunchbase.com/funding_round/lavita-8ba0-seed--5325ca31,Lavita,https://www.crunchbase.com/organization/lavita-8ba0,Seed,5000000,USD,5000000,2023-05-10,Seed,,,,Yes,Lavita is a blockchain-AI based next generation healthcare platform.,"Artificial Intelligence (AI), Blockchain, Health Care",,"San Francisco, California, United States, North America",https://www.lavita.ai/,,5000000,USD,5000000,Seed,1,Camford Capital,Camford Capital,1,,"633,475"
Seed Round - Mustard,https://www.crunchbase.com/funding_round/mustard-78c9-seed--e774cda2,Mustard,https://www.crunchbase.com/organization/mustard-78c9,Seed,3750000,USD,3750000,2022-01-18,Seed,,,,Yes,Mustard is an elite-level motion analysis app for broad athletics coaching.,"Apps, Artificial Intelligence (AI), Baseball, Sports",,"Los Angeles, California, United States, North America",https://teammstrd.com/,$1M to $10M,5450000,USD,5450000,Seed,2,leAD Lake Nona Sports & Health Academy,"Adam Jacobs, Dan Rosensweig, David C. Novak, Drew Brees, Gary Jacobs, Global Rugby Ventures, Intersect VC, Justin Rose, Justin Siegel, leAD Lake Nona Sports & Health Academy, Mark Cuban, MLS Players Association, Nolan Ryan, One Team Partners, Reid Ryan, Ronnie Lott, Shasta Ventures, U.S. Women's National Team Players Association, Wessel Management",19,2,"399,908"
Pre Seed Round - Get More Brain,https://www.crunchbase.com/funding_round/get-more-brain-pre-seed--b76fed5e,Get More Brain,https://www.crunchbase.com/organization/get-more-brain,Pre-Seed,2500000,CHF,2708266,2022-03-31,Seed,,,,Yes,Next Generation Learning Management System (LMS),"Artificial Intelligence (AI), E-Learning, EdTech, Education, Mobile Apps, Software",,"Zürich, Zurich, Switzerland, Europe",https://www.getmorebrain.com,,2500000,CHF,2708266,Seed,1,SICTIC,SICTIC,1,1,"322,367"
Debt Financing - Tourmo,https://www.crunchbase.com/funding_round/tourmaline-labs-debt-financing--ba30f765,Tourmo,https://www.crunchbase.com/organization/tourmaline-labs,Debt Financing,5000000,USD,5000000,2022-05-02,,,,,No,Tourmo are the Experts Solving Your Mobility Challenges - Harnessing the Mobility Data Storm Through Artificial Intelligence.,"Artificial Intelligence (AI), Automotive, Big Data, Business Intelligence, Enterprise Applications, Information Technology, Machine Learning, Real Time, SaaS, Software",,"San Diego, California, United States, North America",https://www.tourmalinelabs.com/,$1M to $10M,8000000,USD,8000000,Seed,5,Bridge Bank,Bridge Bank,1,,"635,332"
Seed Round - Daivergent,https://www.crunchbase.com/funding_round/daivergent-seed--9e1550d0,Daivergent,https://www.crunchbase.com/organization/daivergent,Seed,3300000,USD,3300000,2022-08-01,Seed,,,,Yes,Daivergent is the first reimbursable job-readiness and care delivery platform for the 70 million adult disability population.,"Artificial Intelligence (AI), Big Data, EdTech, Employment, Human Resources, Virtual Workforce",,"New York, New York, United States, North America",http://daivergent.com/,Less than $1M,4350000,USD,4350000,,6,Zeal Capital Partners,"Difference Partners, Divergent Investments, Enable Ventures, Kapor Capital, Moai Capital, Remarkable Ventures, Springbank Collective, Zeal Capital Partners",8,4,"408,991"
Series A - Bionomous,https://www.crunchbase.com/funding_round/bionomous-series-a--01316a99,Bionomous,https://www.crunchbase.com/organization/bionomous,Series A,2700000,USD,2700000,2023-01-20,Early Stage Venture,,,,Yes,Bionomous develops devices that automatically inspect and sort miniature biological entities.,"Biotechnology, Machine Learning",,"Lausanne, Vaud, Switzerland, Europe",https://bionomous.ch/,$1M to $10M,4259721,USD,4259721,Early Stage Venture,5,NIVALIS Group,"Capital Risque Fribourg, Cybernetix Ventures, NIVALIS Group",3,3,"410,598"
