Series C - Carro,https://www.crunchbase.com/funding_round/carro-series-c--c1a986bf,Carro,https://www.crunchbase.com/organization/carro,Series C,100000000,USD,100000000,2021-11-30,Late Stage Venture,,,,Yes,"Carro is an online used car marketplace that provides services for purchasing vehicles, including financing options and insurance.","Artificial Intelligence (AI), Automotive, E-Commerce Platforms, Marketplace",,"Singapore, Central Region, Singapore, Asia",http://carro.sg,$100M to $500M,760558453,USD,760558453,,13,,"Emtek Group, Greater Honour International, Mirae Asset, Permodalan Nasional Berhad, Shinhan Financial Group, Sime Darby, Temasek Holdings",7,,"132,691"
Series A - Arize AI,https://www.crunchbase.com/funding_round/arize-ai-series-a--bd5e7e8c,Arize AI,https://www.crunchbase.com/organization/arize-ai,Series A,19000000,USD,19000000,2021-09-28,Early Stage Venture,,,,Yes,Arize AI offers a platform that explains and troubleshoots production AI.,"Artificial Intelligence (AI), Information Technology, Machine Learning, Software",Women Founded,"Mill Valley, California, United States, North America",https://arize.com,,61024999,USD,61024999,Early Stage Venture,3,Battery Ventures,"Battery Ventures, Foundation Capital, Swift Ventures, The House Fund, Trinity Ventures",5,2,"133,457"
Post-IPO Equity - Irisity AB (publ),https://www.crunchbase.com/funding_round/mindmancer-post-ipo-equity--03724d4e,Irisity AB (publ),https://www.crunchbase.com/organization/mindmancer,Post-IPO Equity,15000000,USD,15000000,2021-09-01,,,,,Yes,Irisity AB (publ) world-leading video analytics company,"Analytics, Artificial Intelligence (AI), Machine Learning, Physical Security, Security, Software",,"Gothenburg, Vastra Gotaland, Sweden, Europe",http://www.irisity.com/,$10M to $50M,34126713,USD,34126713,IPO,8,,"Berenberg, Chalmers University of Technology, Lannebo Fonder, Stena Metall, Svenska Handelsbanken, TIN Fonder",6,,"312,093"
Series B - Duality Technologies,https://www.crunchbase.com/funding_round/duality-series-b--299136c0,Duality Technologies,https://www.crunchbase.com/organization/duality,Series B,30000000,USD,30000000,2021-10-05,Early Stage Venture,,,,Yes,Duality empowers organizations to extract business value from sensitive data by enabling secure data collaborations within their ecosystem.,"Artificial Intelligence (AI), Cyber Security, Software",Women Founded,"Hoboken, New Jersey, United States, North America",https://dualitytech.com,$1M to $10M,50000000,USD,50000000,Early Stage Venture,3,LG Technology Ventures,"Euclidean Capital, Hearst Ventures, Intel Capital, LG Technology Ventures, NAventures, Team8",6,3,"440,097"
Series C - Shield AI,https://www.crunchbase.com/funding_round/shield-ai-series-c--7fdd49f6,Shield AI,https://www.crunchbase.com/organization/shield-ai,Series C,70000000,USD,70000000,2021-02-23,Late Stage Venture,,,,Yes,Shield AI is an artificial intelligence company that aims to protect service members and civilians with intelligent systems.,"Artificial Intelligence (AI), Autonomous Vehicles, Drones, Machine Learning, National Security",,"San Diego, California, United States, North America",http://www.shield.ai,$50M to $100M,1073144999,USD,1073144999,Late Stage Venture,13,Point72 Ventures,Point72 Ventures,1,1,"548,275"
Venture Round - Greater Than,https://www.crunchbase.com/funding_round/greater-than-series-unknown--45b60251,Greater Than,https://www.crunchbase.com/organization/greater-than,Venture - Series Unknown,136000000,SEK,16268575,2021-01-29,,,,,Yes,"Greater Than is an AI and insurtech company, providing predictive risk insights, services and apps for car sharing, fleets and new mobility.","Artificial Intelligence (AI), FinTech, Information Technology, InsurTech",,"Stockholm, Stockholms Lan, Sweden, Europe",http://www.greaterthan.eu/,$1M to $10M,136000000,SEK,16268575,,1,,,,,"440,463"
Venture Round - Reveleer,https://www.crunchbase.com/funding_round/reveleer-series-unknown--32e54d1b,Reveleer,https://www.crunchbase.com/organization/reveleer,Venture - Series Unknown,65000000,USD,65000000,2021-12-07,,,,,Yes,"Reveleer provides health plan software and services for risk adjustment, quality, and data analytics using NLP technology.","Artificial Intelligence (AI), Health Care, Information Technology, Machine Learning, SaaS",,"Glendale, California, United States, North America",https://www.reveleer.com,$10M to $50M,208799992,USD,208799992,,10,Oak HC/FT,"Boston Millennia Partners, Oak HC/FT, Upfront Ventures",3,3,"474,838"
Series B - Sproutt Insurance,https://www.crunchbase.com/funding_round/sproutt-insurance-series-b--10619eb2,Sproutt Insurance,https://www.crunchbase.com/organization/sproutt-insurance,Series B,26000000,USD,26000000,2021-09-14,Early Stage Venture,,,,Yes,Sproutt is an insurance company that offers people a smarter and easier way to buy life insurance.,"Artificial Intelligence (AI), Insurance, Life Insurance",,"Hartford, Connecticut, United States, North America",https://sproutt.com/,$1M to $10M,38000000,USD,38000000,Early Stage Venture,2,MoreTech Ventures,"Alpha Wave Global, FinTLV Ventures, Guardian Life, Harel Insurance and Financial, Moneta VC, MoreTech Ventures, Raptor Group, State of Mind Ventures",8,3,"441,756"
Series A - Encord,https://www.crunchbase.com/funding_round/cord-0d3f-series-a--6b866a74,Encord,https://www.crunchbase.com/organization/cord-0d3f,Series A,15000000,USD,15000000,2021-10-13,Early Stage Venture,,,,Yes,Encord is a data development platform for AI,"Artificial Intelligence (AI), Computer Vision, Machine Learning, Software",,"San Francisco, California, United States, North America",https://encord.com,,20000000,USD,20000000,Early Stage Venture,3,CRV,"Crane Venture Partners, CRV, Harpoon, Y Combinator Continuity Fund",4,1,"265,739"
Series A - Rasgo,https://www.crunchbase.com/funding_round/rasgo-5e6c-series-a--caf21cf9,Rasgo,https://www.crunchbase.com/organization/rasgo-5e6c,Series A,25000000,USD,25000000,2021-06-24,Early Stage Venture,,,,Yes,"Rasgo - the metric command center, eliminates the metric inconsistencies that cause different answers from the same data.","Analytics, Artificial Intelligence (AI), Big Data, Data Center Automation, Data Visualization, Machine Learning, Software",,"New York, New York, United States, North America",https://www.rasgoml.com,$1M to $10M,25000000,USD,25000000,Early Stage Venture,1,Insight Partners,"Insight Partners, Unusual Ventures, Zero Prime Ventures",3,1,"443,259"
Venture Round - AccutarBio,https://www.crunchbase.com/funding_round/accutarbio-series-unknown--a7bce118,AccutarBio,https://www.crunchbase.com/organization/accutarbio,Venture - Series Unknown,28452239,USD,28452239,2021-01-05,,,,,Yes,AccutarBio employs artificial intelligence to revolutionize drug discovery.,"Artificial Intelligence (AI), Biopharma, Biotechnology, Machine Learning",,"Shanghai, Shanghai, China, Asia",https://www.accutarbio.com,$1M to $10M,76613745,USD,76613745,,5,,,,,"264,967"
Post-IPO Equity - AEye,https://www.crunchbase.com/funding_round/aeye-inc-post-ipo-equity--d7d10e44,AEye,https://www.crunchbase.com/organization/aeye-inc,Post-IPO Equity,225000000,USD,225000000,2021-08-18,,,,,Yes,"AEye develops adaptive, high performance lidar systems for automotive, trucking, smart infrastructure and logistics applications.","Artificial Intelligence (AI), Automotive, Autonomous Vehicles, Hardware, Software",,"Dublin, California, United States, North America",http://www.aeye.ai,$1M to $10M,364146590,USD,364146590,IPO,11,,"General Motors Ventures, Hella Ventures, Intel Capital, SBI Investment, Taiwania Capital Management Corporation",5,,"265,004"
Post-IPO Equity - Taboola,https://www.crunchbase.com/funding_round/taboola-post-ipo-equity--33b13288,Taboola,https://www.crunchbase.com/organization/taboola,Post-IPO Equity,285000000,USD,285000000,2021-06-30,,,,,Yes,Taboola is an AI-powered content discovery platform that connects people with content on the web that suits their interests.,"Advertising, Advertising Platforms, Artificial Intelligence (AI), Content Discovery, Content Marketing, Native Advertising",,"New York, New York, United States, North America",https://www.taboola.com,$1B to $10B,446300000,USD,446300000,IPO,10,,"Baron Capital, BlackRock, Federated Kaufmann Fund, Fidelity, Phoenix Insurance Company",5,,"461,760"
Series D - Nuro,https://www.crunchbase.com/funding_round/nuro-2-series-d--98c1a4ab,Nuro,https://www.crunchbase.com/organization/nuro-2,Series D,600000000,USD,600000000,2021-11-02,Late Stage Venture,8000000000,USD,8000000000,Yes,Nuro develops and operates a fleet of electric and autonomous vehicles.,"Artificial Intelligence (AI), Autonomous Vehicles, Robotics, Transportation",,"Mountain View, California, United States, North America",https://nuro.ai,$100M to $500M,2132148855,USD,2132148855,Late Stage Venture,8,Tiger Global Management,"Baillie Gifford, Fidelity, Gaorong Capital, Google, Kroger, SoftBank Vision Fund, T. Rowe Price, Tiger Global Management, Woven Capital",9,2,"586,387"
Series B - Horizon3.ai,https://www.crunchbase.com/funding_round/horizon3-ai-series-b--3616c5de,Horizon3.ai,https://www.crunchbase.com/organization/horizon3-ai,Series B,30000000,USD,30000000,2021-10-29,Early Stage Venture,,,,Yes,Horizon3.ai develops NodeZero which provides an autonomous penetration testing solution that helps customers find and fix attack vectors.,"Artificial Intelligence (AI), Cyber Security, Enterprise Software, Machine Learning, Network Security",,"San Francisco, California, United States, North America",https://www.horizon3.ai,$10M to $50M,78500000,USD,78500000,Late Stage Venture,4,SignalFire,SignalFire,1,1,"265,943"
Series A - Delfi Diagnostics,https://www.crunchbase.com/funding_round/delfi-diagnostics-series-a--0ccd19af,Delfi Diagnostics,https://www.crunchbase.com/organization/delfi-diagnostics,Series A,100000000,USD,100000000,2021-01-12,Early Stage Venture,,,,Yes,"Delfi Diagnostics detects cancer early, when it is most curable, using high precision non-invasive blood tests.","Artificial Intelligence (AI), Biotechnology, Health Care, Health Diagnostics, Medical",,"Baltimore, Maryland, United States, North America",https://delfidiagnostics.com,,330500000,USD,330500000,Early Stage Venture,3,OrbiMed,"AV8 Ventures, Cowen Healthcare Investments, Foresite Capital, Illumina Ventures, Menlo Ventures, Northpond Ventures, OrbiMed, OUP (Osage University Partners), Rock Springs Capital, Samsara BioCapital, T. Rowe Price, Windham Venture Partners",12,2,"463,239"
Series A - Causaly,https://www.crunchbase.com/funding_round/causaly-inc-series-a--c4b42953,Causaly,https://www.crunchbase.com/organization/causaly-inc,Series A,17000000,USD,17000000,2021-05-17,Early Stage Venture,,,,Yes,Causaly develops a biomedical research discovery tool designed to find and unlock key hidden evidence in biomedicine.,"Artificial Intelligence (AI), Life Science, Pharmaceutical, Semantic Search, Software",,"London, England, United Kingdom, Europe",https://www.causaly.com,$1M to $10M,93000000,USD,93000000,Early Stage Venture,5,Index Ventures,"Index Ventures, Marathon Venture Capital, Pentech Ventures",3,1,"636,064"
Series C - CommerceIQ,https://www.crunchbase.com/funding_round/commerceiq-series-c--81f8df68,CommerceIQ,https://www.crunchbase.com/organization/commerceiq,Series C,60000000,USD,60000000,2021-06-22,Late Stage Venture,,,,Yes,CommerceIQ is an omnichannel management platform that helps large brands use machine learning and automation to increase e-commerce sales.,"Analytics, Consumer Goods, E-Commerce, Machine Learning, Sales, Software",,"Palo Alto, California, United States, North America",https://commerceiq.ai,$10M to $50M,195500000,USD,195500000,Late Stage Venture,4,Insight Partners,"Insight Partners, Madrona, Shasta Ventures, Trinity Ventures",4,2,"464,262"
Series A - Optimal Dynamics,https://www.crunchbase.com/funding_round/optimal-dynamics-series-a--ef976971,Optimal Dynamics,https://www.crunchbase.com/organization/optimal-dynamics,Series A,18400000,USD,18400000,2021-05-13,Early Stage Venture,,,,Yes,Optimal Dynamics is a SaaS company that uses artificial intelligence and machine learning to disrupt the logistics industry.,"Artificial Intelligence (AI), Logistics, Machine Learning, SaaS, Software, Supply Chain Management, Transportation",,"New York, New York, United States, North America",http://www.optimaldynamics.com,Less than $1M,55795000,USD,55795000,Early Stage Venture,5,Bessemer Venture Partners,"Bessemer Venture Partners, Embark Ventures, Fitz Gate Ventures, Fusion Fund, John Hess, John Larkin, TenOneTen Ventures, The Westly Group",8,1,"268,612"
Series C - Gaussian Robot,https://www.crunchbase.com/funding_round/gaussian-robot-series-c--71da8295,Gaussian Robot,https://www.crunchbase.com/organization/gaussian-robot,Series C,1200000000,CNY,187819881,2021-11-10,Late Stage Venture,813000000,USD,813000000,Yes,Gaussian Robot is a robotics company that develops intelligent cleaning robots.,"Artificial Intelligence (AI), Robotics",,"Shanghai, Shanghai, China, Asia",http://www.gs-robot.com/,$1M to $10M,394654068,USD,394654068,Late Stage Venture,10,"Capital Today, SoftBank Vision Fund","Capital Today, Grand Flight Investment, Jinyi Capital, Meituan, SoftBank Vision Fund",5,,"266,093"
Series D - Komodo Health,https://www.crunchbase.com/funding_round/komodo-health-series-d--c4901e48,Komodo Health,https://www.crunchbase.com/organization/komodo-health,Series D,44000000,USD,44000000,2021-01-11,Late Stage Venture,,,,Yes,Komodo Health is a healthcare technology company that connects patients and doctors.,"Health Care, Information Technology, Predictive Analytics, Software",,"San Francisco, California, United States, North America",http://komodohealth.com,$100M to $500M,514000000,USD,514000000,,7,,ICONIQ Growth,1,,"266,189"
Series B - Unmind,https://www.crunchbase.com/funding_round/unmind-series-b--d048b249,Unmind,https://www.crunchbase.com/organization/unmind,Series B,47000000,USD,47000000,2021-05-12,Early Stage Venture,,,,Yes,Unmind is a B2B mental health platform providing clinically-backed tools and training.,"Apps, Artificial Intelligence (AI), B2B, Enterprise Software, Health Care, Mental Health, mHealth, Psychology, Training",,"London, England, United Kingdom, Europe",http://unmind.com,$10M to $50M,63185969,USD,63185969,Early Stage Venture,5,EQT Ventures,"EQT Ventures, Felix Capital, Project A Ventures, Sapphire Ventures, True.",5,2,"290,444"
Series C - Cowarobot,https://www.crunchbase.com/funding_round/cowarobot-series-c--2014a6ed,Cowarobot,https://www.crunchbase.com/organization/cowarobot,Series C,250000000,USD,250000000,2021-09-29,Late Stage Venture,,,,Yes,"Cowarobot is to bring people the future travel experience by using robotics, self-driving technology and other intelligent solutions.","Apps, Artificial Intelligence (AI), Information Technology, Robotics, Software",,"Shanghai, Shanghai, China, Asia",http://www.cowarobot.com/,$1M to $10M,271163192,USD,271163192,Late Stage Venture,4,,,,,"244,402"
Series E - ScienceLogic,https://www.crunchbase.com/funding_round/sciencelogic-series-e--0757d543,ScienceLogic,https://www.crunchbase.com/organization/sciencelogic,Series E,105000000,USD,105000000,2021-02-23,Late Stage Venture,,,,Yes,ScienceLogic is a provider of AI-driven monitoring solutions for hybrid cloud management.,"Analytics, Artificial Intelligence (AI), Cloud Data Services, Cloud Management, IT Management",,"Reston, Virginia, United States, North America",http://www.sciencelogic.com,$500M to $1B,235167632,USD,235167632,,7,Silver Lake Waterman,"Goldman Sachs, Intel Capital, NewView Capital, Silver Lake Waterman",4,1,"293,607"
Series C - mfine,https://www.crunchbase.com/funding_round/mfine-series-c--e7fcab2d,mfine,https://www.crunchbase.com/organization/mfine,Series C,3561000000,INR,48782865,2021-08-31,Late Stage Venture,,,,Yes,Mfine is a health-tech startup developing an AI-powered telemedicine mobile app.,"Apps, Artificial Intelligence (AI), Health Care, Hospital, Medical",,"Bengaluru, Karnataka, India, Asia",https://www.mfine.co/,$50M to $100M,97568082,USD,97568082,Late Stage Venture,7,"BEENEXT, Moore Strategic Ventures","Alteria Capital, BEENEXT, Heritas Capital, Moore Strategic Ventures, Prime Venture Partners, SBI Investment, SBI Ven Capital, Stellaris Venture Partners, YS Investment",9,6,"269,513"
Series F - WorkFusion,https://www.crunchbase.com/funding_round/crowdcomputing-systems-series-f--3993a60b,WorkFusion,https://www.crunchbase.com/organization/crowdcomputing-systems,Series F,220000000,USD,220000000,2021-03-09,Late Stage Venture,,,,Yes,WorkFusion offers automation solutions to enterprises to help them reduce costs and up-skill workforces.,"Artificial Intelligence (AI), Business Process Automation (BPA), Enterprise Software, Machine Learning, Productivity Tools, Robotic Process Automation (RPA), Software",,"New York, New York, United States, North America",http://www.workfusion.com/,$50M to $100M,341300000,USD,341300000,Late Stage Venture,7,Georgian,Georgian,1,1,"269,897"
Post-IPO Equity - Nerdy,https://www.crunchbase.com/funding_round/nerdy-post-ipo-equity--33cf3190,Nerdy,https://www.crunchbase.com/organization/nerdy,Post-IPO Equity,150000000,USD,150000000,2021-09-21,,,,,Yes,Nerdy is a direct-to-consumer platform developed for live online learning.,"Artificial Intelligence (AI), EdTech, Education",,"St Louis, Missouri, United States, North America",https://www.nerdy.com,$100M to $500M,150000000,USD,150000000,IPO,2,,"Chan Zuckerberg Initiative, Franklin Templeton, Healthcare of Ontario Pension Plan (HOOPP), Koch Industries, Learn Capital, TCV",6,,"591,876"
Series A - Mendel.ai,https://www.crunchbase.com/funding_round/mendel-health-series-a--0b226415,Mendel.ai,https://www.crunchbase.com/organization/mendel-health,Series A,18000000,USD,18000000,2021-06-07,Early Stage Venture,,,,Yes,Advancing Clinical Research by Combining Machine Precision and Human Intuition,"Analytics, Artificial Intelligence (AI), Health Care, Life Science, Medical",Women Founded,"San Jose, California, United States, North America",https://mendel.ai/,$1M to $10M,65400000,USD,65400000,Early Stage Venture,9,DCM Ventures,"BootstrapLabs, DCM Ventures, LaunchCapital, Mark Goldstein, Millennium Technology Value Partners, Olive Tree Capital, SOSV, Zola Global Investors",8,6,"163,885"
Venture Round - One Concern,https://www.crunchbase.com/funding_round/oneconcern-series-unknown--b25d1e90,One Concern,https://www.crunchbase.com/organization/oneconcern,Venture - Series Unknown,45000000,USD,45000000,2021-06-03,,,,,Yes,One Concern's is a climate analytics software that provides information on the potential financial impacts of weather.,"Analytics, Artificial Intelligence (AI), InsurTech, Risk Management, Software, Sustainability",Women Founded,"Menlo Park, California, United States, North America",http://www.oneconcern.com,$1M to $10M,119160000,USD,119160000,,7,Sompo Holdings,Sompo Holdings,1,1,"164,007"
Series B - Snorkel AI,https://www.crunchbase.com/funding_round/snorkel-ai-series-b--b2487159,Snorkel AI,https://www.crunchbase.com/organization/snorkel-ai,Series B,35000000,USD,35000000,2021-04-07,Early Stage Venture,,,,Yes,The data-centric platform of enterprise AI,"Artificial Intelligence (AI), Data Collection and Labeling, Enterprise Software, Machine Learning",Women Founded,"Redwood City, California, United States, North America",https://www.snorkel.ai/,$1M to $10M,135250000,USD,135250000,,6,Lightspeed Venture Partners,"BlackRock, Boston Trust Walden Company, Google Ventures, Greylock, In-Q-Tel, Lightspeed Venture Partners, Nepenthe Capital",7,4,"164,088"
Series B - GigaIO,https://www.crunchbase.com/funding_round/gigaio-series-b--dc4aa93f,GigaIO,https://www.crunchbase.com/organization/gigaio,Series B,14700000,USD,14700000,2021-09-16,Early Stage Venture,,,,Yes,GigaIO develops high performance interconnect memory fabric solutions for computing clusters.,"Artificial Intelligence (AI), Computer, Electronics, Information Technology, Machine Learning, Network Hardware, Network Security, Software",,"Carlsbad, California, United States, North America",http://gigaio.com/,$1M to $10M,19200000,USD,19200000,Early Stage Venture,3,Impact Venture Capital,"Four Palms Ventures, Impact Venture Capital, Lagomaj Capital, Mark IV Capital, SK Hynix",5,3,"164,115"
Series B - Pecan,https://www.crunchbase.com/funding_round/pecan-series-b--d2c58e3f,Pecan,https://www.crunchbase.com/organization/pecan,Series B,35000000,USD,35000000,2021-05-05,Early Stage Venture,,,,Yes,"Pecan is an AI platform that offers predictive analytics services for business intelligence, operations, and revenue teams.","Artificial Intelligence (AI), Business Intelligence, InsurTech, Machine Learning, Predictive Analytics, Software",,"Ramat Gan, Tel Aviv, Israel, Asia",https://www.pecan.ai,$1M to $10M,116000000,USD,116000000,Late Stage Venture,6,Notable Capital,"Dell Technologies Capital, Mindset Ventures, Notable Capital, S Capital, Vintage Investment Partners",5,1,"124,510"
Series A - BlueOcean,https://www.crunchbase.com/funding_round/blueocean-ai-series-a--c223b65c,BlueOcean,https://www.crunchbase.com/organization/blueocean-ai,Series A,15000000,USD,15000000,2021-07-21,Early Stage Venture,,,,Yes,BlueOcean is an always-on brand intelligence platform delivering data and insights that drive actions and outcomes.,"Apps, Artificial Intelligence (AI), Brand Marketing, Information Technology, Machine Learning, SaaS, Software",Women Founded,"Oakland, California, United States, North America",https://blueocean.ai,$10M to $50M,50000000,USD,50000000,Early Stage Venture,3,Insight Partners,"Global Venture Capital, Insight Partners",2,1,"629,246"
Series B - PriceHubble,https://www.crunchbase.com/funding_round/pricehubble-series-b--fbbe517c,PriceHubble,https://www.crunchbase.com/organization/pricehubble,Series B,34000000,USD,34000000,2021-07-19,Early Stage Venture,,,,Yes,"PriceHubble provides a platform dedicated to the development of Data & explainable AI-driven real estate valuations and insights, globally.","Analytics, Artificial Intelligence (AI), Big Data, Machine Learning, PropTech, Real Estate",,"Zürich, Zurich, Switzerland, Europe",https://www.pricehubble.com/,$1M to $10M,34000000,USD,34000000,Early Stage Venture,3,Yttrium,"Helvetia Venture Fund, Latitude, Martin Enderle, Swiss Life, TX Ventures, Yttrium",6,3,"629,336"
Series D - Miso Robotics,https://www.crunchbase.com/funding_round/miso-robotics-series-d--6e1398d5,Miso Robotics,https://www.crunchbase.com/organization/miso-robotics,Series D,35000000,USD,35000000,2021-06-22,Late Stage Venture,350000000,USD,350000000,Yes,"AI & Robotics for Restaurants, Makers of Flippy","Artificial Intelligence (AI), Consumer Electronics, Machine Learning, Robotics",,"Pasadena, California, United States, North America",http://misorobotics.com,$10M to $50M,96850809,USD,96850809,,12,Equity Crowdfunding,Equity Crowdfunding,1,,"165,405"
Series C - Autobrains,https://www.crunchbase.com/funding_round/cartica-ai-series-c--12b03b91,Autobrains,https://www.crunchbase.com/organization/cartica-ai,Series C,101000000,USD,101000000,2021-11-01,Late Stage Venture,,,,Yes,Autobrains is a Solutions for the Next Generation of Vehicles and Mobility,"Artificial Intelligence (AI), Automotive",,"Tel Aviv, Tel Aviv, Israel, Asia",https://autobrains.ai,$10M to $50M,145000000,USD,145000000,Late Stage Venture,4,Temasek Holdings,"BMW i Ventures, Changer Club, Continental, Eduardo Gutierrez, Knorr-Bremse, Temasek Holdings, Vinfast",7,1,"126,246"
Series B - Builder.ai,https://www.crunchbase.com/funding_round/builderai-series-b--ac61196a,Builder.ai,https://www.crunchbase.com/organization/builderai,Series B,65500000,USD,65500000,2021-05-01,Early Stage Venture,,,,Yes,Builder.ai offers a no-code AI-powered app development platform designed to build and operate software projects.,"Artificial Intelligence (AI), Developer Tools, Machine Learning, Software, Software Engineering",,"London, England, United Kingdom, Europe",http://www.builder.ai,Less than $1M,445000000,USD,445000000,Late Stage Venture,6,,,,,"631,380"
Series C - Carro,https://www.crunchbase.com/funding_round/carro-series-c--7af6a61b,Carro,https://www.crunchbase.com/organization/carro,Series C,15600000,USD,15600000,2021-12-20,Late Stage Venture,,,,Yes,"Carro is an online used car marketplace that provides services for purchasing vehicles, including financing options and insurance.","Artificial Intelligence (AI), Automotive, E-Commerce Platforms, Marketplace",,"Singapore, Central Region, Singapore, Asia",http://carro.sg,$100M to $500M,760558453,USD,760558453,,13,Celestial Sage International,"Aldama Investments, Celestial Sage International, Simon James Moran",3,,"167,877"
Series E - Globality,https://www.crunchbase.com/funding_round/globality-inc-series-e--6c5fb9eb,Globality,https://www.crunchbase.com/organization/globality-inc,Series E,138300000,USD,138300000,2021-01-21,Late Stage Venture,,,,Yes,Globality revolutionizes how businesses buy and sell services by matching the best provider at the right price for every project.,"Artificial Intelligence (AI), Enterprise Applications, SaaS, Sales Enablement",,"Palo Alto, California, United States, North America",http://www.globality.com/,$1M to $10M,310550000,USD,310550000,Late Stage Venture,5,"Sienna Capital, SoftBank Vision Fund","Al Gore, Debra Polishook, Dennis Nally, John R. Joyce, Ken Goldman, Mark Vorsatz, Scott Belsky, Sienna Capital, SoftBank Vision Fund",9,1,"367,248"
